    1  09:41:52.237330 IP usertekiiphone.mdns > 224.0.0.251.mdns: 0 [2q] SRV (QM)? HP Color LaserJet M651 [3F3C6F]._ipp._tcp.local. TXT (QM)? HP Color LaserJet M651 [3F3C6F]._ipp._tcp.local. (71)
    2  09:41:52.237339 IP6 nslabs-macbook-pro.local.mdns > ff02::fb.mdns: 0 [2q] SRV (QM)? HP Color LaserJet M651 [3F3C6F]._ipp._tcp.local. TXT (QM)? HP Color LaserJet M651 [3F3C6F]._ipp._tcp.local. (71)
    3  09:41:55.373716 IP 192.168.0.157.59248 > 80.14.211.130.bc.googleusercontent.com.https: Flags [P.], seq 1095511238:1095511296, ack 1378040281, win 4227, options [nop,nop,TS val 3744836987 ecr 2241121853], length 58
    4  09:41:55.375461 IP 192.168.0.157.59248 > 80.14.211.130.bc.googleusercontent.com.https: Flags [.], seq 58:1458, ack 1, win 4227, options [nop,nop,TS val 3744836988 ecr 2241121853], length 1400
    5  09:41:55.375602 IP 192.168.0.157.59248 > 80.14.211.130.bc.googleusercontent.com.https: Flags [P.], seq 1458:2013, ack 1, win 4227, options [nop,nop,TS val 3744836988 ecr 2241121853], length 555
    6  09:41:55.387584 IP 80.14.211.130.bc.googleusercontent.com.https > 192.168.0.157.59248: Flags [.], ack 1458, win 1193, options [nop,nop,TS val 2241131647 ecr 3744836988], length 0
    7  09:41:55.387875 IP 80.14.211.130.bc.googleusercontent.com.https > 192.168.0.157.59248: Flags [.], ack 58, win 1195, options [nop,nop,TS val 2241131647 ecr 3744836987], length 0
    8  09:41:55.387876 IP 80.14.211.130.bc.googleusercontent.com.https > 192.168.0.157.59248: Flags [.], ack 2013, win 1191, options [nop,nop,TS val 2241131647 ecr 3744836988], length 0
    9  09:41:55.617171 IP 80.14.211.130.bc.googleusercontent.com.https > 192.168.0.157.59248: Flags [P.], seq 1:63, ack 2013, win 1195, options [nop,nop,TS val 2241131815 ecr 3744836988], length 62
   10  09:41:55.617175 IP 80.14.211.130.bc.googleusercontent.com.https > 192.168.0.157.59248: Flags [P.], seq 63:1463, ack 2013, win 1195, options [nop,nop,TS val 2241131815 ecr 3744836988], length 1400
   11  09:41:55.617178 IP 80.14.211.130.bc.googleusercontent.com.https > 192.168.0.157.59248: Flags [P.], seq 1463:2431, ack 2013, win 1195, options [nop,nop,TS val 2241131816 ecr 3744836988], length 968
   12  09:41:55.617179 IP 80.14.211.130.bc.googleusercontent.com.https > 192.168.0.157.59248: Flags [P.], seq 2431:2470, ack 2013, win 1195, options [nop,nop,TS val 2241131816 ecr 3744836988], length 39
   13  09:41:55.619199 IP 192.168.0.157.59248 > 80.14.211.130.bc.googleusercontent.com.https: Flags [.], ack 2470, win 4150, options [nop,nop,TS val 3744837229 ecr 2241131816], length 0
   14  09:41:55.620255 IP 192.168.0.157.59248 > 80.14.211.130.bc.googleusercontent.com.https: Flags [P.], seq 2013:2052, ack 2470, win 4227, options [nop,nop,TS val 3744837230 ecr 2241131816], length 39
   15  09:41:55.627681 IP 80.14.211.130.bc.googleusercontent.com.https > 192.168.0.157.59248: Flags [.], ack 2052, win 1195, options [nop,nop,TS val 2241131888 ecr 3744837230], length 0
   16  09:41:57.153312 IP 192.168.0.161.mdns > 224.0.0.251.mdns: 6 [2q] PTR (QM)? _%9E5E7C8F47989526C9BCD95D24084F6F0B27C5ED._sub._googlecast._tcp.local. PTR (QM)? _googlecast._tcp.local. (94)
   17  09:41:57.153319 IP 192.168.0.196.mdns > 224.0.0.251.mdns: 0*- [0q] 1/0/3 PTR Chromecast-da1af5076d1ad7b42db4fc73a6664155._googlecast._tcp.local. (413)
   18  09:41:57.153322 IP 192.168.0.196.mdns > 224.0.0.251.mdns: 0*- [0q] 1/0/3 PTR Chromecast-da1af5076d1ad7b42db4fc73a6664155._googlecast._tcp.local. (365)
   19  09:42:01.145353 IP 192.168.0.185.netbios-ns > 192.168.0.255.netbios-ns: UDP, length 50
   20  09:42:01.161044 IP 169.254.107.160.mdns > 224.0.0.251.mdns: 0 [1a] [2q] PTR (QM)? _companion-link._tcp.local. PTR (QM)? _homekit._tcp.local. (95)
   21  09:42:01.161131 IP6 fe80::182e:78db:6db7:a9d6.mdns > ff02::fb.mdns: 0 [1a] [2q] PTR (QM)? _companion-link._tcp.local. PTR (QM)? _homekit._tcp.local. (95)
   22  09:42:01.477192 IP 169.254.189.183.mdns > 224.0.0.251.mdns: 0 [1a] [18q] PTR (QM)? _airport._tcp.local. PTR (QM)? _uscan._tcp.local. PTR (QM)? _ippusb._tcp.local. PTR (QM)? _uscans._tcp.local. PTR (QM)? _scanner._tcp.local. PTR (QM)? _ipp._tcp.local. PTR (QM)? _ipps._tcp.local. PTR (QM)? _printer._tcp.local. PTR (QM)? _pdl-datastream._tcp.local. PTR (QM)? _ptp._tcp.local. PTR (QM)? _rdlink._tcp.local. PTR (QM)? _afpovertcp._tcp.local. PTR (QM)? _smb._tcp.local. PTR (QM)? _rfb._tcp.local. PTR (QM)? _adisk._tcp.local. PTR (QM)? _apple-mobdev._tcp.local. PTR (QM)? 8c9607c9._sub._apple-mobdev2._tcp.local. PTR (QM)? _apple-pairable._tcp.local. (338)
   23  09:42:01.477203 IP6 fe80::1841:c2be:7912:ba1d.mdns > ff02::fb.mdns: 0 [1a] [18q] PTR (QM)? _airport._tcp.local. PTR (QM)? _uscan._tcp.local. PTR (QM)? _ippusb._tcp.local. PTR (QM)? _uscans._tcp.local. PTR (QM)? _scanner._tcp.local. PTR (QM)? _ipp._tcp.local. PTR (QM)? _ipps._tcp.local. PTR (QM)? _printer._tcp.local. PTR (QM)? _pdl-datastream._tcp.local. PTR (QM)? _ptp._tcp.local. PTR (QM)? _rdlink._tcp.local. PTR (QM)? _afpovertcp._tcp.local. PTR (QM)? _smb._tcp.local. PTR (QM)? _rfb._tcp.local. PTR (QM)? _adisk._tcp.local. PTR (QM)? _apple-mobdev._tcp.local. PTR (QM)? 8c9607c9._sub._apple-mobdev2._tcp.local. PTR (QM)? _apple-pairable._tcp.local. (338)
   24  09:42:01.556515 IP usertekiiphone.mdns > 224.0.0.251.mdns: 0 [7q] PTR (QM)? _afpovertcp._tcp.local. PTR (QM)? _smb._tcp.local. PTR (QM)? _rfb._tcp.local. PTR (QM)? _adisk._tcp.local. PTR (QM)? _apple-mobdev._tcp.local. PTR (QM)? 8c9607c9._sub._apple-mobdev2._tcp.local. PTR (QM)? _apple-pairable._tcp.local. (152)
   25  09:42:01.556528 IP6 nslabs-macbook-pro.local.mdns > ff02::fb.mdns: 0 [7q] PTR (QM)? _afpovertcp._tcp.local. PTR (QM)? _smb._tcp.local. PTR (QM)? _rfb._tcp.local. PTR (QM)? _adisk._tcp.local. PTR (QM)? _apple-mobdev._tcp.local. PTR (QM)? 8c9607c9._sub._apple-mobdev2._tcp.local. PTR (QM)? _apple-pairable._tcp.local. (152)
   26  09:42:01.964555 IP 192.168.0.185.netbios-ns > 192.168.0.255.netbios-ns: UDP, length 50
   27  09:42:02.066928 IP usertekiiphone.netbios-ns > 192.168.0.255.netbios-ns: UDP, length 50
   28  09:42:02.067167 IP usertekiiphone.netbios-ns > 192.168.0.255.netbios-ns: UDP, length 50
   29  09:42:02.224731 IP 192.168.0.157.59248 > 80.14.211.130.bc.googleusercontent.com.https: Flags [P.], seq 2052:2110, ack 2470, win 4227, options [nop,nop,TS val 3744843833 ecr 2241131888], length 58
   30  09:42:02.226182 IP 192.168.0.157.59248 > 80.14.211.130.bc.googleusercontent.com.https: Flags [.], seq 2110:3510, ack 2470, win 4227, options [nop,nop,TS val 3744843833 ecr 2241131888], length 1400
   31  09:42:02.226322 IP 192.168.0.157.59248 > 80.14.211.130.bc.googleusercontent.com.https: Flags [P.], seq 3510:3921, ack 2470, win 4227, options [nop,nop,TS val 3744843833 ecr 2241131888], length 411
   32  09:42:02.237517 IP 80.14.211.130.bc.googleusercontent.com.https > 192.168.0.157.59248: Flags [.], ack 2110, win 1195, options [nop,nop,TS val 2241138498 ecr 3744843833], length 0
   33  09:42:02.237954 IP 80.14.211.130.bc.googleusercontent.com.https > 192.168.0.157.59248: Flags [.], ack 3510, win 1193, options [nop,nop,TS val 2241138498 ecr 3744843833], length 0
   34  09:42:02.237955 IP 80.14.211.130.bc.googleusercontent.com.https > 192.168.0.157.59248: Flags [.], ack 3921, win 1192, options [nop,nop,TS val 2241138498 ecr 3744843833], length 0
   35  09:42:02.409878 IP 80.14.211.130.bc.googleusercontent.com.https > 192.168.0.157.59248: Flags [P.], seq 2470:2532, ack 3921, win 1195, options [nop,nop,TS val 2241138670 ecr 3744843833], length 62
   36  09:42:02.409881 IP 80.14.211.130.bc.googleusercontent.com.https > 192.168.0.157.59248: Flags [P.], seq 2532:3932, ack 3921, win 1195, options [nop,nop,TS val 2241138670 ecr 3744843833], length 1400
   37  09:42:02.410152 IP 80.14.211.130.bc.googleusercontent.com.https > 192.168.0.157.59248: Flags [.], seq 3932:5332, ack 3921, win 1195, options [nop,nop,TS val 2241138670 ecr 3744843833], length 1400
   38  09:42:02.410155 IP 80.14.211.130.bc.googleusercontent.com.https > 192.168.0.157.59248: Flags [P.], seq 5332:6625, ack 3921, win 1195, options [nop,nop,TS val 2241138670 ecr 3744843833], length 1293
   39  09:42:02.410455 IP 192.168.0.157.59248 > 80.14.211.130.bc.googleusercontent.com.https: Flags [.], ack 3932, win 4181, options [nop,nop,TS val 3744844016 ecr 2241138670], length 0
   40  09:42:02.411415 IP 192.168.0.157.59248 > 80.14.211.130.bc.googleusercontent.com.https: Flags [.], ack 6625, win 4143, options [nop,nop,TS val 3744844017 ecr 2241138670], length 0
   41  09:42:02.412587 IP 80.14.211.130.bc.googleusercontent.com.https > 192.168.0.157.59248: Flags [P.], seq 6625:8025, ack 3921, win 1195, options [nop,nop,TS val 2241138672 ecr 3744843833], length 1400
   42  09:42:02.412590 IP 80.14.211.130.bc.googleusercontent.com.https > 192.168.0.157.59248: Flags [.], seq 8025:9425, ack 3921, win 1195, options [nop,nop,TS val 2241138672 ecr 3744843833], length 1400
   43  09:42:02.412592 IP 80.14.211.130.bc.googleusercontent.com.https > 192.168.0.157.59248: Flags [P.], seq 9425:9472, ack 3921, win 1195, options [nop,nop,TS val 2241138672 ecr 3744843833], length 47
   44  09:42:02.412883 IP 80.14.211.130.bc.googleusercontent.com.https > 192.168.0.157.59248: Flags [P.], seq 9472:9623, ack 3921, win 1195, options [nop,nop,TS val 2241138673 ecr 3744843833], length 151
   45  09:42:02.412884 IP 80.14.211.130.bc.googleusercontent.com.https > 192.168.0.157.59248: Flags [P.], seq 9623:9662, ack 3921, win 1195, options [nop,nop,TS val 2241138673 ecr 3744843833], length 39
   46  09:42:02.414399 IP 192.168.0.157.59248 > 80.14.211.130.bc.googleusercontent.com.https: Flags [.], ack 9472, win 4138, options [nop,nop,TS val 3744844019 ecr 2241138672], length 0
   47  09:42:02.414401 IP 192.168.0.157.59248 > 80.14.211.130.bc.googleusercontent.com.https: Flags [.], ack 9662, win 4132, options [nop,nop,TS val 3744844019 ecr 2241138673], length 0
   48  09:42:02.414402 IP 192.168.0.157.59248 > 80.14.211.130.bc.googleusercontent.com.https: Flags [.], ack 9662, win 4227, options [nop,nop,TS val 3744844019 ecr 2241138673], length 0
   49  09:42:02.414882 IP 192.168.0.157.59248 > 80.14.211.130.bc.googleusercontent.com.https: Flags [P.], seq 3921:3960, ack 9662, win 4227, options [nop,nop,TS val 3744844019 ecr 2241138673], length 39
   50  09:42:02.422362 IP 80.14.211.130.bc.googleusercontent.com.https > 192.168.0.157.59248: Flags [.], ack 3960, win 1195, options [nop,nop,TS val 2241138682 ecr 3744844019], length 0
   51  09:42:02.558169 IP 192.168.0.102.mdns > 224.0.0.251.mdns: 0 [4q] [1au] PTR (QU)? lb._dns-sd._udp.local. PTR (QU)? _companion-link._tcp.local. PTR (QU)? _homekit._tcp.local. PTR (QU)? _sleep-proxy._udp.local. (129)
   52  09:42:02.558178 IP6 fe80::14a7:9d4a:ce23:651f.mdns > ff02::fb.mdns: 0 [4q] [1au] PTR (QU)? lb._dns-sd._udp.local. PTR (QU)? _companion-link._tcp.local. PTR (QU)? _homekit._tcp.local. PTR (QU)? _sleep-proxy._udp.local. (129)
   53  09:42:03.050589 IP 192.168.0.102 > all-routers.mcast.net: igmp leave 224.0.0.251
   54  09:42:03.051137 IP 192.168.0.102 > 224.0.0.251: igmp v2 report 224.0.0.251
   55  09:42:03.220332 IP6 fe80::14a7:9d4a:ce23:651f > ff02::16: HBH ICMP6, multicast listener report v2, 1 group record(s), length 28
   56  09:42:03.500242 IP 192.168.0.102.mdns > 224.0.0.251.mdns: 0 [1a] [4q] [1au] PTR (QM)? lb._dns-sd._udp.local. PTR (QM)? _companion-link._tcp.local. PTR (QM)? _homekit._tcp.local. PTR (QM)? _sleep-proxy._udp.local. (165)
   57  09:42:03.500253 IP6 fe80::14a7:9d4a:ce23:651f.mdns > ff02::fb.mdns: 0 [1a] [4q] [1au] PTR (QM)? lb._dns-sd._udp.local. PTR (QM)? _companion-link._tcp.local. PTR (QM)? _homekit._tcp.local. PTR (QM)? _sleep-proxy._udp.local. (165)
   58  09:42:03.833504 IP 192.168.0.157.59248 > 80.14.211.130.bc.googleusercontent.com.https: Flags [P.], seq 3960:4018, ack 9662, win 4227, options [nop,nop,TS val 3744845436 ecr 2241138682], length 58
   59  09:42:03.834270 IP 192.168.0.157.59248 > 80.14.211.130.bc.googleusercontent.com.https: Flags [.], seq 4018:5418, ack 9662, win 4227, options [nop,nop,TS val 3744845436 ecr 2241138682], length 1400
   60  09:42:03.834403 IP 192.168.0.157.59248 > 80.14.211.130.bc.googleusercontent.com.https: Flags [P.], seq 5418:5909, ack 9662, win 4227, options [nop,nop,TS val 3744845436 ecr 2241138682], length 491
   61  09:42:03.846659 IP 80.14.211.130.bc.googleusercontent.com.https > 192.168.0.157.59248: Flags [.], ack 4018, win 1195, options [nop,nop,TS val 2241140107 ecr 3744845436], length 0
   62  09:42:03.846662 IP 80.14.211.130.bc.googleusercontent.com.https > 192.168.0.157.59248: Flags [.], ack 5418, win 1193, options [nop,nop,TS val 2241140107 ecr 3744845436], length 0
   63  09:42:03.846663 IP 80.14.211.130.bc.googleusercontent.com.https > 192.168.0.157.59248: Flags [.], ack 5909, win 1192, options [nop,nop,TS val 2241140107 ecr 3744845436], length 0
   64  09:42:04.116858 IP dlinkrouter > 239.255.255.251: igmp query v2 [gaddr 239.255.255.251]
   65  09:42:04.525774 IP 80.14.211.130.bc.googleusercontent.com.https > 192.168.0.157.59248: Flags [P.], seq 9662:9724, ack 5909, win 1195, options [nop,nop,TS val 2241140679 ecr 3744845436], length 62
   66  09:42:04.525777 IP 80.14.211.130.bc.googleusercontent.com.https > 192.168.0.157.59248: Flags [P.], seq 9724:11124, ack 5909, win 1195, options [nop,nop,TS val 2241140679 ecr 3744845436], length 1400
   67  09:42:04.526681 IP 80.14.211.130.bc.googleusercontent.com.https > 192.168.0.157.59248: Flags [.], seq 11124:12524, ack 5909, win 1195, options [nop,nop,TS val 2241140679 ecr 3744845436], length 1400
   68  09:42:04.526686 IP 80.14.211.130.bc.googleusercontent.com.https > 192.168.0.157.59248: Flags [P.], seq 12524:13924, ack 5909, win 1195, options [nop,nop,TS val 2241140679 ecr 3744845436], length 1400
   69  09:42:04.526688 IP 80.14.211.130.bc.googleusercontent.com.https > 192.168.0.157.59248: Flags [P.], seq 13924:13976, ack 5909, win 1195, options [nop,nop,TS val 2241140679 ecr 3744845436], length 52
   70  09:42:04.526689 IP 80.14.211.130.bc.googleusercontent.com.https > 192.168.0.157.59248: Flags [P.], seq 13976:15376, ack 5909, win 1195, options [nop,nop,TS val 2241140679 ecr 3744845436], length 1400
   71  09:42:04.526691 IP 80.14.211.130.bc.googleusercontent.com.https > 192.168.0.157.59248: Flags [.], seq 15376:16776, ack 5909, win 1195, options [nop,nop,TS val 2241140679 ecr 3744845436], length 1400
   72  09:42:04.526693 IP 80.14.211.130.bc.googleusercontent.com.https > 192.168.0.157.59248: Flags [P.], seq 16776:18176, ack 5909, win 1195, options [nop,nop,TS val 2241140679 ecr 3744845436], length 1400
   73  09:42:04.526696 IP 80.14.211.130.bc.googleusercontent.com.https > 192.168.0.157.59248: Flags [P.], seq 18176:18304, ack 5909, win 1195, options [nop,nop,TS val 2241140680 ecr 3744845436], length 128
   74  09:42:04.526697 IP 80.14.211.130.bc.googleusercontent.com.https > 192.168.0.157.59248: Flags [P.], seq 18304:19704, ack 5909, win 1195, options [nop,nop,TS val 2241140680 ecr 3744845436], length 1400
   75  09:42:04.526698 IP 80.14.211.130.bc.googleusercontent.com.https > 192.168.0.157.59248: Flags [P.], seq 19704:21104, ack 5909, win 1195, options [nop,nop,TS val 2241140681 ecr 3744845436], length 1400
   76  09:42:04.526700 IP 80.14.211.130.bc.googleusercontent.com.https > 192.168.0.157.59248: Flags [.], seq 21104:22504, ack 5909, win 1195, options [nop,nop,TS val 2241140681 ecr 3744845436], length 1400
   77  09:42:04.526702 IP 80.14.211.130.bc.googleusercontent.com.https > 192.168.0.157.59248: Flags [P.], seq 22504:22556, ack 5909, win 1195, options [nop,nop,TS val 2241140681 ecr 3744845436], length 52
   78  09:42:04.526703 IP 80.14.211.130.bc.googleusercontent.com.https > 192.168.0.157.59248: Flags [P.], seq 22556:23956, ack 5909, win 1195, options [nop,nop,TS val 2241140681 ecr 3744845436], length 1400
   79  09:42:04.526705 IP 80.14.211.130.bc.googleusercontent.com.https > 192.168.0.157.59248: Flags [P.], seq 23956:24577, ack 5909, win 1195, options [nop,nop,TS val 2241140681 ecr 3744845436], length 621
   80  09:42:04.526707 IP 80.14.211.130.bc.googleusercontent.com.https > 192.168.0.157.59248: Flags [P.], seq 24577:25977, ack 5909, win 1195, options [nop,nop,TS val 2241140683 ecr 3744845436], length 1400
   81  09:42:04.526708 IP 80.14.211.130.bc.googleusercontent.com.https > 192.168.0.157.59248: Flags [.], seq 25977:27377, ack 5909, win 1195, options [nop,nop,TS val 2241140683 ecr 3744845436], length 1400
   82  09:42:04.526710 IP 80.14.211.130.bc.googleusercontent.com.https > 192.168.0.157.59248: Flags [P.], seq 27377:28777, ack 5909, win 1195, options [nop,nop,TS val 2241140683 ecr 3744845436], length 1400
   83  09:42:04.526713 IP 80.14.211.130.bc.googleusercontent.com.https > 192.168.0.157.59248: Flags [P.], seq 28777:28897, ack 5909, win 1195, options [nop,nop,TS val 2241140684 ecr 3744845436], length 120
   84  09:42:04.526714 IP 80.14.211.130.bc.googleusercontent.com.https > 192.168.0.157.59248: Flags [P.], seq 28897:30297, ack 5909, win 1195, options [nop,nop,TS val 2241140684 ecr 3744845436], length 1400
   85  09:42:04.526716 IP 80.14.211.130.bc.googleusercontent.com.https > 192.168.0.157.59248: Flags [P.], seq 30297:31697, ack 5909, win 1195, options [nop,nop,TS val 2241140684 ecr 3744845436], length 1400
   86  09:42:04.526718 IP 80.14.211.130.bc.googleusercontent.com.https > 192.168.0.157.59248: Flags [P.], seq 31697:33071, ack 5909, win 1195, options [nop,nop,TS val 2241140684 ecr 3744845436], length 1374
   87  09:42:04.527125 IP 80.14.211.130.bc.googleusercontent.com.https > 192.168.0.157.59248: Flags [P.], seq 33071:34471, ack 5909, win 1195, options [nop,nop,TS val 2241140686 ecr 3744845436], length 1400
   88  09:42:04.527128 IP 80.14.211.130.bc.googleusercontent.com.https > 192.168.0.157.59248: Flags [.], seq 34471:35871, ack 5909, win 1195, options [nop,nop,TS val 2241140686 ecr 3744845436], length 1400
   89  09:42:04.527130 IP 80.14.211.130.bc.googleusercontent.com.https > 192.168.0.157.59248: Flags [P.], seq 35871:37271, ack 5909, win 1195, options [nop,nop,TS val 2241140686 ecr 3744845436], length 1400
   90  09:42:04.527132 IP 80.14.211.130.bc.googleusercontent.com.https > 192.168.0.157.59248: Flags [.], seq 37271:38671, ack 5909, win 1195, options [nop,nop,TS val 2241140686 ecr 3744845436], length 1400
   91  09:42:04.527135 IP 80.14.211.130.bc.googleusercontent.com.https > 192.168.0.157.59248: Flags [P.], seq 38671:38787, ack 5909, win 1195, options [nop,nop,TS val 2241140686 ecr 3744845436], length 116
   92  09:42:04.527136 IP 80.14.211.130.bc.googleusercontent.com.https > 192.168.0.157.59248: Flags [P.], seq 38787:39749, ack 5909, win 1195, options [nop,nop,TS val 2241140687 ecr 3744845436], length 962
   93  09:42:04.527137 IP 80.14.211.130.bc.googleusercontent.com.https > 192.168.0.157.59248: Flags [P.], seq 39749:39788, ack 5909, win 1195, options [nop,nop,TS val 2241140687 ecr 3744845436], length 39
   94  09:42:04.527138 IP 80.14.211.130.bc.googleusercontent.com.https > 192.168.0.157.59248: Flags [P.], seq 39749:39788, ack 5909, win 1195, options [nop,nop,TS val 2241140756 ecr 3744845436], length 39
   95  09:42:04.534025 IP 192.168.0.157.59248 > 80.14.211.130.bc.googleusercontent.com.https: Flags [.], ack 11124, win 4181, options [nop,nop,TS val 3744846134 ecr 2241140679], length 0
   96  09:42:04.534027 IP 192.168.0.157.59248 > 80.14.211.130.bc.googleusercontent.com.https: Flags [.], ack 27377, win 3673, options [nop,nop,TS val 3744846134 ecr 2241140683], length 0
   97  09:42:04.534028 IP 192.168.0.157.59248 > 80.14.211.130.bc.googleusercontent.com.https: Flags [.], ack 33071, win 3495, options [nop,nop,TS val 3744846134 ecr 2241140684], length 0
   98  09:42:04.534030 IP 192.168.0.157.59248 > 80.14.211.130.bc.googleusercontent.com.https: Flags [.], ack 39788, win 3285, options [nop,nop,TS val 3744846134 ecr 2241140687], length 0
   99  09:42:04.534031 IP 192.168.0.157.59248 > 80.14.211.130.bc.googleusercontent.com.https: Flags [.], ack 39788, win 3285, options [nop,nop,TS val 3744846134 ecr 2241140756,nop,nop,sack 1 {39749:39788}], length 0
  100  09:42:04.534032 IP 192.168.0.157.59248 > 80.14.211.130.bc.googleusercontent.com.https: Flags [.], ack 39788, win 4227, options [nop,nop,TS val 3744846134 ecr 2241140756], length 0
  101  09:42:04.538370 IP 192.168.0.157.59248 > 80.14.211.130.bc.googleusercontent.com.https: Flags [P.], seq 5909:5948, ack 39788, win 4227, options [nop,nop,TS val 3744846138 ecr 2241140756], length 39
  102  09:42:04.546409 IP 80.14.211.130.bc.googleusercontent.com.https > 192.168.0.157.59248: Flags [.], ack 5948, win 1195, options [nop,nop,TS val 2241140806 ecr 3744846138], length 0
  103  09:42:04.710150 IP 169.254.189.183.mdns > 224.0.0.251.mdns: 0 [2q] SRV (QU)? ncm._remoted._tcp.local. TXT (QU)? ncm._remoted._tcp.local. (47)
  104  09:42:04.710255 IP6 fe80::1841:c2be:7912:ba1d.mdns > ff02::fb.mdns: 0 [2q] SRV (QU)? ncm._remoted._tcp.local. TXT (QU)? ncm._remoted._tcp.local. (47)
  105  09:42:05.643864 IP 192.168.0.157.59248 > 80.14.211.130.bc.googleusercontent.com.https: Flags [P.], seq 5948:6006, ack 39788, win 4227, options [nop,nop,TS val 3744847243 ecr 2241140806], length 58
  106  09:42:05.644224 IP 192.168.0.157.59248 > 80.14.211.130.bc.googleusercontent.com.https: Flags [P.], seq 6006:7385, ack 39788, win 4227, options [nop,nop,TS val 3744847243 ecr 2241140806], length 1379
  107  09:42:05.655831 IP 80.14.211.130.bc.googleusercontent.com.https > 192.168.0.157.59248: Flags [.], ack 6006, win 1195, options [nop,nop,TS val 2241141916 ecr 3744847243], length 0
  108  09:42:05.655832 IP 80.14.211.130.bc.googleusercontent.com.https > 192.168.0.157.59248: Flags [.], ack 7385, win 1193, options [nop,nop,TS val 2241141916 ecr 3744847243], length 0
  109  09:42:05.712032 IP 169.254.189.183.mdns > 224.0.0.251.mdns: 0 [2q] SRV (QM)? ncm._remoted._tcp.local. TXT (QM)? ncm._remoted._tcp.local. (47)
  110  09:42:05.712036 IP6 fe80::1841:c2be:7912:ba1d.mdns > ff02::fb.mdns: 0 [2q] SRV (QM)? ncm._remoted._tcp.local. TXT (QM)? ncm._remoted._tcp.local. (47)
  111  09:42:05.858407 IP 80.14.211.130.bc.googleusercontent.com.https > 192.168.0.157.59248: Flags [P.], seq 39788:39850, ack 7385, win 1195, options [nop,nop,TS val 2241142078 ecr 3744847243], length 62
  112  09:42:05.858409 IP 80.14.211.130.bc.googleusercontent.com.https > 192.168.0.157.59248: Flags [P.], seq 39850:40402, ack 7385, win 1195, options [nop,nop,TS val 2241142078 ecr 3744847243], length 552
  113  09:42:05.858409 IP 80.14.211.130.bc.googleusercontent.com.https > 192.168.0.157.59248: Flags [P.], seq 40402:40477, ack 7385, win 1195, options [nop,nop,TS val 2241142078 ecr 3744847243], length 75
  114  09:42:05.858410 IP 80.14.211.130.bc.googleusercontent.com.https > 192.168.0.157.59248: Flags [P.], seq 40477:40516, ack 7385, win 1195, options [nop,nop,TS val 2241142078 ecr 3744847243], length 39
  115  09:42:05.858755 IP 192.168.0.157.59248 > 80.14.211.130.bc.googleusercontent.com.https: Flags [.], ack 40516, win 4204, options [nop,nop,TS val 3744847457 ecr 2241142078], length 0
  116  09:42:05.859173 IP 192.168.0.157.59248 > 80.14.211.130.bc.googleusercontent.com.https: Flags [P.], seq 7385:7424, ack 40516, win 4227, options [nop,nop,TS val 3744847457 ecr 2241142078], length 39
  117  09:42:05.867261 IP 80.14.211.130.bc.googleusercontent.com.https > 192.168.0.157.59248: Flags [.], ack 7424, win 1195, options [nop,nop,TS val 2241142127 ecr 3744847457], length 0
  118  09:42:06.266708 IP6 fe80::14a7:9d4a:ce23:651f > ff02::16: HBH ICMP6, multicast listener report v2, 1 group record(s), length 28
  119  09:42:06.678156 IP 192.168.0.102.mdns > 224.0.0.251.mdns: 0 [1a] [4q] [1au] PTR (QM)? lb._dns-sd._udp.local. PTR (QM)? _companion-link._tcp.local. PTR (QM)? _homekit._tcp.local. PTR (QM)? _sleep-proxy._udp.local. (165)
  120  09:42:06.678164 IP6 fe80::14a7:9d4a:ce23:651f.mdns > ff02::fb.mdns: 0 [1a] [4q] [1au] PTR (QM)? lb._dns-sd._udp.local. PTR (QM)? _companion-link._tcp.local. PTR (QM)? _homekit._tcp.local. PTR (QM)? _sleep-proxy._udp.local. (165)
  121  09:42:08.314630 IP 192.168.0.196 > 239.255.255.251: igmp v2 report 239.255.255.251
  122  09:42:08.721783 IP 169.254.189.183.mdns > 224.0.0.251.mdns: 0 [2q] SRV (QM)? ncm._remoted._tcp.local. TXT (QM)? ncm._remoted._tcp.local. (47)
  123  09:42:08.721886 IP6 fe80::1841:c2be:7912:ba1d.mdns > ff02::fb.mdns: 0 [2q] SRV (QM)? ncm._remoted._tcp.local. TXT (QM)? ncm._remoted._tcp.local. (47)
  124  09:42:12.239734 IP 192.168.0.157.59248 > 80.14.211.130.bc.googleusercontent.com.https: Flags [P.], seq 7424:7482, ack 40516, win 4227, options [nop,nop,TS val 3744853837 ecr 2241142127], length 58
  125  09:42:12.241934 IP 192.168.0.157.59248 > 80.14.211.130.bc.googleusercontent.com.https: Flags [.], seq 7482:8882, ack 40516, win 4227, options [nop,nop,TS val 3744853839 ecr 2241142127], length 1400
  126  09:42:12.241936 IP 192.168.0.157.59248 > 80.14.211.130.bc.googleusercontent.com.https: Flags [P.], seq 8882:9357, ack 40516, win 4227, options [nop,nop,TS val 3744853839 ecr 2241142127], length 475
  127  09:42:12.254380 IP 80.14.211.130.bc.googleusercontent.com.https > 192.168.0.157.59248: Flags [.], ack 7482, win 1195, options [nop,nop,TS val 2241148513 ecr 3744853837], length 0
  128  09:42:12.254657 IP 80.14.211.130.bc.googleusercontent.com.https > 192.168.0.157.59248: Flags [.], ack 9357, win 1192, options [nop,nop,TS val 2241148513 ecr 3744853839], length 0
  129  09:42:12.255026 IP 80.14.211.130.bc.googleusercontent.com.https > 192.168.0.157.59248: Flags [.], ack 8882, win 1193, options [nop,nop,TS val 2241148513 ecr 3744853839], length 0
  130  09:42:12.615469 IP 80.14.211.130.bc.googleusercontent.com.https > 192.168.0.157.59248: Flags [P.], seq 40516:40578, ack 9357, win 1195, options [nop,nop,TS val 2241148761 ecr 3744853839], length 62
  131  09:42:12.615472 IP 80.14.211.130.bc.googleusercontent.com.https > 192.168.0.157.59248: Flags [P.], seq 40578:41978, ack 9357, win 1195, options [nop,nop,TS val 2241148761 ecr 3744853839], length 1400
  132  09:42:12.615474 IP 80.14.211.130.bc.googleusercontent.com.https > 192.168.0.157.59248: Flags [.], seq 41978:43378, ack 9357, win 1195, options [nop,nop,TS val 2241148761 ecr 3744853839], length 1400
  133  09:42:12.615477 IP 80.14.211.130.bc.googleusercontent.com.https > 192.168.0.157.59248: Flags [P.], seq 43378:44579, ack 9357, win 1195, options [nop,nop,TS val 2241148761 ecr 3744853839], length 1201
  134  09:42:12.615480 IP 80.14.211.130.bc.googleusercontent.com.https > 192.168.0.157.59248: Flags [P.], seq 44579:45979, ack 9357, win 1195, options [nop,nop,TS val 2241148762 ecr 3744853839], length 1400
  135  09:42:12.615481 IP 80.14.211.130.bc.googleusercontent.com.https > 192.168.0.157.59248: Flags [P.], seq 45979:47249, ack 9357, win 1195, options [nop,nop,TS val 2241148762 ecr 3744853839], length 1270
  136  09:42:12.615484 IP 80.14.211.130.bc.googleusercontent.com.https > 192.168.0.157.59248: Flags [P.], seq 47249:47288, ack 9357, win 1195, options [nop,nop,TS val 2241148762 ecr 3744853839], length 39
  137  09:42:12.620723 IP 192.168.0.157.59248 > 80.14.211.130.bc.googleusercontent.com.https: Flags [.], ack 47288, win 4015, options [nop,nop,TS val 3744854215 ecr 2241148762], length 0
  138  09:42:12.620725 IP 192.168.0.157.59248 > 80.14.211.130.bc.googleusercontent.com.https: Flags [.], ack 47288, win 4227, options [nop,nop,TS val 3744854215 ecr 2241148762], length 0
  139  09:42:12.622456 IP 192.168.0.157.59248 > 80.14.211.130.bc.googleusercontent.com.https: Flags [P.], seq 9357:9396, ack 47288, win 4227, options [nop,nop,TS val 3744854217 ecr 2241148762], length 39
  140  09:42:12.630150 IP 80.14.211.130.bc.googleusercontent.com.https > 192.168.0.157.59248: Flags [.], ack 9396, win 1195, options [nop,nop,TS val 2241148890 ecr 3744854217], length 0
  141  09:42:12.846752 IP 192.168.0.157.59248 > 80.14.211.130.bc.googleusercontent.com.https: Flags [P.], seq 9396:9454, ack 47288, win 4227, options [nop,nop,TS val 3744854439 ecr 2241148890], length 58
  142  09:42:12.856344 IP 80.14.211.130.bc.googleusercontent.com.https > 192.168.0.157.59248: Flags [.], ack 9454, win 1195, options [nop,nop,TS val 2241149117 ecr 3744854439], length 0
  143  09:42:12.860679 IP 192.168.0.157.59248 > 80.14.211.130.bc.googleusercontent.com.https: Flags [.], seq 9454:10854, ack 47288, win 4227, options [nop,nop,TS val 3744854452 ecr 2241148890], length 1400
  144  09:42:12.860682 IP 192.168.0.157.59248 > 80.14.211.130.bc.googleusercontent.com.https: Flags [P.], seq 10854:10969, ack 47288, win 4227, options [nop,nop,TS val 3744854452 ecr 2241148890], length 115
  145  09:42:12.868927 IP 80.14.211.130.bc.googleusercontent.com.https > 192.168.0.157.59248: Flags [.], ack 10854, win 1193, options [nop,nop,TS val 2241149129 ecr 3744854452], length 0
  146  09:42:12.868930 IP 80.14.211.130.bc.googleusercontent.com.https > 192.168.0.157.59248: Flags [.], ack 10969, win 1193, options [nop,nop,TS val 2241149129 ecr 3744854452], length 0
  147  09:42:12.961783 IP 192.168.0.157.59248 > 80.14.211.130.bc.googleusercontent.com.https: Flags [P.], seq 10969:11027, ack 47288, win 4227, options [nop,nop,TS val 3744854551 ecr 2241149129], length 58
  148  09:42:12.962370 IP 192.168.0.157.59248 > 80.14.211.130.bc.googleusercontent.com.https: Flags [P.], seq 11027:12302, ack 47288, win 4227, options [nop,nop,TS val 3744854551 ecr 2241149129], length 1275
  149  09:42:12.974722 IP 80.14.211.130.bc.googleusercontent.com.https > 192.168.0.157.59248: Flags [.], ack 11027, win 1195, options [nop,nop,TS val 2241149235 ecr 3744854551], length 0
  150  09:42:12.974725 IP 80.14.211.130.bc.googleusercontent.com.https > 192.168.0.157.59248: Flags [.], ack 12302, win 1193, options [nop,nop,TS val 2241149235 ecr 3744854551], length 0
  151  09:42:13.030836 IP 80.14.211.130.bc.googleusercontent.com.https > 192.168.0.157.59248: Flags [P.], seq 47288:47350, ack 12302, win 1195, options [nop,nop,TS val 2241149291 ecr 3744854551], length 62
  152  09:42:13.030839 IP 80.14.211.130.bc.googleusercontent.com.https > 192.168.0.157.59248: Flags [P.], seq 47350:48750, ack 12302, win 1195, options [nop,nop,TS val 2241149291 ecr 3744854551], length 1400
  153  09:42:13.031138 IP 80.14.211.130.bc.googleusercontent.com.https > 192.168.0.157.59248: Flags [.], seq 48750:50150, ack 12302, win 1195, options [nop,nop,TS val 2241149291 ecr 3744854551], length 1400
  154  09:42:13.031140 IP 80.14.211.130.bc.googleusercontent.com.https > 192.168.0.157.59248: Flags [P.], seq 50150:50719, ack 12302, win 1195, options [nop,nop,TS val 2241149291 ecr 3744854551], length 569
  155  09:42:13.031141 IP 80.14.211.130.bc.googleusercontent.com.https > 192.168.0.157.59248: Flags [P.], seq 50719:50758, ack 12302, win 1195, options [nop,nop,TS val 2241149291 ecr 3744854551], length 39
  156  09:42:13.034379 IP 192.168.0.157.59248 > 80.14.211.130.bc.googleusercontent.com.https: Flags [.], ack 48750, win 4181, options [nop,nop,TS val 3744854621 ecr 2241149291], length 0
  157  09:42:13.034381 IP 192.168.0.157.59248 > 80.14.211.130.bc.googleusercontent.com.https: Flags [.], ack 50758, win 4118, options [nop,nop,TS val 3744854621 ecr 2241149291], length 0
  158  09:42:13.034382 IP 192.168.0.157.59248 > 80.14.211.130.bc.googleusercontent.com.https: Flags [.], ack 50758, win 4227, options [nop,nop,TS val 3744854621 ecr 2241149291], length 0
  159  09:42:13.036683 IP 192.168.0.157.59248 > 80.14.211.130.bc.googleusercontent.com.https: Flags [P.], seq 12302:12341, ack 50758, win 4227, options [nop,nop,TS val 3744854625 ecr 2241149291], length 39
  160  09:42:13.044707 IP 80.14.211.130.bc.googleusercontent.com.https > 192.168.0.157.59248: Flags [.], ack 12341, win 1195, options [nop,nop,TS val 2241149305 ecr 3744854625], length 0
  161  09:42:13.227186 IP 80.14.211.130.bc.googleusercontent.com.https > 192.168.0.157.59248: Flags [P.], seq 50758:50820, ack 12341, win 1195, options [nop,nop,TS val 2241149432 ecr 3744854625], length 62
  162  09:42:13.227188 IP 80.14.211.130.bc.googleusercontent.com.https > 192.168.0.157.59248: Flags [P.], seq 50820:51566, ack 12341, win 1195, options [nop,nop,TS val 2241149432 ecr 3744854625], length 746
  163  09:42:13.227189 IP 80.14.211.130.bc.googleusercontent.com.https > 192.168.0.157.59248: Flags [P.], seq 51566:51692, ack 12341, win 1195, options [nop,nop,TS val 2241149432 ecr 3744854625], length 126
  164  09:42:13.227190 IP 80.14.211.130.bc.googleusercontent.com.https > 192.168.0.157.59248: Flags [P.], seq 51692:51731, ack 12341, win 1195, options [nop,nop,TS val 2241149432 ecr 3744854625], length 39
  165  09:42:13.227846 IP 192.168.0.157.59248 > 80.14.211.130.bc.googleusercontent.com.https: Flags [.], ack 51731, win 4196, options [nop,nop,TS val 3744854815 ecr 2241149432], length 0
  166  09:42:13.228282 IP 192.168.0.157.59248 > 80.14.211.130.bc.googleusercontent.com.https: Flags [P.], seq 12341:12380, ack 51731, win 4227, options [nop,nop,TS val 3744854815 ecr 2241149432], length 39
  167  09:42:13.235882 IP 80.14.211.130.bc.googleusercontent.com.https > 192.168.0.157.59248: Flags [.], ack 12380, win 1195, options [nop,nop,TS val 2241149496 ecr 3744854815], length 0
  168  09:42:15.670234 IP 192.168.0.157.59248 > 80.14.211.130.bc.googleusercontent.com.https: Flags [P.], seq 12380:12438, ack 51731, win 4227, options [nop,nop,TS val 3744857256 ecr 2241149496], length 58
  169  09:42:15.670932 IP 192.168.0.157.59248 > 80.14.211.130.bc.googleusercontent.com.https: Flags [P.], seq 12438:13817, ack 51731, win 4227, options [nop,nop,TS val 3744857256 ecr 2241149496], length 1379
  170  09:42:15.671016 IP 192.168.0.157.59248 > 80.14.211.130.bc.googleusercontent.com.https: Flags [P.], seq 13817:13848, ack 51731, win 4227, options [nop,nop,TS val 3744857256 ecr 2241149496], length 31
  171  09:42:15.683161 IP 80.14.211.130.bc.googleusercontent.com.https > 192.168.0.157.59248: Flags [.], ack 12438, win 1195, options [nop,nop,TS val 2241151943 ecr 3744857256], length 0
  172  09:42:15.683163 IP 80.14.211.130.bc.googleusercontent.com.https > 192.168.0.157.59248: Flags [.], ack 13817, win 1193, options [nop,nop,TS val 2241151943 ecr 3744857256], length 0
  173  09:42:15.683164 IP 80.14.211.130.bc.googleusercontent.com.https > 192.168.0.157.59248: Flags [.], ack 13848, win 1193, options [nop,nop,TS val 2241151943 ecr 3744857256], length 0
  174  09:42:15.893662 IP 80.14.211.130.bc.googleusercontent.com.https > 192.168.0.157.59248: Flags [P.], seq 51731:51793, ack 13848, win 1195, options [nop,nop,TS val 2241152110 ecr 3744857256], length 62
  175  09:42:15.893665 IP 80.14.211.130.bc.googleusercontent.com.https > 192.168.0.157.59248: Flags [P.], seq 51793:52341, ack 13848, win 1195, options [nop,nop,TS val 2241152110 ecr 3744857256], length 548
  176  09:42:15.893667 IP 80.14.211.130.bc.googleusercontent.com.https > 192.168.0.157.59248: Flags [P.], seq 52341:52494, ack 13848, win 1195, options [nop,nop,TS val 2241152110 ecr 3744857256], length 153
  177  09:42:15.893669 IP 80.14.211.130.bc.googleusercontent.com.https > 192.168.0.157.59248: Flags [P.], seq 52494:52533, ack 13848, win 1195, options [nop,nop,TS val 2241152110 ecr 3744857256], length 39
  178  09:42:15.894141 IP 192.168.0.157.59248 > 80.14.211.130.bc.googleusercontent.com.https: Flags [.], ack 52533, win 4202, options [nop,nop,TS val 3744857478 ecr 2241152110], length 0
  179  09:42:15.894780 IP 192.168.0.157.59248 > 80.14.211.130.bc.googleusercontent.com.https: Flags [P.], seq 13848:13887, ack 52533, win 4227, options [nop,nop,TS val 3744857478 ecr 2241152110], length 39
  180  09:42:15.902460 IP 80.14.211.130.bc.googleusercontent.com.https > 192.168.0.157.59248: Flags [.], ack 13887, win 1195, options [nop,nop,TS val 2241152162 ecr 3744857478], length 0
  181  09:42:17.169365 IP 192.168.0.161.mdns > 224.0.0.251.mdns: 7 [2q] PTR (QM)? _%9E5E7C8F47989526C9BCD95D24084F6F0B27C5ED._sub._googlecast._tcp.local. PTR (QM)? _googlecast._tcp.local. (94)
  182  09:42:17.169372 IP 192.168.0.196.mdns > 224.0.0.251.mdns: 0*- [0q] 1/0/3 PTR Chromecast-da1af5076d1ad7b42db4fc73a6664155._googlecast._tcp.local. (413)
  183  09:42:17.169375 IP 192.168.0.196.mdns > 224.0.0.251.mdns: 0*- [0q] 1/0/3 PTR Chromecast-da1af5076d1ad7b42db4fc73a6664155._googlecast._tcp.local. (365)
  184  09:42:17.740782 IP 169.254.189.183.mdns > 224.0.0.251.mdns: 0 [2q] SRV (QM)? ncm._remoted._tcp.local. TXT (QM)? ncm._remoted._tcp.local. (47)
  185  09:42:17.740786 IP6 fe80::1841:c2be:7912:ba1d.mdns > ff02::fb.mdns: 0 [2q] SRV (QM)? ncm._remoted._tcp.local. TXT (QM)? ncm._remoted._tcp.local. (47)
  186  09:42:18.400210 IP 192.168.0.102.mdns > 224.0.0.251.mdns: 0 [4q] [1au] PTR (QU)? lb._dns-sd._udp.local. PTR (QU)? _companion-link._tcp.local. PTR (QU)? _homekit._tcp.local. PTR (QU)? _sleep-proxy._udp.local. (129)
  187  09:42:18.400223 IP6 fe80::14a7:9d4a:ce23:651f.mdns > ff02::fb.mdns: 0 [4q] [1au] PTR (QU)? lb._dns-sd._udp.local. PTR (QU)? _companion-link._tcp.local. PTR (QU)? _homekit._tcp.local. PTR (QU)? _sleep-proxy._udp.local. (129)
  188  09:42:18.582519 IP 192.168.0.102 > all-routers.mcast.net: igmp leave 224.0.0.251
  189  09:42:18.582920 IP 192.168.0.102 > 224.0.0.251: igmp v2 report 224.0.0.251
  190  09:42:19.240724 IP 169.254.189.183.mdns > 224.0.0.251.mdns: 0 [2q] SRV (QM)? HP Color LaserJet M651 [3F3C6F]._ipp._tcp.local. TXT (QM)? HP Color LaserJet M651 [3F3C6F]._ipp._tcp.local. (71)
  191  09:42:19.240827 IP6 fe80::1841:c2be:7912:ba1d.mdns > ff02::fb.mdns: 0 [2q] SRV (QM)? HP Color LaserJet M651 [3F3C6F]._ipp._tcp.local. TXT (QM)? HP Color LaserJet M651 [3F3C6F]._ipp._tcp.local. (71)
  192  09:42:19.272072 IP usertekiiphone.mdns > 224.0.0.251.mdns: 0 [2q] SRV (QM)? HP Color LaserJet M651 [3F3C6F]._ipp._tcp.local. TXT (QM)? HP Color LaserJet M651 [3F3C6F]._ipp._tcp.local. (71)
  193  09:42:19.272080 IP6 nslabs-macbook-pro.local.mdns > ff02::fb.mdns: 0 [2q] SRV (QM)? HP Color LaserJet M651 [3F3C6F]._ipp._tcp.local. TXT (QM)? HP Color LaserJet M651 [3F3C6F]._ipp._tcp.local. (71)
  194  09:42:19.374065 IP 192.168.0.102.mdns > 224.0.0.251.mdns: 0 [1a] [4q] [1au] PTR (QM)? lb._dns-sd._udp.local. PTR (QM)? _companion-link._tcp.local. PTR (QM)? _homekit._tcp.local. PTR (QM)? _sleep-proxy._udp.local. (165)
  195  09:42:19.374073 IP6 fe80::14a7:9d4a:ce23:651f.mdns > ff02::fb.mdns: 0 [1a] [4q] [1au] PTR (QM)? lb._dns-sd._udp.local. PTR (QM)? _companion-link._tcp.local. PTR (QM)? _homekit._tcp.local. PTR (QM)? _sleep-proxy._udp.local. (165)
  196  09:42:21.626833 IP 80.14.211.130.bc.googleusercontent.com.https > 192.168.0.157.51077: Flags [F.], seq 2038951402, ack 3944780110, win 276, options [nop,nop,TS val 405682654 ecr 2188394279], length 0
  197  09:42:21.627081 IP 192.168.0.157.51077 > 80.14.211.130.bc.googleusercontent.com.https: Flags [.], ack 1, win 4096, options [nop,nop,TS val 2188454002 ecr 405682654], length 0
  198  09:42:21.630819 IP 192.168.0.157.51077 > 80.14.211.130.bc.googleusercontent.com.https: Flags [F.], seq 1, ack 1, win 4096, options [nop,nop,TS val 2188454004 ecr 405682654], length 0
  199  09:42:21.639685 IP 80.14.211.130.bc.googleusercontent.com.https > 192.168.0.157.51077: Flags [.], ack 2, win 276, options [nop,nop,TS val 405682777 ecr 2188454004], length 0
  200  09:42:22.642426 IP 192.168.0.157.51078 > 80.14.211.130.bc.googleusercontent.com.https: Flags [S], seq 203594998, win 65535, options [mss 1460,nop,wscale 5,nop,nop,TS val 1456930577 ecr 0,sackOK,eol], length 0
  201  09:42:22.655119 IP 80.14.211.130.bc.googleusercontent.com.https > 192.168.0.157.51078: Flags [S.], seq 736153116, ack 203594999, win 65535, options [mss 1412,sackOK,TS val 435221654 ecr 1456930577,nop,wscale 8], length 0
  202  09:42:22.655320 IP 192.168.0.157.51078 > 80.14.211.130.bc.googleusercontent.com.https: Flags [.], ack 1, win 4112, options [nop,nop,TS val 1456930589 ecr 435221654], length 0
