    1  10:39:40.179246 IP 0.0.0.0.bootpc > broadcasthost.bootps: BOOTP/DHCP, Request from 6a:db:ca:c7:c7:6c (oui Unknown), length 300
    2  10:39:40.516470 IP nslabs-macbook-pro.local.55318 > 239.255.255.250.ssdp: UDP, length 174
    3  10:39:40.986070 IP 0.0.0.0.bootpc > broadcasthost.bootps: BOOTP/DHCP, Request from 6a:db:ca:c7:c7:6a (oui Unknown), length 300
    4  10:39:41.514828 IP usertekiiphone.57135 > 80.14.211.130.bc.googleusercontent.com.https: Flags [P.], seq 1301732307:1301732365, ack 330679728, win 4893, options [nop,nop,TS val 1494735720 ecr 139643236], length 58
    5  10:39:41.516759 IP nslabs-macbook-pro.local.55318 > 239.255.255.250.ssdp: UDP, length 174
    6  10:39:41.532525 IP usertekiiphone.57135 > 80.14.211.130.bc.googleusercontent.com.https: Flags [.], seq 58:1476, ack 1, win 4893, options [nop,nop,TS val 1494735737 ecr 139643236], length 1418
    7  10:39:41.533025 IP usertekiiphone.57135 > 80.14.211.130.bc.googleusercontent.com.https: Flags [P.], seq 1476:2106, ack 1, win 4893, options [nop,nop,TS val 1494735737 ecr 139643236], length 630
    8  10:39:41.533386 IP usertekiiphone.57135 > 80.14.211.130.bc.googleusercontent.com.https: Flags [P.], seq 2106:2261, ack 1, win 4893, options [nop,nop,TS val 1494735738 ecr 139643236], length 155
    9  10:39:41.601571 IP usertekiiphone.57135 > 80.14.211.130.bc.googleusercontent.com.https: Flags [P.], seq 843:2261, ack 1, win 4893, options [nop,nop,TS val 1494735805 ecr 139643236], length 1418
   10  10:39:41.680170 IP 80.14.211.130.bc.googleusercontent.com.https > usertekiiphone.57135: Flags [.], ack 58, win 1050, options [nop,nop,TS val 139671923 ecr 1494735720], length 0
   11  10:39:41.681535 IP 80.14.211.130.bc.googleusercontent.com.https > usertekiiphone.57135: Flags [.], ack 1476, win 1050, options [nop,nop,TS val 139671924 ecr 1494735737], length 0
   12  10:39:41.681538 IP 80.14.211.130.bc.googleusercontent.com.https > usertekiiphone.57135: Flags [.], ack 2106, win 1049, options [nop,nop,TS val 139671924 ecr 1494735737], length 0
   13  10:39:41.681540 IP 80.14.211.130.bc.googleusercontent.com.https > usertekiiphone.57135: Flags [.], ack 2261, win 1049, options [nop,nop,TS val 139671924 ecr 1494735738], length 0
   14  10:39:41.681542 IP 80.14.211.130.bc.googleusercontent.com.https > usertekiiphone.57135: Flags [.], ack 2261, win 1049, options [nop,nop,TS val 139671924 ecr 1494735805,nop,nop,sack 1 {843:2261}], length 0
   15  10:39:42.149827 IP 80.14.211.130.bc.googleusercontent.com.https > usertekiiphone.57135: Flags [P.], seq 1:63, ack 2261, win 1050, options [nop,nop,TS val 139672153 ecr 1494735805], length 62
   16  10:39:42.149831 IP 80.14.211.130.bc.googleusercontent.com.https > usertekiiphone.57135: Flags [P.], seq 63:1437, ack 2261, win 1050, options [nop,nop,TS val 139672153 ecr 1494735805], length 1374
   17  10:39:42.150295 IP 80.14.211.130.bc.googleusercontent.com.https > usertekiiphone.57135: Flags [P.], seq 1437:2855, ack 2261, win 1050, options [nop,nop,TS val 139672155 ecr 1494735805], length 1418
   18  10:39:42.150298 IP 80.14.211.130.bc.googleusercontent.com.https > usertekiiphone.57135: Flags [P.], seq 2855:4273, ack 2261, win 1050, options [nop,nop,TS val 139672155 ecr 1494735805], length 1418
   19  10:39:42.150301 IP 80.14.211.130.bc.googleusercontent.com.https > usertekiiphone.57135: Flags [.], seq 4273:5691, ack 2261, win 1050, options [nop,nop,TS val 139672156 ecr 1494735805], length 1418
   20  10:39:42.150304 IP 80.14.211.130.bc.googleusercontent.com.https > usertekiiphone.57135: Flags [P.], seq 5691:5727, ack 2261, win 1050, options [nop,nop,TS val 139672156 ecr 1494735805], length 36
   21  10:39:42.150306 IP 80.14.211.130.bc.googleusercontent.com.https > usertekiiphone.57135: Flags [P.], seq 5727:7145, ack 2261, win 1050, options [nop,nop,TS val 139672158 ecr 1494735805], length 1418
   22  10:39:42.150308 IP 80.14.211.130.bc.googleusercontent.com.https > usertekiiphone.57135: Flags [.], seq 7145:8563, ack 2261, win 1050, options [nop,nop,TS val 139672158 ecr 1494735805], length 1418
   23  10:39:42.150310 IP 80.14.211.130.bc.googleusercontent.com.https > usertekiiphone.57135: Flags [P.], seq 8563:9918, ack 2261, win 1050, options [nop,nop,TS val 139672158 ecr 1494735805], length 1355
   24  10:39:42.152189 IP 80.14.211.130.bc.googleusercontent.com.https > usertekiiphone.57135: Flags [P.], seq 9918:11336, ack 2261, win 1050, options [nop,nop,TS val 139672162 ecr 1494735805], length 1418
   25  10:39:42.152193 IP usertekiiphone.57135 > 80.14.211.130.bc.googleusercontent.com.https: Flags [.], ack 1437, win 4848, options [nop,nop,TS val 1494736354 ecr 139672153], length 0
   26  10:39:42.152196 IP 80.14.211.130.bc.googleusercontent.com.https > usertekiiphone.57135: Flags [.], seq 11336:12754, ack 2261, win 1050, options [nop,nop,TS val 139672162 ecr 1494735805], length 1418
   27  10:39:42.152199 IP usertekiiphone.57135 > 80.14.211.130.bc.googleusercontent.com.https: Flags [.], ack 9918, win 4583, options [nop,nop,TS val 1494736354 ecr 139672158], length 0
   28  10:39:42.152201 IP 80.14.211.130.bc.googleusercontent.com.https > usertekiiphone.57135: Flags [P.], seq 12754:14172, ack 2261, win 1050, options [nop,nop,TS val 139672162 ecr 1494735805], length 1418
   29  10:39:42.152206 IP usertekiiphone.57135 > 80.14.211.130.bc.googleusercontent.com.https: Flags [.], ack 9918, win 4893, options [nop,nop,TS val 1494736354 ecr 139672158], length 0
   30  10:39:42.152208 IP 80.14.211.130.bc.googleusercontent.com.https > usertekiiphone.57135: Flags [P.], seq 14172:14849, ack 2261, win 1050, options [nop,nop,TS val 139672162 ecr 1494735805], length 677
   31  10:39:42.152211 IP 80.14.211.130.bc.googleusercontent.com.https > usertekiiphone.57135: Flags [P.], seq 14849:16267, ack 2261, win 1050, options [nop,nop,TS val 139672167 ecr 1494735805], length 1418
   32  10:39:42.152215 IP 80.14.211.130.bc.googleusercontent.com.https > usertekiiphone.57135: Flags [.], seq 16267:17685, ack 2261, win 1050, options [nop,nop,TS val 139672167 ecr 1494735805], length 1418
   33  10:39:42.152218 IP 80.14.211.130.bc.googleusercontent.com.https > usertekiiphone.57135: Flags [P.], seq 17685:19103, ack 2261, win 1050, options [nop,nop,TS val 139672167 ecr 1494735805], length 1418
   34  10:39:42.152222 IP 80.14.211.130.bc.googleusercontent.com.https > usertekiiphone.57135: Flags [.], seq 19103:20521, ack 2261, win 1050, options [nop,nop,TS val 139672167 ecr 1494735805], length 1418
   35  10:39:42.152224 IP 80.14.211.130.bc.googleusercontent.com.https > usertekiiphone.57135: Flags [P.], seq 20521:20900, ack 2261, win 1050, options [nop,nop,TS val 139672167 ecr 1494735805], length 379
   36  10:39:42.152226 IP 80.14.211.130.bc.googleusercontent.com.https > usertekiiphone.57135: Flags [P.], seq 20900:22318, ack 2261, win 1050, options [nop,nop,TS val 139672171 ecr 1494735805], length 1418
   37  10:39:42.152229 IP 80.14.211.130.bc.googleusercontent.com.https > usertekiiphone.57135: Flags [.], seq 22318:23736, ack 2261, win 1050, options [nop,nop,TS val 139672171 ecr 1494735805], length 1418
   38  10:39:42.152231 IP 80.14.211.130.bc.googleusercontent.com.https > usertekiiphone.57135: Flags [P.], seq 23736:25121, ack 2261, win 1050, options [nop,nop,TS val 139672171 ecr 1494735805], length 1385
   39  10:39:42.152235 IP 80.14.211.130.bc.googleusercontent.com.https > usertekiiphone.57135: Flags [P.], seq 25121:26539, ack 2261, win 1050, options [nop,nop,TS val 139672173 ecr 1494735805], length 1418
   40  10:39:42.152238 IP 80.14.211.130.bc.googleusercontent.com.https > usertekiiphone.57135: Flags [.], seq 26539:27957, ack 2261, win 1050, options [nop,nop,TS val 139672173 ecr 1494735805], length 1418
   41  10:39:42.152241 IP 80.14.211.130.bc.googleusercontent.com.https > usertekiiphone.57135: Flags [P.], seq 27957:29306, ack 2261, win 1050, options [nop,nop,TS val 139672173 ecr 1494735805], length 1349
   42  10:39:42.152244 IP 80.14.211.130.bc.googleusercontent.com.https > usertekiiphone.57135: Flags [P.], seq 29306:30724, ack 2261, win 1050, options [nop,nop,TS val 139672178 ecr 1494735805], length 1418
   43  10:39:42.152246 IP 80.14.211.130.bc.googleusercontent.com.https > usertekiiphone.57135: Flags [.], seq 30724:32142, ack 2261, win 1050, options [nop,nop,TS val 139672178 ecr 1494735805], length 1418
   44  10:39:42.152248 IP 80.14.211.130.bc.googleusercontent.com.https > usertekiiphone.57135: Flags [P.], seq 32142:33560, ack 2261, win 1050, options [nop,nop,TS val 139672178 ecr 1494735805], length 1418
   45  10:39:42.152251 IP 80.14.211.130.bc.googleusercontent.com.https > usertekiiphone.57135: Flags [P.], seq 33560:33694, ack 2261, win 1050, options [nop,nop,TS val 139672178 ecr 1494735805], length 134
   46  10:39:42.152253 IP 80.14.211.130.bc.googleusercontent.com.https > usertekiiphone.57135: Flags [P.], seq 33694:35112, ack 2261, win 1050, options [nop,nop,TS val 139672180 ecr 1494735805], length 1418
   47  10:39:42.152255 IP 80.14.211.130.bc.googleusercontent.com.https > usertekiiphone.57135: Flags [.], seq 35112:36530, ack 2261, win 1050, options [nop,nop,TS val 139672180 ecr 1494735805], length 1418
   48  10:39:42.152258 IP 80.14.211.130.bc.googleusercontent.com.https > usertekiiphone.57135: Flags [P.], seq 36530:37948, ack 2261, win 1050, options [nop,nop,TS val 139672180 ecr 1494735805], length 1418
   49  10:39:42.152260 IP 80.14.211.130.bc.googleusercontent.com.https > usertekiiphone.57135: Flags [P.], seq 37948:38019, ack 2261, win 1050, options [nop,nop,TS val 139672180 ecr 1494735805], length 71
   50  10:39:42.152261 IP 80.14.211.130.bc.googleusercontent.com.https > usertekiiphone.57135: Flags [P.], seq 38019:39437, ack 2261, win 1050, options [nop,nop,TS val 139672182 ecr 1494735805], length 1418
   51  10:39:42.152263 IP 80.14.211.130.bc.googleusercontent.com.https > usertekiiphone.57135: Flags [.], seq 39437:40855, ack 2261, win 1050, options [nop,nop,TS val 139672182 ecr 1494735805], length 1418
   52  10:39:42.152266 IP 80.14.211.130.bc.googleusercontent.com.https > usertekiiphone.57135: Flags [P.], seq 40855:40940, ack 2261, win 1050, options [nop,nop,TS val 139672182 ecr 1494735805], length 85
   53  10:39:42.152267 IP 80.14.211.130.bc.googleusercontent.com.https > usertekiiphone.57135: Flags [P.], seq 40940:41189, ack 2261, win 1050, options [nop,nop,TS val 139672183 ecr 1494735805], length 249
   54  10:39:42.152269 IP 80.14.211.130.bc.googleusercontent.com.https > usertekiiphone.57135: Flags [P.], seq 41189:41228, ack 2261, win 1050, options [nop,nop,TS val 139672183 ecr 1494735805], length 39
   55  10:39:42.152270 IP 80.14.211.130.bc.googleusercontent.com.https > usertekiiphone.57135: Flags [P.], seq 41189:41228, ack 2261, win 1050, options [nop,nop,TS val 139672265 ecr 1494735805], length 39
   56  10:39:42.162220 IP usertekiiphone.57135 > 80.14.211.130.bc.googleusercontent.com.https: Flags [.], ack 25121, win 4418, options [nop,nop,TS val 1494736355 ecr 139672171], length 0
   57  10:39:42.162223 IP usertekiiphone.57135 > 80.14.211.130.bc.googleusercontent.com.https: Flags [.], ack 41228, win 3915, options [nop,nop,TS val 1494736355 ecr 139672183], length 0
   58  10:39:42.162224 IP usertekiiphone.57135 > 80.14.211.130.bc.googleusercontent.com.https: Flags [.], ack 41228, win 3915, options [nop,nop,TS val 1494736355 ecr 139672265,nop,nop,sack 1 {41189:41228}], length 0
   59  10:39:42.162226 IP usertekiiphone.57135 > 80.14.211.130.bc.googleusercontent.com.https: Flags [.], ack 41228, win 4893, options [nop,nop,TS val 1494736355 ecr 139672265], length 0
   60  10:39:42.164543 IP usertekiiphone.57135 > 80.14.211.130.bc.googleusercontent.com.https: Flags [P.], seq 2261:2300, ack 41228, win 4893, options [nop,nop,TS val 1494736366 ecr 139672265], length 39
   61  10:39:42.167032 IP 80.14.211.130.bc.googleusercontent.com.https > usertekiiphone.57135: Flags [.], ack 2300, win 1050, options [nop,nop,TS val 139672411 ecr 1494736366], length 0
   62  10:39:42.517877 IP nslabs-macbook-pro.local.55318 > 239.255.255.250.ssdp: UDP, length 174
   63  10:39:43.518973 IP nslabs-macbook-pro.local.55318 > 239.255.255.250.ssdp: UDP, length 174
   64  10:39:43.619767 IP usertekiiphone.57136 > 80.14.211.130.bc.googleusercontent.com.https: Flags [P.], seq 3698121331:3698121386, ack 2857529959, win 4096, options [nop,nop,TS val 1188880624 ecr 2171259105], length 55
   65  10:39:43.776377 IP 80.14.211.130.bc.googleusercontent.com.https > usertekiiphone.57136: Flags [.], ack 55, win 265, options [nop,nop,TS val 2171289964 ecr 1188880624], length 0
   66  10:39:43.780821 IP usertekiiphone.57136 > 80.14.211.130.bc.googleusercontent.com.https: Flags [P.], seq 0:55, ack 1, win 4096, options [nop,nop,TS val 1188880784 ecr 2171259105], length 55
   67  10:39:43.783098 IP 80.14.211.130.bc.googleusercontent.com.https > usertekiiphone.57136: Flags [.], ack 55, win 265, options [nop,nop,TS val 2171289970 ecr 1188880784,nop,nop,sack 1 {0:55}], length 0
   68  10:39:44.043035 IP 80.14.211.130.bc.googleusercontent.com.https > usertekiiphone.57136: Flags [P.], seq 1:62, ack 55, win 265, options [nop,nop,TS val 2171290125 ecr 1188880784], length 61
   69  10:39:44.043040 IP 80.14.211.130.bc.googleusercontent.com.https > usertekiiphone.57136: Flags [P.], seq 62:133, ack 55, win 265, options [nop,nop,TS val 2171290125 ecr 1188880784], length 71
   70  10:39:44.043043 IP 80.14.211.130.bc.googleusercontent.com.https > usertekiiphone.57136: Flags [P.], seq 133:172, ack 55, win 265, options [nop,nop,TS val 2171290125 ecr 1188880784], length 39
   71  10:39:44.051376 IP usertekiiphone.57136 > 80.14.211.130.bc.googleusercontent.com.https: Flags [.], ack 172, win 4090, options [nop,nop,TS val 1188881053 ecr 2171290125], length 0
   72  10:39:44.052497 IP usertekiiphone.57136 > 80.14.211.130.bc.googleusercontent.com.https: Flags [P.], seq 55:94, ack 172, win 4096, options [nop,nop,TS val 1188881054 ecr 2171290125], length 39
   73  10:39:44.054931 IP 80.14.211.130.bc.googleusercontent.com.https > usertekiiphone.57136: Flags [.], ack 94, win 265, options [nop,nop,TS val 2171290242 ecr 1188881054], length 0
   74  10:39:44.554893 IP usertekiiphone.57135 > 80.14.211.130.bc.googleusercontent.com.https: Flags [P.], seq 2300:2358, ack 41228, win 4893, options [nop,nop,TS val 1494738750 ecr 139672411], length 58
   75  10:39:44.555880 IP usertekiiphone.57135 > 80.14.211.130.bc.googleusercontent.com.https: Flags [.], seq 2358:3776, ack 41228, win 4893, options [nop,nop,TS val 1494738751 ecr 139672411], length 1418
   76  10:39:44.555992 IP usertekiiphone.57135 > 80.14.211.130.bc.googleusercontent.com.https: Flags [P.], seq 3776:4017, ack 41228, win 4893, options [nop,nop,TS val 1494738751 ecr 139672411], length 241
   77  10:39:44.563487 IP 80.14.211.130.bc.googleusercontent.com.https > usertekiiphone.57135: Flags [.], ack 2358, win 1050, options [nop,nop,TS val 139674807 ecr 1494738750], length 0
   78  10:39:44.563488 IP 80.14.211.130.bc.googleusercontent.com.https > usertekiiphone.57135: Flags [.], ack 3776, win 1049, options [nop,nop,TS val 139674807 ecr 1494738751], length 0
   79  10:39:44.563489 IP 80.14.211.130.bc.googleusercontent.com.https > usertekiiphone.57135: Flags [.], ack 4017, win 1049, options [nop,nop,TS val 139674807 ecr 1494738751], length 0
   80  10:39:44.563695 IP 80.14.211.130.bc.googleusercontent.com.https > usertekiiphone.57135: Flags [.], ack 2358, win 1050, options [nop,nop,TS val 139674807 ecr 1494738750], length 0
   81  10:39:44.914082 IP 80.14.211.130.bc.googleusercontent.com.https > usertekiiphone.57135: Flags [P.], seq 41228:41290, ack 4017, win 1050, options [nop,nop,TS val 139675158 ecr 1494738751], length 62
   82  10:39:44.914084 IP 80.14.211.130.bc.googleusercontent.com.https > usertekiiphone.57135: Flags [P.], seq 41290:42050, ack 4017, win 1050, options [nop,nop,TS val 139675158 ecr 1494738751], length 760
   83  10:39:44.914086 IP 80.14.211.130.bc.googleusercontent.com.https > usertekiiphone.57135: Flags [P.], seq 42050:42156, ack 4017, win 1050, options [nop,nop,TS val 139675158 ecr 1494738751], length 106
   84  10:39:44.914357 IP 80.14.211.130.bc.googleusercontent.com.https > usertekiiphone.57135: Flags [P.], seq 42156:42195, ack 4017, win 1050, options [nop,nop,TS val 139675158 ecr 1494738751], length 39
   85  10:39:44.914682 IP usertekiiphone.57135 > 80.14.211.130.bc.googleusercontent.com.https: Flags [.], ack 42156, win 4864, options [nop,nop,TS val 1494739108 ecr 139675158], length 0
   86  10:39:44.916458 IP usertekiiphone.57135 > 80.14.211.130.bc.googleusercontent.com.https: Flags [.], ack 42195, win 4892, options [nop,nop,TS val 1494739110 ecr 139675158], length 0
   87  10:39:44.928066 IP usertekiiphone.57135 > 80.14.211.130.bc.googleusercontent.com.https: Flags [P.], seq 4017:4056, ack 42195, win 4893, options [nop,nop,TS val 1494739121 ecr 139675158], length 39
   88  10:39:44.930744 IP 80.14.211.130.bc.googleusercontent.com.https > usertekiiphone.57135: Flags [.], ack 4056, win 1050, options [nop,nop,TS val 139675174 ecr 1494739121], length 0
   89  10:39:47.707639 IP nslabs-macbook-pro.local.mdns > 224.0.0.251.mdns: 0 [4q] SRV (QM)? HP Color LaserJet M651 [3F3C6F]._ipp._tcp.local. TXT (QM)? HP Color LaserJet M651 [3F3C6F]._ipp._tcp.local. SRV (QM)? ncm._remoted._tcp.local. TXT (QM)? ncm._remoted._tcp.local. (96)
   90  10:39:47.707774 IP6 nslabs-macbook-pro.local.mdns > ff02::fb.mdns: 0 [4q] SRV (QM)? HP Color LaserJet M651 [3F3C6F]._ipp._tcp.local. TXT (QM)? HP Color LaserJet M651 [3F3C6F]._ipp._tcp.local. SRV (QM)? ncm._remoted._tcp.local. TXT (QM)? ncm._remoted._tcp.local. (96)
   91  10:39:47.728051 IP nslabs-mbp.mdns > 224.0.0.251.mdns: 0 [2q] SRV (QM)? HP Color LaserJet M651 [3F3C6F]._ipp._tcp.local. TXT (QM)? HP Color LaserJet M651 [3F3C6F]._ipp._tcp.local. (71)
   92  10:39:47.728062 IP6 nslabs-macbook-pro.local.mdns > ff02::fb.mdns: 0 [2q] SRV (QM)? HP Color LaserJet M651 [3F3C6F]._ipp._tcp.local. TXT (QM)? HP Color LaserJet M651 [3F3C6F]._ipp._tcp.local. (71)
   93  10:39:48.865688 IP 0.0.0.0.bootpc > broadcasthost.bootps: BOOTP/DHCP, Request from 6a:db:ca:c7:c7:6c (oui Unknown), length 300
   94  10:39:49.892999 IP 0.0.0.0.bootpc > broadcasthost.bootps: BOOTP/DHCP, Request from 6a:db:ca:c7:c7:6a (oui Unknown), length 300
   95  10:39:51.367509 IP usertekiiphone.57135 > 80.14.211.130.bc.googleusercontent.com.https: Flags [P.], seq 4056:4114, ack 42195, win 4893, options [nop,nop,TS val 1494745558 ecr 139675174], length 58
   96  10:39:51.367980 IP usertekiiphone.57135 > 80.14.211.130.bc.googleusercontent.com.https: Flags [.], seq 4114:5532, ack 42195, win 4893, options [nop,nop,TS val 1494745558 ecr 139675174], length 1418
   97  10:39:51.368000 IP usertekiiphone.57135 > 80.14.211.130.bc.googleusercontent.com.https: Flags [P.], seq 5532:6162, ack 42195, win 4893, options [nop,nop,TS val 1494745558 ecr 139675174], length 630
   98  10:39:51.368018 IP usertekiiphone.57135 > 80.14.211.130.bc.googleusercontent.com.https: Flags [P.], seq 6162:6261, ack 42195, win 4893, options [nop,nop,TS val 1494745558 ecr 139675174], length 99
   99  10:39:51.368100 IP usertekiiphone.57135 > 80.14.211.130.bc.googleusercontent.com.https: Flags [P.], seq 6261:6292, ack 42195, win 4893, options [nop,nop,TS val 1494745558 ecr 139675174], length 31
  100  10:39:51.372270 IP 80.14.211.130.bc.googleusercontent.com.https > usertekiiphone.57135: Flags [.], ack 4114, win 1050, options [nop,nop,TS val 139681616 ecr 1494745558], length 0
  101  10:39:51.372270 IP 80.14.211.130.bc.googleusercontent.com.https > usertekiiphone.57135: Flags [.], ack 5532, win 1050, options [nop,nop,TS val 139681616 ecr 1494745558], length 0
  102  10:39:51.372367 IP 80.14.211.130.bc.googleusercontent.com.https > usertekiiphone.57135: Flags [.], ack 6162, win 1049, options [nop,nop,TS val 139681616 ecr 1494745558], length 0
  103  10:39:51.372368 IP 80.14.211.130.bc.googleusercontent.com.https > usertekiiphone.57135: Flags [.], ack 6261, win 1049, options [nop,nop,TS val 139681616 ecr 1494745558], length 0
  104  10:39:51.372727 IP 80.14.211.130.bc.googleusercontent.com.https > usertekiiphone.57135: Flags [.], ack 6292, win 1049, options [nop,nop,TS val 139681616 ecr 1494745558], length 0
  105  10:39:51.613464 IP 80.14.211.130.bc.googleusercontent.com.https > usertekiiphone.57135: Flags [P.], seq 42195:42257, ack 6292, win 1050, options [nop,nop,TS val 139681846 ecr 1494745558], length 62
  106  10:39:51.613465 IP 80.14.211.130.bc.googleusercontent.com.https > usertekiiphone.57135: Flags [P.], seq 42257:43675, ack 6292, win 1050, options [nop,nop,TS val 139681846 ecr 1494745558], length 1418
  107  10:39:51.613466 IP 80.14.211.130.bc.googleusercontent.com.https > usertekiiphone.57135: Flags [.], seq 43675:45093, ack 6292, win 1050, options [nop,nop,TS val 139681846 ecr 1494745558], length 1418
  108  10:39:51.613467 IP 80.14.211.130.bc.googleusercontent.com.https > usertekiiphone.57135: Flags [P.], seq 45093:46268, ack 6292, win 1050, options [nop,nop,TS val 139681846 ecr 1494745558], length 1175
  109  10:39:51.613851 IP usertekiiphone.57135 > 80.14.211.130.bc.googleusercontent.com.https: Flags [.], ack 46268, win 4766, options [nop,nop,TS val 1494745802 ecr 139681846], length 0
  110  10:39:51.613851 IP usertekiiphone.57135 > 80.14.211.130.bc.googleusercontent.com.https: Flags [.], ack 46268, win 4893, options [nop,nop,TS val 1494745802 ecr 139681846], length 0
  111  10:39:51.613938 IP 80.14.211.130.bc.googleusercontent.com.https > usertekiiphone.57135: Flags [P.], seq 46268:47686, ack 6292, win 1050, options [nop,nop,TS val 139681850 ecr 1494745558], length 1418
  112  10:39:51.613939 IP 80.14.211.130.bc.googleusercontent.com.https > usertekiiphone.57135: Flags [.], seq 47686:49104, ack 6292, win 1050, options [nop,nop,TS val 139681850 ecr 1494745558], length 1418
  113  10:39:51.613941 IP 80.14.211.130.bc.googleusercontent.com.https > usertekiiphone.57135: Flags [P.], seq 49104:50460, ack 6292, win 1050, options [nop,nop,TS val 139681850 ecr 1494745558], length 1356
  114  10:39:51.613942 IP 80.14.211.130.bc.googleusercontent.com.https > usertekiiphone.57135: Flags [P.], seq 50460:51878, ack 6292, win 1050, options [nop,nop,TS val 139681852 ecr 1494745558], length 1418
  115  10:39:51.613943 IP 80.14.211.130.bc.googleusercontent.com.https > usertekiiphone.57135: Flags [.], seq 51878:53296, ack 6292, win 1050, options [nop,nop,TS val 139681852 ecr 1494745558], length 1418
  116  10:39:51.613944 IP 80.14.211.130.bc.googleusercontent.com.https > usertekiiphone.57135: Flags [P.], seq 53296:54714, ack 6292, win 1050, options [nop,nop,TS val 139681852 ecr 1494745558], length 1418
  117  10:39:51.613945 IP 80.14.211.130.bc.googleusercontent.com.https > usertekiiphone.57135: Flags [P.], seq 54714:54804, ack 6292, win 1050, options [nop,nop,TS val 139681852 ecr 1494745558], length 90
  118  10:39:51.613946 IP 80.14.211.130.bc.googleusercontent.com.https > usertekiiphone.57135: Flags [P.], seq 54804:56222, ack 6292, win 1050, options [nop,nop,TS val 139681854 ecr 1494745558], length 1418
  119  10:39:51.613946 IP 80.14.211.130.bc.googleusercontent.com.https > usertekiiphone.57135: Flags [P.], seq 56222:56862, ack 6292, win 1050, options [nop,nop,TS val 139681854 ecr 1494745558], length 640
  120  10:39:51.614749 IP usertekiiphone.57135 > 80.14.211.130.bc.googleusercontent.com.https: Flags [.], ack 56862, win 4562, options [nop,nop,TS val 1494745802 ecr 139681854], length 0
  121  10:39:51.614750 IP usertekiiphone.57135 > 80.14.211.130.bc.googleusercontent.com.https: Flags [.], ack 56862, win 4893, options [nop,nop,TS val 1494745802 ecr 139681854], length 0
  122  10:39:51.616147 IP 80.14.211.130.bc.googleusercontent.com.https > usertekiiphone.57135: Flags [P.], seq 56862:58280, ack 6292, win 1050, options [nop,nop,TS val 139681859 ecr 1494745558], length 1418
  123  10:39:51.616148 IP 80.14.211.130.bc.googleusercontent.com.https > usertekiiphone.57135: Flags [.], seq 58280:59698, ack 6292, win 1050, options [nop,nop,TS val 139681859 ecr 1494745558], length 1418
  124  10:39:51.616149 IP 80.14.211.130.bc.googleusercontent.com.https > usertekiiphone.57135: Flags [P.], seq 59698:61116, ack 6292, win 1050, options [nop,nop,TS val 139681859 ecr 1494745558], length 1418
  125  10:39:51.616173 IP 80.14.211.130.bc.googleusercontent.com.https > usertekiiphone.57135: Flags [P.], seq 61116:61236, ack 6292, win 1050, options [nop,nop,TS val 139681859 ecr 1494745558], length 120
  126  10:39:51.616366 IP usertekiiphone.57135 > 80.14.211.130.bc.googleusercontent.com.https: Flags [.], ack 61116, win 4760, options [nop,nop,TS val 1494745804 ecr 139681859], length 0
  127  10:39:51.616366 IP usertekiiphone.57135 > 80.14.211.130.bc.googleusercontent.com.https: Flags [.], ack 61236, win 4756, options [nop,nop,TS val 1494745804 ecr 139681859], length 0
  128  10:39:51.616367 IP usertekiiphone.57135 > 80.14.211.130.bc.googleusercontent.com.https: Flags [.], ack 61236, win 4893, options [nop,nop,TS val 1494745804 ecr 139681859], length 0
  129  10:39:51.619774 IP 80.14.211.130.bc.googleusercontent.com.https > usertekiiphone.57135: Flags [P.], seq 61236:62654, ack 6292, win 1050, options [nop,nop,TS val 139681863 ecr 1494745804], length 1418
  130  10:39:51.620017 IP usertekiiphone.57135 > 80.14.211.130.bc.googleusercontent.com.https: Flags [.], ack 62654, win 4849, options [nop,nop,TS val 1494745807 ecr 139681863], length 0
  131  10:39:51.620230 IP 80.14.211.130.bc.googleusercontent.com.https > usertekiiphone.57135: Flags [.], seq 62654:64072, ack 6292, win 1050, options [nop,nop,TS val 139681863 ecr 1494745804], length 1418
  132  10:39:51.620232 IP 80.14.211.130.bc.googleusercontent.com.https > usertekiiphone.57135: Flags [P.], seq 64072:65490, ack 6292, win 1050, options [nop,nop,TS val 139681863 ecr 1494745804], length 1418
  133  10:39:51.620233 IP 80.14.211.130.bc.googleusercontent.com.https > usertekiiphone.57135: Flags [P.], seq 65490:65671, ack 6292, win 1050, options [nop,nop,TS val 139681863 ecr 1494745804], length 181
  134  10:39:51.620330 IP usertekiiphone.57135 > 80.14.211.130.bc.googleusercontent.com.https: Flags [.], ack 65671, win 4799, options [nop,nop,TS val 1494745807 ecr 139681863], length 0
  135  10:39:51.620330 IP usertekiiphone.57135 > 80.14.211.130.bc.googleusercontent.com.https: Flags [.], ack 65671, win 4893, options [nop,nop,TS val 1494745807 ecr 139681863], length 0
  136  10:39:51.622747 IP 80.14.211.130.bc.googleusercontent.com.https > usertekiiphone.57135: Flags [P.], seq 65671:67089, ack 6292, win 1050, options [nop,nop,TS val 139681866 ecr 1494745804], length 1418
  137  10:39:51.622748 IP 80.14.211.130.bc.googleusercontent.com.https > usertekiiphone.57135: Flags [.], seq 67089:68507, ack 6292, win 1050, options [nop,nop,TS val 139681866 ecr 1494745804], length 1418
  138  10:39:51.622749 IP 80.14.211.130.bc.googleusercontent.com.https > usertekiiphone.57135: Flags [P.], seq 68507:69925, ack 6292, win 1050, options [nop,nop,TS val 139681866 ecr 1494745804], length 1418
  139  10:39:51.622750 IP 80.14.211.130.bc.googleusercontent.com.https > usertekiiphone.57135: Flags [P.], seq 69925:70017, ack 6292, win 1050, options [nop,nop,TS val 139681866 ecr 1494745804], length 92
  140  10:39:51.622981 IP usertekiiphone.57135 > 80.14.211.130.bc.googleusercontent.com.https: Flags [.], ack 70017, win 4757, options [nop,nop,TS val 1494745809 ecr 139681866], length 0
  141  10:39:51.622982 IP usertekiiphone.57135 > 80.14.211.130.bc.googleusercontent.com.https: Flags [.], ack 70017, win 4893, options [nop,nop,TS val 1494745809 ecr 139681866], length 0
  142  10:39:51.625087 IP 80.14.211.130.bc.googleusercontent.com.https > usertekiiphone.57135: Flags [P.], seq 70017:71435, ack 6292, win 1050, options [nop,nop,TS val 139681868 ecr 1494745807], length 1418
  143  10:39:51.625088 IP 80.14.211.130.bc.googleusercontent.com.https > usertekiiphone.57135: Flags [.], seq 71435:72853, ack 6292, win 1050, options [nop,nop,TS val 139681868 ecr 1494745807], length 1418
  144  10:39:51.625089 IP 80.14.211.130.bc.googleusercontent.com.https > usertekiiphone.57135: Flags [P.], seq 72853:74271, ack 6292, win 1050, options [nop,nop,TS val 139681868 ecr 1494745807], length 1418
  145  10:39:51.625090 IP 80.14.211.130.bc.googleusercontent.com.https > usertekiiphone.57135: Flags [P.], seq 74271:74302, ack 6292, win 1050, options [nop,nop,TS val 139681868 ecr 1494745807], length 31
  146  10:39:51.625340 IP usertekiiphone.57135 > 80.14.211.130.bc.googleusercontent.com.https: Flags [.], ack 74302, win 4759, options [nop,nop,TS val 1494745811 ecr 139681868], length 0
  147  10:39:51.625341 IP usertekiiphone.57135 > 80.14.211.130.bc.googleusercontent.com.https: Flags [.], ack 74302, win 4893, options [nop,nop,TS val 1494745811 ecr 139681868], length 0
  148  10:39:51.626873 IP 80.14.211.130.bc.googleusercontent.com.https > usertekiiphone.57135: Flags [P.], seq 74302:75720, ack 6292, win 1050, options [nop,nop,TS val 139681870 ecr 1494745809], length 1418
  149  10:39:51.626874 IP 80.14.211.130.bc.googleusercontent.com.https > usertekiiphone.57135: Flags [P.], seq 75720:77138, ack 6292, win 1050, options [nop,nop,TS val 139681870 ecr 1494745809], length 1418
  150  10:39:51.626875 IP 80.14.211.130.bc.googleusercontent.com.https > usertekiiphone.57135: Flags [.], seq 77138:78556, ack 6292, win 1050, options [nop,nop,TS val 139681870 ecr 1494745809], length 1418
  151  10:39:51.626876 IP 80.14.211.130.bc.googleusercontent.com.https > usertekiiphone.57135: Flags [P.], seq 78556:78628, ack 6292, win 1050, options [nop,nop,TS val 139681870 ecr 1494745809], length 72
  152  10:39:51.627185 IP usertekiiphone.57135 > 80.14.211.130.bc.googleusercontent.com.https: Flags [.], ack 78628, win 4758, options [nop,nop,TS val 1494745812 ecr 139681870], length 0
  153  10:39:51.627186 IP usertekiiphone.57135 > 80.14.211.130.bc.googleusercontent.com.https: Flags [.], ack 78628, win 4893, options [nop,nop,TS val 1494745812 ecr 139681870], length 0
  154  10:39:51.629487 IP 80.14.211.130.bc.googleusercontent.com.https > usertekiiphone.57135: Flags [P.], seq 78628:80046, ack 6292, win 1050, options [nop,nop,TS val 139681873 ecr 1494745811], length 1418
  155  10:39:51.629488 IP 80.14.211.130.bc.googleusercontent.com.https > usertekiiphone.57135: Flags [P.], seq 80046:81456, ack 6292, win 1050, options [nop,nop,TS val 139681873 ecr 1494745811], length 1410
  156  10:39:51.629490 IP 80.14.211.130.bc.googleusercontent.com.https > usertekiiphone.57135: Flags [P.], seq 81456:81495, ack 6292, win 1050, options [nop,nop,TS val 139681873 ecr 1494745811], length 39
  157  10:39:51.629845 IP usertekiiphone.57135 > 80.14.211.130.bc.googleusercontent.com.https: Flags [.], ack 81495, win 4804, options [nop,nop,TS val 1494745814 ecr 139681873], length 0
  158  10:39:51.629846 IP usertekiiphone.57135 > 80.14.211.130.bc.googleusercontent.com.https: Flags [.], ack 81495, win 4893, options [nop,nop,TS val 1494745814 ecr 139681873], length 0
  159  10:39:51.630053 IP usertekiiphone.57135 > 80.14.211.130.bc.googleusercontent.com.https: Flags [P.], seq 6292:6331, ack 81495, win 4893, options [nop,nop,TS val 1494745814 ecr 139681873], length 39
  160  10:39:51.633109 IP 80.14.211.130.bc.googleusercontent.com.https > usertekiiphone.57135: Flags [.], ack 6331, win 1050, options [nop,nop,TS val 139681876 ecr 1494745814], length 0
  161  10:39:53.565894 IP usertekiiphone.51608 > nslabs-mbp.56756: Flags [.], ack 2057907959, win 4096, length 0
  162  10:39:53.975983 IP nslabs-mbp.56756 > usertekiiphone.51608: Flags [.], ack 1, win 2048, options [nop,nop,TS val 2523941749 ecr 1179844685], length 0
  163  10:39:56.123312 IP nslabs-macbook-pro.local.mdns > 224.0.0.251.mdns: 0 [2q] SRV (QU)? ncm._remoted._tcp.local. TXT (QU)? ncm._remoted._tcp.local. (47)
  164  10:39:56.123438 IP6 nslabs-macbook-pro.local.mdns > ff02::fb.mdns: 0 [2q] SRV (QU)? ncm._remoted._tcp.local. TXT (QU)? ncm._remoted._tcp.local. (47)
  165  10:39:57.127563 IP nslabs-macbook-pro.local.mdns > 224.0.0.251.mdns: 0 [2q] SRV (QM)? ncm._remoted._tcp.local. TXT (QM)? ncm._remoted._tcp.local. (47)
  166  10:39:57.127678 IP6 nslabs-macbook-pro.local.mdns > ff02::fb.mdns: 0 [2q] SRV (QM)? ncm._remoted._tcp.local. TXT (QM)? ncm._remoted._tcp.local. (47)
  167  10:39:57.796168 ARP, Reply dlinkrouter is-at f4:8c:eb:9e:9e:db (oui Unknown), length 28
  168  10:40:00.138866 IP nslabs-macbook-pro.local.mdns > 224.0.0.251.mdns: 0 [2q] SRV (QM)? ncm._remoted._tcp.local. TXT (QM)? ncm._remoted._tcp.local. (47)
  169  10:40:00.138987 IP6 nslabs-macbook-pro.local.mdns > ff02::fb.mdns: 0 [2q] SRV (QM)? ncm._remoted._tcp.local. TXT (QM)? ncm._remoted._tcp.local. (47)
  170  10:40:01.054390 IP usertekiiphone.57135 > 80.14.211.130.bc.googleusercontent.com.https: Flags [P.], seq 6331:6389, ack 81495, win 4893, options [nop,nop,TS val 1494755237 ecr 139681876], length 58
  171  10:40:01.055251 IP usertekiiphone.57135 > 80.14.211.130.bc.googleusercontent.com.https: Flags [.], seq 6389:7807, ack 81495, win 4893, options [nop,nop,TS val 1494755237 ecr 139681876], length 1418
  172  10:40:01.055410 IP usertekiiphone.57135 > 80.14.211.130.bc.googleusercontent.com.https: Flags [P.], seq 7807:8208, ack 81495, win 4893, options [nop,nop,TS val 1494755237 ecr 139681876], length 401
  173  10:40:01.062082 IP 80.14.211.130.bc.googleusercontent.com.https > usertekiiphone.57135: Flags [.], ack 6389, win 1050, options [nop,nop,TS val 139691306 ecr 1494755237], length 0
  174  10:40:01.062312 IP 80.14.211.130.bc.googleusercontent.com.https > usertekiiphone.57135: Flags [.], ack 7807, win 1050, options [nop,nop,TS val 139691306 ecr 1494755237], length 0
  175  10:40:01.062313 IP 80.14.211.130.bc.googleusercontent.com.https > usertekiiphone.57135: Flags [.], ack 8208, win 1049, options [nop,nop,TS val 139691306 ecr 1494755237], length 0
  176  10:40:01.656307 IP 80.14.211.130.bc.googleusercontent.com.https > usertekiiphone.57135: Flags [P.], seq 81495:81557, ack 8208, win 1050, options [nop,nop,TS val 139691522 ecr 1494755237], length 62
  177  10:40:01.656310 IP 80.14.211.130.bc.googleusercontent.com.https > usertekiiphone.57135: Flags [P.], seq 81557:82975, ack 8208, win 1050, options [nop,nop,TS val 139691522 ecr 1494755237], length 1418
  178  10:40:01.657793 IP 80.14.211.130.bc.googleusercontent.com.https > usertekiiphone.57135: Flags [.], seq 82975:84393, ack 8208, win 1050, options [nop,nop,TS val 139691522 ecr 1494755237], length 1418
  179  10:40:01.657796 IP 80.14.211.130.bc.googleusercontent.com.https > usertekiiphone.57135: Flags [P.], seq 84393:84813, ack 8208, win 1050, options [nop,nop,TS val 139691522 ecr 1494755237], length 420
  180  10:40:01.657799 IP 80.14.211.130.bc.googleusercontent.com.https > usertekiiphone.57135: Flags [P.], seq 84813:84852, ack 8208, win 1050, options [nop,nop,TS val 139691522 ecr 1494755237], length 39
  181  10:40:01.657800 IP 80.14.211.130.bc.googleusercontent.com.https > usertekiiphone.57135: Flags [P.], seq 84813:84852, ack 8208, win 1050, options [nop,nop,TS val 139691581 ecr 1494755237], length 39
  182  10:40:01.678503 IP usertekiiphone.57135 > 80.14.211.130.bc.googleusercontent.com.https: Flags [.], ack 82975, win 4847, options [nop,nop,TS val 1494755849 ecr 139691522], length 0
  183  10:40:01.678506 IP usertekiiphone.57135 > 80.14.211.130.bc.googleusercontent.com.https: Flags [.], ack 84852, win 4788, options [nop,nop,TS val 1494755849 ecr 139691522], length 0
  184  10:40:01.678508 IP usertekiiphone.57135 > 80.14.211.130.bc.googleusercontent.com.https: Flags [.], ack 84852, win 4788, options [nop,nop,TS val 1494755849 ecr 139691581,nop,nop,sack 1 {84813:84852}], length 0
  185  10:40:01.678509 IP usertekiiphone.57135 > 80.14.211.130.bc.googleusercontent.com.https: Flags [.], ack 84852, win 4893, options [nop,nop,TS val 1494755849 ecr 139691581], length 0
  186  10:40:01.679979 IP usertekiiphone.57135 > 80.14.211.130.bc.googleusercontent.com.https: Flags [P.], seq 8208:8247, ack 84852, win 4893, options [nop,nop,TS val 1494755861 ecr 139691581], length 39
  187  10:40:01.687858 IP 80.14.211.130.bc.googleusercontent.com.https > usertekiiphone.57135: Flags [.], ack 8247, win 1050, options [nop,nop,TS val 139691931 ecr 1494755861], length 0
  188  10:40:06.263814 ARP, Request who-has usertekiiphone tell dlinkrouter, length 28
  189  10:40:06.263861 ARP, Reply usertekiiphone is-at 42:55:64:8e:cb:27 (oui Unknown), length 28
  190  10:40:09.161950 IP nslabs-macbook-pro.local.mdns > 224.0.0.251.mdns: 0 [2q] SRV (QM)? ncm._remoted._tcp.local. TXT (QM)? ncm._remoted._tcp.local. (47)
  191  10:40:09.162072 IP6 nslabs-macbook-pro.local.mdns > ff02::fb.mdns: 0 [2q] SRV (QM)? ncm._remoted._tcp.local. TXT (QM)? ncm._remoted._tcp.local. (47)
  192  10:40:13.764025 IP usertekiiphone.64446 > dlinkrouter.domain: 1239+ Type65? gateway.icloud.com. (36)
  193  10:40:13.764413 IP usertekiiphone.56654 > dlinkrouter.domain: 21302+ A? gateway.icloud.com. (36)
  194  10:40:13.776189 IP dlinkrouter.domain > usertekiiphone.64446: 1239 1/0/0 CNAME gateway.fe.apple-dns.net. (74)
  195  10:40:13.779715 IP usertekiiphone.64848 > dlinkrouter.domain: 5671+ Type65? gateway.fe.apple-dns.net. (42)
  196  10:40:13.779890 IP usertekiiphone.57578 > dlinkrouter.domain: 48885+ A? gateway.fe.apple-dns.net. (42)
  197  10:40:13.786713 IP dlinkrouter.domain > usertekiiphone.56654: 21302 2/0/0 CNAME gateway.fe.apple-dns.net., A 17.248.223.4 (90)
  198  10:40:13.797259 IP dlinkrouter.domain > usertekiiphone.57578: 48885 4/0/0 A 17.248.223.1, A 17.248.223.2, A 17.248.223.3, A 17.248.223.4 (106)
  199  10:40:13.797263 IP dlinkrouter.domain > usertekiiphone.64848: 5671 0/1/0 (115)
  200  10:40:13.800427 IP usertekiiphone.57185 > 17.248.223.4.https: Flags [SEW], seq 1682700451, win 65535, options [mss 1460,nop,wscale 5,nop,nop,TS val 231583751 ecr 0,sackOK,eol], length 0
  201  10:40:13.804119 IP 17.248.223.4.https > usertekiiphone.57185: Flags [S.E], seq 2689606178, ack 1682700452, win 65160, options [mss 1460,sackOK,TS val 1849977842 ecr 231583751,nop,wscale 7], length 0
  202  10:40:13.804691 IP usertekiiphone.57185 > 17.248.223.4.https: Flags [.], ack 1, win 4117, options [nop,nop,TS val 231583755 ecr 1849977842], length 0
  203  10:40:13.804692 IP usertekiiphone.57185 > 17.248.223.4.https: Flags [P.], seq 1:518, ack 1, win 4117, options [nop,nop,TS val 231583755 ecr 1849977842], length 517
  204  10:40:13.807891 IP 17.248.223.4.https > usertekiiphone.57185: Flags [.], ack 518, win 506, options [nop,nop,TS val 1849977846 ecr 231583755], length 0
  205  10:40:13.808957 IP 17.248.223.4.https > usertekiiphone.57185: Flags [.], seq 1:1449, ack 518, win 506, options [nop,nop,TS val 1849977846 ecr 231583755], length 1448
  206  10:40:13.808958 IP 17.248.223.4.https > usertekiiphone.57185: Flags [.], seq 1449:2897, ack 518, win 506, options [nop,nop,TS val 1849977846 ecr 231583755], length 1448
  207  10:40:13.808960 IP 17.248.223.4.https > usertekiiphone.57185: Flags [P.], seq 2897:4097, ack 518, win 506, options [nop,nop,TS val 1849977846 ecr 231583755], length 1200
  208  10:40:13.808961 IP 17.248.223.4.https > usertekiiphone.57185: Flags [.], seq 4097:5545, ack 518, win 506, options [nop,nop,TS val 1849977846 ecr 231583755], length 1448
  209  10:40:13.808962 IP 17.248.223.4.https > usertekiiphone.57185: Flags [P.], seq 5545:6097, ack 518, win 506, options [nop,nop,TS val 1849977846 ecr 231583755], length 552
  210  10:40:13.812500 IP usertekiiphone.57185 > 17.248.223.4.https: Flags [.], ack 6097, win 3927, options [nop,nop,TS val 231583760 ecr 1849977846], length 0
  211  10:40:13.812502 IP usertekiiphone.57185 > 17.248.223.4.https: Flags [.], ack 6097, win 4096, options [nop,nop,TS val 231583760 ecr 1849977846], length 0
  212  10:40:13.826699 IP usertekiiphone.57185 > 17.248.223.4.https: Flags [P.], seq 518:582, ack 6097, win 4096, options [nop,nop,TS val 231583775 ecr 1849977846], length 64
