    1  13:32:59.284803 IP nslabs-macbook-pro.local.mdns > 224.0.0.251.mdns: 0 [2q] SRV (QM)? ncm._remoted._tcp.local. TXT (QM)? ncm._remoted._tcp.local. (47)
    2  13:32:59.284828 IP6 nslabs-macbook-pro.local.mdns > ff02::fb.mdns: 0 [2q] SRV (QM)? ncm._remoted._tcp.local. TXT (QM)? ncm._remoted._tcp.local. (47)
    3  13:33:02.851054 IP 0.0.0.0.bootpc > broadcasthost.bootps: BOOTP/DHCP, Request from 6a:db:ca:c7:c7:6a (oui Unknown), length 300
    4  13:33:03.055524 IP 0.0.0.0.bootpc > broadcasthost.bootps: BOOTP/DHCP, Request from 6a:db:ca:c7:c7:6c (oui Unknown), length 300
    5  13:33:03.946817 IP 0.0.0.0.bootpc > broadcasthost.bootps: BOOTP/DHCP, Request from 6a:db:ca:c7:c7:6a (oui Unknown), length 300
    6  13:33:04.489448 IP 0.0.0.0.bootpc > broadcasthost.bootps: BOOTP/DHCP, Request from 6a:db:ca:c7:c7:6c (oui Unknown), length 300
    7  13:33:05.248455 IP nslabs-macbook-pro.local.mdns > 224.0.0.251.mdns: 0 [4q] SRV (QM)? HP Color LaserJet M651 [3F3C6F]._ipp._tcp.local. TXT (QM)? HP Color LaserJet M651 [3F3C6F]._ipp._tcp.local. SRV (QM)? ncm._remoted._tcp.local. TXT (QM)? ncm._remoted._tcp.local. (96)
    8  13:33:05.248463 IP6 nslabs-macbook-pro.local.mdns > ff02::fb.mdns: 0 [4q] SRV (QM)? HP Color LaserJet M651 [3F3C6F]._ipp._tcp.local. TXT (QM)? HP Color LaserJet M651 [3F3C6F]._ipp._tcp.local. SRV (QM)? ncm._remoted._tcp.local. TXT (QM)? ncm._remoted._tcp.local. (96)
    9  13:33:05.980669 IP 0.0.0.0.bootpc > broadcasthost.bootps: BOOTP/DHCP, Request from 6a:db:ca:c7:c7:6a (oui Unknown), length 300
   10  13:33:06.636777 IP 0.0.0.0.bootpc > broadcasthost.bootps: BOOTP/DHCP, Request from 6a:db:ca:c7:c7:6c (oui Unknown), length 300
   11  13:33:09.383794 IP usertekiiphone.57345 > 80.14.211.130.bc.googleusercontent.com.https: Flags [P.], seq 2694894861:2694894919, ack 3900000088, win 4096, options [nop,nop,TS val 2000652039 ecr 1582497183], length 58
   12  13:33:09.385869 IP usertekiiphone.57345 > 80.14.211.130.bc.googleusercontent.com.https: Flags [.], seq 58:1476, ack 1, win 4096, options [nop,nop,TS val 2000652041 ecr 1582497183], length 1418
   13  13:33:09.385915 IP usertekiiphone.57345 > 80.14.211.130.bc.googleusercontent.com.https: Flags [P.], seq 1476:2106, ack 1, win 4096, options [nop,nop,TS val 2000652041 ecr 1582497183], length 630
   14  13:33:09.385943 IP usertekiiphone.57345 > 80.14.211.130.bc.googleusercontent.com.https: Flags [P.], seq 2106:2293, ack 1, win 4096, options [nop,nop,TS val 2000652041 ecr 1582497183], length 187
   15  13:33:09.386910 IP 80.14.211.130.bc.googleusercontent.com.https > usertekiiphone.57345: Flags [.], ack 58, win 1661, options [nop,nop,TS val 1582512295 ecr 2000652039], length 0
   16  13:33:09.388628 IP 80.14.211.130.bc.googleusercontent.com.https > usertekiiphone.57345: Flags [.], ack 1476, win 1672, options [nop,nop,TS val 1582512297 ecr 2000652041], length 0
   17  13:33:09.388629 IP 80.14.211.130.bc.googleusercontent.com.https > usertekiiphone.57345: Flags [.], ack 2106, win 1683, options [nop,nop,TS val 1582512297 ecr 2000652041], length 0
   18  13:33:09.388630 IP 80.14.211.130.bc.googleusercontent.com.https > usertekiiphone.57345: Flags [.], ack 2293, win 1694, options [nop,nop,TS val 1582512297 ecr 2000652041], length 0
   19  13:33:09.716893 IP 80.14.211.130.bc.googleusercontent.com.https > usertekiiphone.57345: Flags [P.], seq 1:63, ack 2293, win 1694, options [nop,nop,TS val 1582512533 ecr 2000652041], length 62
   20  13:33:09.716899 IP 80.14.211.130.bc.googleusercontent.com.https > usertekiiphone.57345: Flags [P.], seq 63:1481, ack 2293, win 1694, options [nop,nop,TS val 1582512533 ecr 2000652041], length 1418
   21  13:33:09.716903 IP 80.14.211.130.bc.googleusercontent.com.https > usertekiiphone.57345: Flags [.], seq 1481:2899, ack 2293, win 1694, options [nop,nop,TS val 1582512533 ecr 2000652041], length 1418
   22  13:33:09.716905 IP 80.14.211.130.bc.googleusercontent.com.https > usertekiiphone.57345: Flags [P.], seq 2899:4209, ack 2293, win 1694, options [nop,nop,TS val 1582512533 ecr 2000652041], length 1310
   23  13:33:09.716907 IP 80.14.211.130.bc.googleusercontent.com.https > usertekiiphone.57345: Flags [.], seq 4209:5627, ack 2293, win 1694, options [nop,nop,TS val 1582512533 ecr 2000652041], length 1418
   24  13:33:09.716909 IP 80.14.211.130.bc.googleusercontent.com.https > usertekiiphone.57345: Flags [P.], seq 5627:7045, ack 2293, win 1694, options [nop,nop,TS val 1582512533 ecr 2000652041], length 1418
   25  13:33:09.716911 IP 80.14.211.130.bc.googleusercontent.com.https > usertekiiphone.57345: Flags [.], seq 7045:8463, ack 2293, win 1694, options [nop,nop,TS val 1582512533 ecr 2000652041], length 1418
   26  13:33:09.716913 IP 80.14.211.130.bc.googleusercontent.com.https > usertekiiphone.57345: Flags [.], seq 8463:9881, ack 2293, win 1694, options [nop,nop,TS val 1582512533 ecr 2000652041], length 1418
   27  13:33:09.716915 IP 80.14.211.130.bc.googleusercontent.com.https > usertekiiphone.57345: Flags [.], seq 9881:11299, ack 2293, win 1694, options [nop,nop,TS val 1582512533 ecr 2000652041], length 1418
   28  13:33:09.716917 IP 80.14.211.130.bc.googleusercontent.com.https > usertekiiphone.57345: Flags [P.], seq 11299:11842, ack 2293, win 1694, options [nop,nop,TS val 1582512533 ecr 2000652041], length 543
   29  13:33:09.716918 IP 80.14.211.130.bc.googleusercontent.com.https > usertekiiphone.57345: Flags [.], seq 11842:13260, ack 2293, win 1694, options [nop,nop,TS val 1582512533 ecr 2000652041], length 1418
   30  13:33:09.716920 IP 80.14.211.130.bc.googleusercontent.com.https > usertekiiphone.57345: Flags [.], seq 13260:14678, ack 2293, win 1694, options [nop,nop,TS val 1582512533 ecr 2000652041], length 1418
   31  13:33:09.716923 IP 80.14.211.130.bc.googleusercontent.com.https > usertekiiphone.57345: Flags [P.], seq 14678:15031, ack 2293, win 1694, options [nop,nop,TS val 1582512533 ecr 2000652041], length 353
   32  13:33:09.716924 IP 80.14.211.130.bc.googleusercontent.com.https > usertekiiphone.57345: Flags [.], seq 15031:16449, ack 2293, win 1694, options [nop,nop,TS val 1582512534 ecr 2000652041], length 1418
   33  13:33:09.716925 IP 80.14.211.130.bc.googleusercontent.com.https > usertekiiphone.57345: Flags [.], seq 16449:17867, ack 2293, win 1694, options [nop,nop,TS val 1582512534 ecr 2000652041], length 1418
   34  13:33:09.716927 IP 80.14.211.130.bc.googleusercontent.com.https > usertekiiphone.57345: Flags [.], seq 17867:19285, ack 2293, win 1694, options [nop,nop,TS val 1582512534 ecr 2000652041], length 1418
   35  13:33:09.716929 IP 80.14.211.130.bc.googleusercontent.com.https > usertekiiphone.57345: Flags [.], seq 19285:20703, ack 2293, win 1694, options [nop,nop,TS val 1582512534 ecr 2000652041], length 1418
   36  13:33:09.716930 IP 80.14.211.130.bc.googleusercontent.com.https > usertekiiphone.57345: Flags [P.], seq 20703:22000, ack 2293, win 1694, options [nop,nop,TS val 1582512534 ecr 2000652041], length 1297
   37  13:33:09.716934 IP 80.14.211.130.bc.googleusercontent.com.https > usertekiiphone.57345: Flags [.], seq 22000:23418, ack 2293, win 1694, options [nop,nop,TS val 1582512534 ecr 2000652041], length 1418
   38  13:33:09.716939 IP 80.14.211.130.bc.googleusercontent.com.https > usertekiiphone.57345: Flags [.], seq 23418:24836, ack 2293, win 1694, options [nop,nop,TS val 1582512534 ecr 2000652041], length 1418
   39  13:33:09.716941 IP 80.14.211.130.bc.googleusercontent.com.https > usertekiiphone.57345: Flags [.], seq 24836:26254, ack 2293, win 1694, options [nop,nop,TS val 1582512534 ecr 2000652041], length 1418
   40  13:33:09.716945 IP 80.14.211.130.bc.googleusercontent.com.https > usertekiiphone.57345: Flags [.], seq 26254:27672, ack 2293, win 1694, options [nop,nop,TS val 1582512534 ecr 2000652041], length 1418
   41  13:33:09.716950 IP 80.14.211.130.bc.googleusercontent.com.https > usertekiiphone.57345: Flags [.], seq 27672:29090, ack 2293, win 1694, options [nop,nop,TS val 1582512534 ecr 2000652041], length 1418
   42  13:33:09.716952 IP 80.14.211.130.bc.googleusercontent.com.https > usertekiiphone.57345: Flags [.], seq 29090:30508, ack 2293, win 1694, options [nop,nop,TS val 1582512534 ecr 2000652041], length 1418
   43  13:33:09.716954 IP 80.14.211.130.bc.googleusercontent.com.https > usertekiiphone.57345: Flags [.], seq 30508:31926, ack 2293, win 1694, options [nop,nop,TS val 1582512534 ecr 2000652041], length 1418
   44  13:33:09.716956 IP 80.14.211.130.bc.googleusercontent.com.https > usertekiiphone.57345: Flags [.], seq 31926:33344, ack 2293, win 1694, options [nop,nop,TS val 1582512534 ecr 2000652041], length 1418
   45  13:33:09.716958 IP 80.14.211.130.bc.googleusercontent.com.https > usertekiiphone.57345: Flags [P.], seq 33344:33462, ack 2293, win 1694, options [nop,nop,TS val 1582512534 ecr 2000652041], length 118
   46  13:33:09.716960 IP 80.14.211.130.bc.googleusercontent.com.https > usertekiiphone.57345: Flags [.], seq 33462:34880, ack 2293, win 1694, options [nop,nop,TS val 1582512534 ecr 2000652041], length 1418
   47  13:33:09.716963 IP 80.14.211.130.bc.googleusercontent.com.https > usertekiiphone.57345: Flags [P.], seq 34880:35145, ack 2293, win 1694, options [nop,nop,TS val 1582512534 ecr 2000652041], length 265
   48  13:33:09.716964 IP 80.14.211.130.bc.googleusercontent.com.https > usertekiiphone.57345: Flags [.], seq 35145:36563, ack 2293, win 1694, options [nop,nop,TS val 1582512534 ecr 2000652041], length 1418
   49  13:33:09.716969 IP 80.14.211.130.bc.googleusercontent.com.https > usertekiiphone.57345: Flags [.], seq 36563:37981, ack 2293, win 1694, options [nop,nop,TS val 1582512534 ecr 2000652041], length 1418
   50  13:33:09.716970 IP 80.14.211.130.bc.googleusercontent.com.https > usertekiiphone.57345: Flags [.], seq 37981:39399, ack 2293, win 1694, options [nop,nop,TS val 1582512534 ecr 2000652041], length 1418
   51  13:33:09.716973 IP 80.14.211.130.bc.googleusercontent.com.https > usertekiiphone.57345: Flags [.], seq 39399:40817, ack 2293, win 1694, options [nop,nop,TS val 1582512534 ecr 2000652041], length 1418
   52  13:33:09.716975 IP 80.14.211.130.bc.googleusercontent.com.https > usertekiiphone.57345: Flags [P.], seq 40817:41412, ack 2293, win 1694, options [nop,nop,TS val 1582512534 ecr 2000652041], length 595
   53  13:33:09.718625 IP usertekiiphone.57345 > 80.14.211.130.bc.googleusercontent.com.https: Flags [.], ack 15031, win 3626, options [nop,nop,TS val 2000652371 ecr 1582512533], length 0
   54  13:33:09.718627 IP usertekiiphone.57345 > 80.14.211.130.bc.googleusercontent.com.https: Flags [.], ack 30508, win 3142, options [nop,nop,TS val 2000652371 ecr 1582512534], length 0
   55  13:33:09.718629 IP usertekiiphone.57345 > 80.14.211.130.bc.googleusercontent.com.https: Flags [.], ack 41412, win 2801, options [nop,nop,TS val 2000652371 ecr 1582512534], length 0
   56  13:33:09.718630 IP usertekiiphone.57345 > 80.14.211.130.bc.googleusercontent.com.https: Flags [.], ack 41412, win 4096, options [nop,nop,TS val 2000652371 ecr 1582512534], length 0
   57  13:33:09.719477 IP usertekiiphone.57345 > 80.14.211.130.bc.googleusercontent.com.https: Flags [P.], seq 2293:2332, ack 41412, win 4096, options [nop,nop,TS val 2000652373 ecr 1582512534], length 39
   58  13:33:09.722287 IP 80.14.211.130.bc.googleusercontent.com.https > usertekiiphone.57345: Flags [.], ack 2332, win 1694, options [nop,nop,TS val 1582512631 ecr 2000652373], length 0
   59  13:33:10.276401 IP 0.0.0.0.bootpc > broadcasthost.bootps: BOOTP/DHCP, Request from 6a:db:ca:c7:c7:6a (oui Unknown), length 300
   60  13:33:10.899240 IP 0.0.0.0.bootpc > broadcasthost.bootps: BOOTP/DHCP, Request from 6a:db:ca:c7:c7:6c (oui Unknown), length 300
   61  13:33:11.098903 IP usertekiiphone.51608 > nslabs-mbp.56756: Flags [.], ack 2057936285, win 4096, length 0
   62  13:33:11.161174 IP nslabs-mbp.56756 > usertekiiphone.51608: Flags [.], ack 1, win 2048, options [nop,nop,TS val 2534312819 ecr 1189992547], length 0
   63  13:33:16.370535 IP nslabs-macbook-pro.local.mdns > 224.0.0.251.mdns: 0 [2q] SRV (QU)? ncm._remoted._tcp.local. TXT (QU)? ncm._remoted._tcp.local. (47)
   64  13:33:16.370657 IP6 nslabs-macbook-pro.local.mdns > ff02::fb.mdns: 0 [2q] SRV (QU)? ncm._remoted._tcp.local. TXT (QU)? ncm._remoted._tcp.local. (47)
   65  13:33:17.373243 IP nslabs-macbook-pro.local.mdns > 224.0.0.251.mdns: 0 [2q] SRV (QM)? ncm._remoted._tcp.local. TXT (QM)? ncm._remoted._tcp.local. (47)
   66  13:33:17.373352 IP6 nslabs-macbook-pro.local.mdns > ff02::fb.mdns: 0 [2q] SRV (QM)? ncm._remoted._tcp.local. TXT (QM)? ncm._remoted._tcp.local. (47)
   67  13:33:18.522818 IP 0.0.0.0.bootpc > broadcasthost.bootps: BOOTP/DHCP, Request from 6a:db:ca:c7:c7:6a (oui Unknown), length 300
   68  13:33:18.963438 IP 0.0.0.0.bootpc > broadcasthost.bootps: BOOTP/DHCP, Request from 6a:db:ca:c7:c7:6c (oui Unknown), length 300
   69  13:33:19.205032 IP usertekiiphone.57345 > 80.14.211.130.bc.googleusercontent.com.https: Flags [P.], seq 2332:2390, ack 41412, win 4096, options [nop,nop,TS val 2000661856 ecr 1582512631], length 58
   70  13:33:19.205751 IP usertekiiphone.57345 > 80.14.211.130.bc.googleusercontent.com.https: Flags [.], seq 2390:3808, ack 41412, win 4096, options [nop,nop,TS val 2000661856 ecr 1582512631], length 1418
   71  13:33:19.205791 IP usertekiiphone.57345 > 80.14.211.130.bc.googleusercontent.com.https: Flags [P.], seq 3808:4337, ack 41412, win 4096, options [nop,nop,TS val 2000661856 ecr 1582512631], length 529
   72  13:33:19.206185 IP usertekiiphone.57345 > 80.14.211.130.bc.googleusercontent.com.https: Flags [P.], seq 4337:4368, ack 41412, win 4096, options [nop,nop,TS val 2000661857 ecr 1582512631], length 31
   73  13:33:19.207850 IP 80.14.211.130.bc.googleusercontent.com.https > usertekiiphone.57345: Flags [.], ack 2390, win 1694, options [nop,nop,TS val 1582522115 ecr 2000661856], length 0
   74  13:33:19.208861 IP 80.14.211.130.bc.googleusercontent.com.https > usertekiiphone.57345: Flags [.], ack 3808, win 1705, options [nop,nop,TS val 1582522116 ecr 2000661856], length 0
   75  13:33:19.208862 IP 80.14.211.130.bc.googleusercontent.com.https > usertekiiphone.57345: Flags [.], ack 4337, win 1716, options [nop,nop,TS val 1582522116 ecr 2000661856], length 0
   76  13:33:19.208864 IP 80.14.211.130.bc.googleusercontent.com.https > usertekiiphone.57345: Flags [.], ack 4368, win 1716, options [nop,nop,TS val 1582522116 ecr 2000661857], length 0
   77  13:33:19.420392 IP 80.14.211.130.bc.googleusercontent.com.https > usertekiiphone.57345: Flags [P.], seq 41412:41474, ack 4368, win 1716, options [nop,nop,TS val 1582522326 ecr 2000661857], length 62
   78  13:33:19.420395 IP 80.14.211.130.bc.googleusercontent.com.https > usertekiiphone.57345: Flags [P.], seq 41474:42892, ack 4368, win 1716, options [nop,nop,TS val 1582522326 ecr 2000661857], length 1418
   79  13:33:19.420398 IP 80.14.211.130.bc.googleusercontent.com.https > usertekiiphone.57345: Flags [P.], seq 42892:43587, ack 4368, win 1716, options [nop,nop,TS val 1582522326 ecr 2000661857], length 695
   80  13:33:19.420400 IP 80.14.211.130.bc.googleusercontent.com.https > usertekiiphone.57345: Flags [P.], seq 43587:43626, ack 4368, win 1716, options [nop,nop,TS val 1582522326 ecr 2000661857], length 39
   81  13:33:19.442469 IP usertekiiphone.57345 > 80.14.211.130.bc.googleusercontent.com.https: Flags [.], ack 43626, win 4026, options [nop,nop,TS val 2000662090 ecr 1582522326], length 0
   82  13:33:19.446463 IP usertekiiphone.57345 > 80.14.211.130.bc.googleusercontent.com.https: Flags [P.], seq 4368:4407, ack 43626, win 4096, options [nop,nop,TS val 2000662094 ecr 1582522326], length 39
   83  13:33:19.448944 IP 80.14.211.130.bc.googleusercontent.com.https > usertekiiphone.57345: Flags [.], ack 4407, win 1716, options [nop,nop,TS val 1582522356 ecr 2000662094], length 0
   84  13:33:19.470246 IP usertekiiphone.57345 > 80.14.211.130.bc.googleusercontent.com.https: Flags [P.], seq 4407:4465, ack 43626, win 4096, options [nop,nop,TS val 2000662116 ecr 1582522356], length 58
   85  13:33:19.470740 IP usertekiiphone.57345 > 80.14.211.130.bc.googleusercontent.com.https: Flags [.], seq 4465:5883, ack 43626, win 4096, options [nop,nop,TS val 2000662116 ecr 1582522356], length 1418
   86  13:33:19.470855 IP usertekiiphone.57345 > 80.14.211.130.bc.googleusercontent.com.https: Flags [P.], seq 5883:6132, ack 43626, win 4096, options [nop,nop,TS val 2000662116 ecr 1582522356], length 249
   87  13:33:19.484942 IP usertekiiphone.57345 > 80.14.211.130.bc.googleusercontent.com.https: Flags [P.], seq 4714:6132, ack 43626, win 4096, options [nop,nop,TS val 2000662130 ecr 1582522356], length 1418
   88  13:33:19.551505 IP 80.14.211.130.bc.googleusercontent.com.https > usertekiiphone.57345: Flags [.], ack 4465, win 1716, options [nop,nop,TS val 1582522459 ecr 2000662116], length 0
   89  13:33:19.551699 IP 80.14.211.130.bc.googleusercontent.com.https > usertekiiphone.57345: Flags [.], ack 5883, win 1727, options [nop,nop,TS val 1582522459 ecr 2000662116], length 0
   90  13:33:19.551701 IP 80.14.211.130.bc.googleusercontent.com.https > usertekiiphone.57345: Flags [.], ack 6132, win 1738, options [nop,nop,TS val 1582522459 ecr 2000662116], length 0
   91  13:33:19.551702 IP 80.14.211.130.bc.googleusercontent.com.https > usertekiiphone.57345: Flags [.], ack 6132, win 1738, options [nop,nop,TS val 1582522459 ecr 2000662130,nop,nop,sack 1 {4714:6132}], length 0
   92  13:33:19.859492 IP 80.14.211.130.bc.googleusercontent.com.https > usertekiiphone.57345: Flags [P.], seq 43626:43688, ack 6132, win 1738, options [nop,nop,TS val 1582522741 ecr 2000662130], length 62
   93  13:33:19.859494 IP 80.14.211.130.bc.googleusercontent.com.https > usertekiiphone.57345: Flags [P.], seq 43688:45106, ack 6132, win 1738, options [nop,nop,TS val 1582522741 ecr 2000662130], length 1418
   94  13:33:19.859497 IP 80.14.211.130.bc.googleusercontent.com.https > usertekiiphone.57345: Flags [P.], seq 45106:46524, ack 6132, win 1738, options [nop,nop,TS val 1582522741 ecr 2000662130], length 1418
   95  13:33:19.859499 IP 80.14.211.130.bc.googleusercontent.com.https > usertekiiphone.57345: Flags [P.], seq 46524:47801, ack 6132, win 1738, options [nop,nop,TS val 1582522741 ecr 2000662130], length 1277
   96  13:33:19.859501 IP 80.14.211.130.bc.googleusercontent.com.https > usertekiiphone.57345: Flags [P.], seq 47801:49219, ack 6132, win 1738, options [nop,nop,TS val 1582522743 ecr 2000662130], length 1418
   97  13:33:19.859503 IP 80.14.211.130.bc.googleusercontent.com.https > usertekiiphone.57345: Flags [.], seq 49219:50637, ack 6132, win 1738, options [nop,nop,TS val 1582522743 ecr 2000662130], length 1418
   98  13:33:19.859505 IP 80.14.211.130.bc.googleusercontent.com.https > usertekiiphone.57345: Flags [P.], seq 50637:52033, ack 6132, win 1738, options [nop,nop,TS val 1582522743 ecr 2000662130], length 1396
   99  13:33:19.860447 IP 80.14.211.130.bc.googleusercontent.com.https > usertekiiphone.57345: Flags [P.], seq 52033:53451, ack 6132, win 1738, options [nop,nop,TS val 1582522744 ecr 2000662130], length 1418
  100  13:33:19.860450 IP 80.14.211.130.bc.googleusercontent.com.https > usertekiiphone.57345: Flags [.], seq 53451:54869, ack 6132, win 1738, options [nop,nop,TS val 1582522745 ecr 2000662130], length 1418
  101  13:33:19.860452 IP 80.14.211.130.bc.googleusercontent.com.https > usertekiiphone.57345: Flags [P.], seq 54869:56217, ack 6132, win 1738, options [nop,nop,TS val 1582522745 ecr 2000662130], length 1348
  102  13:33:19.860455 IP 80.14.211.130.bc.googleusercontent.com.https > usertekiiphone.57345: Flags [P.], seq 56217:57635, ack 6132, win 1738, options [nop,nop,TS val 1582522746 ecr 2000662130], length 1418
  103  13:33:19.860457 IP 80.14.211.130.bc.googleusercontent.com.https > usertekiiphone.57345: Flags [P.], seq 57635:58139, ack 6132, win 1738, options [nop,nop,TS val 1582522746 ecr 2000662130], length 504
  104  13:33:19.860459 IP 80.14.211.130.bc.googleusercontent.com.https > usertekiiphone.57345: Flags [P.], seq 58139:59557, ack 6132, win 1738, options [nop,nop,TS val 1582522748 ecr 2000662130], length 1418
  105  13:33:19.860461 IP 80.14.211.130.bc.googleusercontent.com.https > usertekiiphone.57345: Flags [.], seq 59557:60975, ack 6132, win 1738, options [nop,nop,TS val 1582522748 ecr 2000662130], length 1418
  106  13:33:19.860463 IP 80.14.211.130.bc.googleusercontent.com.https > usertekiiphone.57345: Flags [P.], seq 60975:62393, ack 6132, win 1738, options [nop,nop,TS val 1582522748 ecr 2000662130], length 1418
  107  13:33:19.860465 IP 80.14.211.130.bc.googleusercontent.com.https > usertekiiphone.57345: Flags [P.], seq 62393:62573, ack 6132, win 1738, options [nop,nop,TS val 1582522748 ecr 2000662130], length 180
  108  13:33:19.860466 IP 80.14.211.130.bc.googleusercontent.com.https > usertekiiphone.57345: Flags [P.], seq 62573:63991, ack 6132, win 1738, options [nop,nop,TS val 1582522749 ecr 2000662130], length 1418
  109  13:33:19.860468 IP 80.14.211.130.bc.googleusercontent.com.https > usertekiiphone.57345: Flags [.], seq 63991:65409, ack 6132, win 1738, options [nop,nop,TS val 1582522749 ecr 2000662130], length 1418
  110  13:33:19.860470 IP 80.14.211.130.bc.googleusercontent.com.https > usertekiiphone.57345: Flags [P.], seq 65409:66827, ack 6132, win 1738, options [nop,nop,TS val 1582522749 ecr 2000662130], length 1418
  111  13:33:19.860472 IP 80.14.211.130.bc.googleusercontent.com.https > usertekiiphone.57345: Flags [P.], seq 66827:66965, ack 6132, win 1738, options [nop,nop,TS val 1582522749 ecr 2000662130], length 138
  112  13:33:19.860473 IP 80.14.211.130.bc.googleusercontent.com.https > usertekiiphone.57345: Flags [P.], seq 66965:68383, ack 6132, win 1738, options [nop,nop,TS val 1582522752 ecr 2000662130], length 1418
  113  13:33:19.860475 IP 80.14.211.130.bc.googleusercontent.com.https > usertekiiphone.57345: Flags [.], seq 68383:69801, ack 6132, win 1738, options [nop,nop,TS val 1582522752 ecr 2000662130], length 1418
  114  13:33:19.860477 IP 80.14.211.130.bc.googleusercontent.com.https > usertekiiphone.57345: Flags [P.], seq 69801:71219, ack 6132, win 1738, options [nop,nop,TS val 1582522752 ecr 2000662130], length 1418
  115  13:33:19.860478 IP 80.14.211.130.bc.googleusercontent.com.https > usertekiiphone.57345: Flags [P.], seq 71219:71296, ack 6132, win 1738, options [nop,nop,TS val 1582522752 ecr 2000662130], length 77
  116  13:33:19.860480 IP 80.14.211.130.bc.googleusercontent.com.https > usertekiiphone.57345: Flags [P.], seq 71296:72714, ack 6132, win 1738, options [nop,nop,TS val 1582522753 ecr 2000662130], length 1418
  117  13:33:19.860481 IP 80.14.211.130.bc.googleusercontent.com.https > usertekiiphone.57345: Flags [.], seq 72714:74132, ack 6132, win 1738, options [nop,nop,TS val 1582522753 ecr 2000662130], length 1418
  118  13:33:19.860483 IP 80.14.211.130.bc.googleusercontent.com.https > usertekiiphone.57345: Flags [P.], seq 74132:75550, ack 6132, win 1738, options [nop,nop,TS val 1582522753 ecr 2000662130], length 1418
  119  13:33:19.860486 IP 80.14.211.130.bc.googleusercontent.com.https > usertekiiphone.57345: Flags [P.], seq 75550:75637, ack 6132, win 1738, options [nop,nop,TS val 1582522753 ecr 2000662130], length 87
  120  13:33:19.860487 IP 80.14.211.130.bc.googleusercontent.com.https > usertekiiphone.57345: Flags [P.], seq 75637:77055, ack 6132, win 1738, options [nop,nop,TS val 1582522754 ecr 2000662130], length 1418
  121  13:33:19.860488 IP 80.14.211.130.bc.googleusercontent.com.https > usertekiiphone.57345: Flags [.], seq 77055:78473, ack 6132, win 1738, options [nop,nop,TS val 1582522754 ecr 2000662130], length 1418
  122  13:33:19.860490 IP 80.14.211.130.bc.googleusercontent.com.https > usertekiiphone.57345: Flags [P.], seq 78473:79891, ack 6132, win 1738, options [nop,nop,TS val 1582522754 ecr 2000662130], length 1418
  123  13:33:19.860493 IP 80.14.211.130.bc.googleusercontent.com.https > usertekiiphone.57345: Flags [P.], seq 79891:79999, ack 6132, win 1738, options [nop,nop,TS val 1582522754 ecr 2000662130], length 108
  124  13:33:19.860494 IP 80.14.211.130.bc.googleusercontent.com.https > usertekiiphone.57345: Flags [P.], seq 79999:81417, ack 6132, win 1738, options [nop,nop,TS val 1582522755 ecr 2000662130], length 1418
  125  13:33:19.860496 IP 80.14.211.130.bc.googleusercontent.com.https > usertekiiphone.57345: Flags [P.], seq 81417:82600, ack 6132, win 1738, options [nop,nop,TS val 1582522755 ecr 2000662130], length 1183
  126  13:33:19.860498 IP 80.14.211.130.bc.googleusercontent.com.https > usertekiiphone.57345: Flags [P.], seq 82600:82639, ack 6132, win 1738, options [nop,nop,TS val 1582522755 ecr 2000662130], length 39
  127  13:33:19.865865 IP usertekiiphone.57345 > 80.14.211.130.bc.googleusercontent.com.https: Flags [.], ack 52033, win 3833, options [nop,nop,TS val 2000662508 ecr 1582522743], length 0
  128  13:33:19.865868 IP usertekiiphone.57345 > 80.14.211.130.bc.googleusercontent.com.https: Flags [.], ack 66965, win 3366, options [nop,nop,TS val 2000662508 ecr 1582522749], length 0
  129  13:33:19.865869 IP usertekiiphone.57345 > 80.14.211.130.bc.googleusercontent.com.https: Flags [.], ack 82639, win 2876, options [nop,nop,TS val 2000662508 ecr 1582522755], length 0
  130  13:33:19.865870 IP usertekiiphone.57345 > 80.14.211.130.bc.googleusercontent.com.https: Flags [.], ack 82639, win 4096, options [nop,nop,TS val 2000662508 ecr 1582522755], length 0
  131  13:33:19.868102 IP usertekiiphone.57345 > 80.14.211.130.bc.googleusercontent.com.https: Flags [P.], seq 6132:6171, ack 82639, win 4096, options [nop,nop,TS val 2000662511 ecr 1582522755], length 39
  132  13:33:19.870570 IP 80.14.211.130.bc.googleusercontent.com.https > usertekiiphone.57345: Flags [.], ack 6171, win 1738, options [nop,nop,TS val 1582522778 ecr 2000662511], length 0
  133  13:33:20.381032 IP nslabs-macbook-pro.local.mdns > 224.0.0.251.mdns: 0 [2q] SRV (QM)? ncm._remoted._tcp.local. TXT (QM)? ncm._remoted._tcp.local. (47)
  134  13:33:20.381116 IP6 nslabs-macbook-pro.local.mdns > ff02::fb.mdns: 0 [2q] SRV (QM)? ncm._remoted._tcp.local. TXT (QM)? ncm._remoted._tcp.local. (47)
  135  13:33:26.673836 IP 0.0.0.0.bootpc > broadcasthost.bootps: BOOTP/DHCP, Request from 6a:db:ca:c7:c7:6a (oui Unknown), length 300
  136  13:33:27.874961 IP 0.0.0.0.bootpc > broadcasthost.bootps: BOOTP/DHCP, Request from 6a:db:ca:c7:c7:6c (oui Unknown), length 300
  137  13:33:29.402074 IP nslabs-macbook-pro.local.mdns > 224.0.0.251.mdns: 0 [2q] SRV (QM)? ncm._remoted._tcp.local. TXT (QM)? ncm._remoted._tcp.local. (47)
  138  13:33:29.402090 IP6 nslabs-macbook-pro.local.mdns > ff02::fb.mdns: 0 [2q] SRV (QM)? ncm._remoted._tcp.local. TXT (QM)? ncm._remoted._tcp.local. (47)
  139  13:33:31.163442 IP 80.14.211.130.bc.googleusercontent.com.https > usertekiiphone.52151: Flags [F.], seq 2194550511, ack 4122583071, win 276, options [nop,nop,TS val 2159070069 ecr 3630754863], length 0
  140  13:33:31.163602 IP usertekiiphone.52151 > 80.14.211.130.bc.googleusercontent.com.https: Flags [.], ack 1, win 4103, options [nop,nop,TS val 3630814872 ecr 2159070069], length 0
  141  13:33:31.190269 IP usertekiiphone.52151 > 80.14.211.130.bc.googleusercontent.com.https: Flags [F.], seq 1, ack 1, win 4103, options [nop,nop,TS val 3630814897 ecr 2159070069], length 0
  142  13:33:31.192614 IP 80.14.211.130.bc.googleusercontent.com.https > usertekiiphone.52151: Flags [.], ack 2, win 276, options [nop,nop,TS val 2159070176 ecr 3630814897], length 0
  143  13:33:32.194988 IP usertekiiphone.52927 > dlinkrouter.domain: 63469+ A? pgorelease.nianticlabs.com. (44)
  144  13:33:32.198669 IP usertekiiphone.52152 > 80.14.211.130.bc.googleusercontent.com.https: Flags [S], seq 3070011202, win 65535, options [mss 1460,nop,wscale 5,nop,nop,TS val 2685434080 ecr 0,sackOK,eol], length 0
  145  13:33:32.257110 IP 80.14.211.130.bc.googleusercontent.com.https > usertekiiphone.52152: Flags [S.], seq 197149497, ack 3070011203, win 65535, options [mss 1430,sackOK,TS val 1296862822 ecr 2685434080,nop,wscale 8], length 0
  146  13:33:32.257256 IP usertekiiphone.52152 > 80.14.211.130.bc.googleusercontent.com.https: Flags [.], ack 1, win 4121, options [nop,nop,TS val 2685434138 ecr 1296862822], length 0
  147  13:33:32.259439 IP usertekiiphone.52152 > 80.14.211.130.bc.googleusercontent.com.https: Flags [P.], seq 1:219, ack 1, win 4121, options [nop,nop,TS val 2685434140 ecr 1296862822], length 218
  148  13:33:32.261740 IP 80.14.211.130.bc.googleusercontent.com.https > usertekiiphone.52152: Flags [.], ack 219, win 261, options [nop,nop,TS val 1296862827 ecr 2685434140], length 0
  149  13:33:32.263936 IP 80.14.211.130.bc.googleusercontent.com.https > usertekiiphone.52152: Flags [.], seq 1:1419, ack 219, win 261, options [nop,nop,TS val 1296862829 ecr 2685434140], length 1418
  150  13:33:32.263938 IP 80.14.211.130.bc.googleusercontent.com.https > usertekiiphone.52152: Flags [.], seq 1419:2837, ack 219, win 261, options [nop,nop,TS val 1296862829 ecr 2685434140], length 1418
  151  13:33:32.263940 IP 80.14.211.130.bc.googleusercontent.com.https > usertekiiphone.52152: Flags [P.], seq 2837:3501, ack 219, win 261, options [nop,nop,TS val 1296862829 ecr 2685434140], length 664
  152  13:33:32.264035 IP usertekiiphone.52152 > 80.14.211.130.bc.googleusercontent.com.https: Flags [.], ack 3501, win 4011, options [nop,nop,TS val 2685434144 ecr 1296862829], length 0
  153  13:33:32.284972 IP dlinkrouter.domain > usertekiiphone.52927: 63469 1/0/0 A 130.211.14.80 (60)
  154  13:33:32.298791 IP usertekiiphone.52152 > 80.14.211.130.bc.googleusercontent.com.https: Flags [P.], seq 219:294, ack 3501, win 4096, options [nop,nop,TS val 2685434177 ecr 1296862829], length 75
  155  13:33:32.430656 IP 80.14.211.130.bc.googleusercontent.com.https > usertekiiphone.52152: Flags [.], ack 294, win 261, options [nop,nop,TS val 1296862872 ecr 2685434177], length 0
  156  13:33:32.430803 IP usertekiiphone.52152 > 80.14.211.130.bc.googleusercontent.com.https: Flags [P.], seq 294:345, ack 3501, win 4096, options [nop,nop,TS val 2685434308 ecr 1296862872], length 51
  157  13:33:32.433942 IP 80.14.211.130.bc.googleusercontent.com.https > usertekiiphone.52152: Flags [.], ack 345, win 261, options [nop,nop,TS val 1296862999 ecr 2685434308], length 0
  158  13:33:32.434293 IP 80.14.211.130.bc.googleusercontent.com.https > usertekiiphone.52152: Flags [P.], seq 3501:3552, ack 345, win 261, options [nop,nop,TS val 1296862999 ecr 2685434308], length 51
  159  13:33:32.434359 IP usertekiiphone.52152 > 80.14.211.130.bc.googleusercontent.com.https: Flags [.], ack 3552, win 4094, options [nop,nop,TS val 2685434311 ecr 1296862999], length 0
  160  13:33:32.444477 IP usertekiiphone.52152 > 80.14.211.130.bc.googleusercontent.com.https: Flags [P.], seq 345:637, ack 3552, win 4096, options [nop,nop,TS val 2685434321 ecr 1296862999], length 292
  161  13:33:32.451335 IP 80.14.211.130.bc.googleusercontent.com.https > usertekiiphone.52152: Flags [.], ack 637, win 265, options [nop,nop,TS val 1296863017 ecr 2685434321], length 0
  162  13:33:32.780747 IP 80.14.211.130.bc.googleusercontent.com.https > usertekiiphone.52152: Flags [P.], seq 3552:3802, ack 637, win 265, options [nop,nop,TS val 1296863175 ecr 2685434321], length 250
  163  13:33:32.780892 IP usertekiiphone.52152 > 80.14.211.130.bc.googleusercontent.com.https: Flags [.], ack 3802, win 4088, options [nop,nop,TS val 2685434655 ecr 1296863175], length 0
  164  13:33:32.924403 IP usertekiiphone.52152 > 80.14.211.130.bc.googleusercontent.com.https: Flags [.], seq 637:2055, ack 3802, win 4096, options [nop,nop,TS val 2685434797 ecr 1296863175], length 1418
  165  13:33:32.924421 IP usertekiiphone.52152 > 80.14.211.130.bc.googleusercontent.com.https: Flags [P.], seq 2055:2174, ack 3802, win 4096, options [nop,nop,TS val 2685434797 ecr 1296863175], length 119
  166  13:33:32.926937 IP 80.14.211.130.bc.googleusercontent.com.https > usertekiiphone.52152: Flags [.], ack 2055, win 276, options [nop,nop,TS val 1296863492 ecr 2685434797], length 0
  167  13:33:32.926939 IP 80.14.211.130.bc.googleusercontent.com.https > usertekiiphone.52152: Flags [.], ack 2174, win 276, options [nop,nop,TS val 1296863492 ecr 2685434797], length 0
  168  13:33:33.173992 IP 80.14.211.130.bc.googleusercontent.com.https > usertekiiphone.52152: Flags [P.], seq 3802:3971, ack 2174, win 276, options [nop,nop,TS val 1296863654 ecr 2685434797], length 169
  169  13:33:33.174071 IP usertekiiphone.52152 > 80.14.211.130.bc.googleusercontent.com.https: Flags [.], ack 3971, win 4090, options [nop,nop,TS val 2685435045 ecr 1296863654], length 0
  170  13:33:34.689748 IP 0.0.0.0.bootpc > broadcasthost.bootps: BOOTP/DHCP, Request from 6a:db:ca:c7:c7:6a (oui Unknown), length 300
  171  13:33:36.763443 IP 0.0.0.0.bootpc > broadcasthost.bootps: BOOTP/DHCP, Request from 6a:db:ca:c7:c7:6c (oui Unknown), length 300
  172  13:33:37.410086 ARP, Request who-has usertekiiphone tell dlinkrouter, length 28
  173  13:33:37.410114 ARP, Reply usertekiiphone is-at 42:55:64:8e:cb:27 (oui Unknown), length 28
  174  13:33:37.551174 IP nslabs-macbook-pro.local.mdns > 224.0.0.251.mdns: 0 [2q] SRV (QU)? ncm._remoted._tcp.local. TXT (QU)? ncm._remoted._tcp.local. (47)
  175  13:33:37.551246 IP6 nslabs-macbook-pro.local.mdns > ff02::fb.mdns: 0 [2q] SRV (QU)? ncm._remoted._tcp.local. TXT (QU)? ncm._remoted._tcp.local. (47)
  176  13:33:37.910995 IP usertekiiphone.57345 > 80.14.211.130.bc.googleusercontent.com.https: Flags [P.], seq 6171:6229, ack 82639, win 4096, options [nop,nop,TS val 2000680550 ecr 1582522778], length 58
  177  13:33:37.911500 IP usertekiiphone.57345 > 80.14.211.130.bc.googleusercontent.com.https: Flags [P.], seq 6229:7504, ack 82639, win 4096, options [nop,nop,TS val 2000680552 ecr 1582522778], length 1275
  178  13:33:38.025067 IP 80.14.211.130.bc.googleusercontent.com.https > usertekiiphone.57345: Flags [.], ack 6229, win 1738, options [nop,nop,TS val 1582540932 ecr 2000680550], length 0
  179  13:33:38.025068 IP 80.14.211.130.bc.googleusercontent.com.https > usertekiiphone.57345: Flags [.], ack 7504, win 1749, options [nop,nop,TS val 1582540932 ecr 2000680552], length 0
  180  13:33:38.230536 IP 80.14.211.130.bc.googleusercontent.com.https > usertekiiphone.57345: Flags [P.], seq 82639:82701, ack 7504, win 1749, options [nop,nop,TS val 1582541094 ecr 2000680552], length 62
  181  13:33:38.230538 IP 80.14.211.130.bc.googleusercontent.com.https > usertekiiphone.57345: Flags [P.], seq 82701:83542, ack 7504, win 1749, options [nop,nop,TS val 1582541094 ecr 2000680552], length 841
  182  13:33:38.230539 IP 80.14.211.130.bc.googleusercontent.com.https > usertekiiphone.57345: Flags [P.], seq 83542:83738, ack 7504, win 1749, options [nop,nop,TS val 1582541094 ecr 2000680552], length 196
  183  13:33:38.230540 IP 80.14.211.130.bc.googleusercontent.com.https > usertekiiphone.57345: Flags [P.], seq 83738:83777, ack 7504, win 1749, options [nop,nop,TS val 1582541094 ecr 2000680552], length 39
  184  13:33:38.256869 IP usertekiiphone.57345 > 80.14.211.130.bc.googleusercontent.com.https: Flags [.], ack 83777, win 4060, options [nop,nop,TS val 2000680895 ecr 1582541094], length 0
  185  13:33:38.257513 IP usertekiiphone.57345 > 80.14.211.130.bc.googleusercontent.com.https: Flags [P.], seq 7504:7543, ack 83777, win 4096, options [nop,nop,TS val 2000680895 ecr 1582541094], length 39
  186  13:33:38.259949 IP 80.14.211.130.bc.googleusercontent.com.https > usertekiiphone.57345: Flags [.], ack 7543, win 1749, options [nop,nop,TS val 1582541167 ecr 2000680895], length 0
  187  13:33:38.557477 IP nslabs-macbook-pro.local.mdns > 224.0.0.251.mdns: 0 [2q] SRV (QM)? ncm._remoted._tcp.local. TXT (QM)? ncm._remoted._tcp.local. (47)
  188  13:33:38.557556 IP6 nslabs-macbook-pro.local.mdns > ff02::fb.mdns: 0 [2q] SRV (QM)? ncm._remoted._tcp.local. TXT (QM)? ncm._remoted._tcp.local. (47)
  189  13:33:41.565476 IP nslabs-macbook-pro.local.mdns > 224.0.0.251.mdns: 0 [2q] SRV (QM)? ncm._remoted._tcp.local. TXT (QM)? ncm._remoted._tcp.local. (47)
  190  13:33:41.565561 IP6 nslabs-macbook-pro.local.mdns > ff02::fb.mdns: 0 [2q] SRV (QM)? ncm._remoted._tcp.local. TXT (QM)? ncm._remoted._tcp.local. (47)
  191  13:33:42.858279 IP 0.0.0.0.bootpc > broadcasthost.bootps: BOOTP/DHCP, Request from 6a:db:ca:c7:c7:6a (oui Unknown), length 300
  192  13:33:45.281273 IP 0.0.0.0.bootpc > broadcasthost.bootps: BOOTP/DHCP, Request from 6a:db:ca:c7:c7:6c (oui Unknown), length 300
  193  13:33:50.583673 IP nslabs-macbook-pro.local.mdns > 224.0.0.251.mdns: 0 [2q] SRV (QM)? ncm._remoted._tcp.local. TXT (QM)? ncm._remoted._tcp.local. (47)
  194  13:33:50.583752 IP6 nslabs-macbook-pro.local.mdns > ff02::fb.mdns: 0 [2q] SRV (QM)? ncm._remoted._tcp.local. TXT (QM)? ncm._remoted._tcp.local. (47)
  195  13:33:50.923630 IP 0.0.0.0.bootpc > broadcasthost.bootps: BOOTP/DHCP, Request from 6a:db:ca:c7:c7:6a (oui Unknown), length 300
  196  13:33:54.245088 IP 0.0.0.0.bootpc > broadcasthost.bootps: BOOTP/DHCP, Request from 6a:db:ca:c7:c7:6c (oui Unknown), length 300
  197  13:33:58.653100 IP nslabs-macbook-pro.local.mdns > 224.0.0.251.mdns: 0 [2q] SRV (QU)? ncm._remoted._tcp.local. TXT (QU)? ncm._remoted._tcp.local. (47)
  198  13:33:58.653119 IP6 nslabs-macbook-pro.local.mdns > ff02::fb.mdns: 0 [2q] SRV (QU)? ncm._remoted._tcp.local. TXT (QU)? ncm._remoted._tcp.local. (47)
  199  13:33:59.077094 IP 0.0.0.0.bootpc > broadcasthost.bootps: BOOTP/DHCP, Request from 6a:db:ca:c7:c7:6a (oui Unknown), length 300
  200  13:33:59.655696 IP nslabs-macbook-pro.local.mdns > 224.0.0.251.mdns: 0 [2q] SRV (QM)? ncm._remoted._tcp.local. TXT (QM)? ncm._remoted._tcp.local. (47)
  201  13:33:59.655704 IP6 nslabs-macbook-pro.local.mdns > ff02::fb.mdns: 0 [2q] SRV (QM)? ncm._remoted._tcp.local. TXT (QM)? ncm._remoted._tcp.local. (47)
  202  13:33:59.795132 IP usertekiiphone.57345 > 80.14.211.130.bc.googleusercontent.com.https: Flags [P.], seq 7543:7601, ack 83777, win 4096, options [nop,nop,TS val 2000702432 ecr 1582541167], length 58
  203  13:33:59.795677 IP usertekiiphone.57345 > 80.14.211.130.bc.googleusercontent.com.https: Flags [.], seq 7601:9019, ack 83777, win 4096, options [nop,nop,TS val 2000702432 ecr 1582541167], length 1418
  204  13:33:59.795705 IP usertekiiphone.57345 > 80.14.211.130.bc.googleusercontent.com.https: Flags [P.], seq 9019:9636, ack 83777, win 4096, options [nop,nop,TS val 2000702432 ecr 1582541167], length 617
  205  13:33:59.889883 IP usertekiiphone.57345 > 80.14.211.130.bc.googleusercontent.com.https: Flags [P.], seq 8218:9636, ack 83777, win 4096, options [nop,nop,TS val 2000702525 ecr 1582541167], length 1418
  206  13:34:00.171883 IP 80.14.211.130.bc.googleusercontent.com.https > usertekiiphone.57345: Flags [.], ack 7601, win 1749, options [nop,nop,TS val 1582562946 ecr 2000702432], length 0
  207  13:34:00.171884 IP 80.14.211.130.bc.googleusercontent.com.https > usertekiiphone.57345: Flags [.], ack 9019, win 1760, options [nop,nop,TS val 1582562946 ecr 2000702432], length 0
  208  13:34:00.171885 IP 80.14.211.130.bc.googleusercontent.com.https > usertekiiphone.57345: Flags [.], ack 9636, win 1771, options [nop,nop,TS val 1582562946 ecr 2000702432], length 0
  209  13:34:00.171885 IP 80.14.211.130.bc.googleusercontent.com.https > usertekiiphone.57345: Flags [.], ack 9636, win 1771, options [nop,nop,TS val 1582562946 ecr 2000702525,nop,nop,sack 1 {8218:9636}], length 0
  210  13:34:00.302057 IP 80.14.211.130.bc.googleusercontent.com.https > usertekiiphone.57345: Flags [P.], seq 83777:83839, ack 9636, win 1771, options [nop,nop,TS val 1582563160 ecr 2000702525], length 62
  211  13:34:00.302059 IP 80.14.211.130.bc.googleusercontent.com.https > usertekiiphone.57345: Flags [P.], seq 83839:85257, ack 9636, win 1771, options [nop,nop,TS val 1582563160 ecr 2000702525], length 1418
