    1  13:51:31.447324 IP usertekiiphone.57394 > 17.248.223.2.https: Flags [S], seq 2833540674, win 65535, options [mss 1460,nop,wscale 5,nop,nop,TS val 289977149 ecr 0,sackOK,eol], length 0
    2  13:51:31.535563 IP dlinkrouter.domain > usertekiiphone.60133: 54784 1/0/0 CNAME gateway.fe.apple-dns.net. (74)
    3  13:51:31.535568 IP dlinkrouter.domain > usertekiiphone.52429: 7546 2/0/0 CNAME gateway.fe.apple-dns.net., A 17.248.223.1 (90)
    4  13:51:31.536703 IP usertekiiphone.60212 > dlinkrouter.domain: 55595+ Type65? gateway.fe.apple-dns.net. (42)
    5  13:51:31.541590 IP 17.248.223.2.https > usertekiiphone.57394: Flags [S.], seq 2131782112, ack 2833540675, win 65160, options [mss 1460,sackOK,TS val 2581810779 ecr 289977149,nop,wscale 7], length 0
    6  13:51:31.542227 IP usertekiiphone.57394 > 17.248.223.2.https: Flags [.], ack 1, win 4117, options [nop,nop,TS val 289977243 ecr 2581810779], length 0
    7  13:51:31.542227 IP usertekiiphone.57394 > 17.248.223.2.https: Flags [P.], seq 1:518, ack 1, win 4117, options [nop,nop,TS val 289977243 ecr 2581810779], length 517
    8  13:51:31.556788 IP dlinkrouter.domain > usertekiiphone.60212: 55595 0/1/0 (115)
    9  13:51:31.567671 IP 17.248.223.2.https > usertekiiphone.57394: Flags [.], ack 518, win 506, options [nop,nop,TS val 2581810806 ecr 289977243], length 0
   10  13:51:31.568437 IP 17.248.223.2.https > usertekiiphone.57394: Flags [.], seq 1:1449, ack 518, win 506, options [nop,nop,TS val 2581810806 ecr 289977243], length 1448
   11  13:51:31.568438 IP 17.248.223.2.https > usertekiiphone.57394: Flags [P.], seq 1449:2897, ack 518, win 506, options [nop,nop,TS val 2581810806 ecr 289977243], length 1448
   12  13:51:31.568439 IP 17.248.223.2.https > usertekiiphone.57394: Flags [P.], seq 2897:4097, ack 518, win 506, options [nop,nop,TS val 2581810806 ecr 289977243], length 1200
   13  13:51:31.568630 IP 17.248.223.2.https > usertekiiphone.57394: Flags [.], seq 4097:5545, ack 518, win 506, options [nop,nop,TS val 2581810806 ecr 289977243], length 1448
   14  13:51:31.568631 IP 17.248.223.2.https > usertekiiphone.57394: Flags [P.], seq 5545:6097, ack 518, win 506, options [nop,nop,TS val 2581810806 ecr 289977243], length 552
   15  13:51:31.571261 IP usertekiiphone.57394 > 17.248.223.2.https: Flags [.], ack 4097, win 3989, options [nop,nop,TS val 289977269 ecr 2581810806], length 0
   16  13:51:31.571262 IP usertekiiphone.57394 > 17.248.223.2.https: Flags [.], ack 6097, win 3927, options [nop,nop,TS val 289977269 ecr 2581810806], length 0
   17  13:51:31.571262 IP usertekiiphone.57394 > 17.248.223.2.https: Flags [.], ack 6097, win 4096, options [nop,nop,TS val 289977269 ecr 2581810806], length 0
   18  13:51:31.581385 IP usertekiiphone.57394 > 17.248.223.2.https: Flags [P.], seq 518:582, ack 6097, win 4096, options [nop,nop,TS val 289977281 ecr 2581810806], length 64
   19  13:51:31.583548 IP usertekiiphone.57394 > 17.248.223.2.https: Flags [P.], seq 582:628, ack 6097, win 4096, options [nop,nop,TS val 289977283 ecr 2581810806], length 46
   20  13:51:31.583676 IP usertekiiphone.57394 > 17.248.223.2.https: Flags [P.], seq 628:671, ack 6097, win 4096, options [nop,nop,TS val 289977283 ecr 2581810806], length 43
   21  13:51:31.583699 IP usertekiiphone.57394 > 17.248.223.2.https: Flags [P.], seq 671:706, ack 6097, win 4096, options [nop,nop,TS val 289977283 ecr 2581810806], length 35
   22  13:51:31.583723 IP usertekiiphone.57394 > 17.248.223.2.https: Flags [P.], seq 706:1834, ack 6097, win 4096, options [nop,nop,TS val 289977283 ecr 2581810806], length 1128
   23  13:51:31.584659 IP usertekiiphone.57394 > 17.248.223.2.https: Flags [.], seq 1834:3282, ack 6097, win 4096, options [nop,nop,TS val 289977284 ecr 2581810806], length 1448
   24  13:51:31.584660 IP usertekiiphone.57394 > 17.248.223.2.https: Flags [P.], seq 3282:3882, ack 6097, win 4096, options [nop,nop,TS val 289977284 ecr 2581810806], length 600
   25  13:51:31.584688 IP usertekiiphone.57394 > 17.248.223.2.https: Flags [P.], seq 3882:4149, ack 6097, win 4096, options [nop,nop,TS val 289977284 ecr 2581810806], length 267
   26  13:51:31.584914 IP usertekiiphone.57394 > 17.248.223.2.https: Flags [P.], seq 4149:4180, ack 6097, win 4096, options [nop,nop,TS val 289977284 ecr 2581810806], length 31
   27  13:51:31.608172 IP 17.248.223.2.https > usertekiiphone.57394: Flags [.], ack 582, win 506, options [nop,nop,TS val 2581810846 ecr 289977281], length 0
   28  13:51:31.608216 IP 17.248.223.2.https > usertekiiphone.57394: Flags [P.], seq 6097:6368, ack 582, win 506, options [nop,nop,TS val 2581810846 ecr 289977281], length 271
   29  13:51:31.608611 IP 17.248.223.2.https > usertekiiphone.57394: Flags [P.], seq 6368:6639, ack 582, win 506, options [nop,nop,TS val 2581810846 ecr 289977281], length 271
   30  13:51:31.608612 IP 17.248.223.2.https > usertekiiphone.57394: Flags [P.], seq 6639:6701, ack 582, win 506, options [nop,nop,TS val 2581810846 ecr 289977281], length 62
   31  13:51:31.608711 IP usertekiiphone.57394 > 17.248.223.2.https: Flags [.], ack 6368, win 4087, options [nop,nop,TS val 289977307 ecr 2581810846], length 0
   32  13:51:31.609089 IP usertekiiphone.57394 > 17.248.223.2.https: Flags [.], ack 6701, win 4085, options [nop,nop,TS val 289977307 ecr 2581810846], length 0
   33  13:51:31.609269 IP usertekiiphone.57394 > 17.248.223.2.https: Flags [P.], seq 4180:4211, ack 6701, win 4096, options [nop,nop,TS val 289977307 ecr 2581810846], length 31
   34  13:51:31.610546 IP 17.248.223.2.https > usertekiiphone.57394: Flags [.], ack 628, win 506, options [nop,nop,TS val 2581810849 ecr 289977283], length 0
   35  13:51:31.613125 IP 17.248.223.2.https > usertekiiphone.57394: Flags [.], ack 671, win 506, options [nop,nop,TS val 2581810850 ecr 289977283], length 0
   36  13:51:31.613126 IP 17.248.223.2.https > usertekiiphone.57394: Flags [.], ack 706, win 506, options [nop,nop,TS val 2581810850 ecr 289977283], length 0
   37  13:51:31.613127 IP 17.248.223.2.https > usertekiiphone.57394: Flags [P.], seq 6701:6732, ack 706, win 506, options [nop,nop,TS val 2581810850 ecr 289977283], length 31
   38  13:51:31.613127 IP 17.248.223.2.https > usertekiiphone.57394: Flags [.], ack 1834, win 498, options [nop,nop,TS val 2581810850 ecr 289977283], length 0
   39  13:51:31.613128 IP 17.248.223.2.https > usertekiiphone.57394: Flags [.], ack 3882, win 495, options [nop,nop,TS val 2581810851 ecr 289977284], length 0
   40  13:51:31.613128 IP 17.248.223.2.https > usertekiiphone.57394: Flags [.], ack 4149, win 501, options [nop,nop,TS val 2581810851 ecr 289977284], length 0
   41  13:51:31.613129 IP 17.248.223.2.https > usertekiiphone.57394: Flags [P.], seq 6732:6767, ack 4149, win 501, options [nop,nop,TS val 2581810851 ecr 289977284], length 35
   42  13:51:31.613129 IP 17.248.223.2.https > usertekiiphone.57394: Flags [.], ack 4180, win 501, options [nop,nop,TS val 2581810851 ecr 289977284], length 0
   43  13:51:31.613679 IP usertekiiphone.57394 > 17.248.223.2.https: Flags [.], ack 6732, win 4095, options [nop,nop,TS val 289977311 ecr 2581810850], length 0
   44  13:51:31.613680 IP usertekiiphone.57394 > 17.248.223.2.https: Flags [.], ack 6767, win 4093, options [nop,nop,TS val 289977311 ecr 2581810851], length 0
   45  13:51:31.644523 IP 17.248.223.2.https > usertekiiphone.57394: Flags [.], ack 4211, win 501, options [nop,nop,TS val 2581810876 ecr 289977307], length 0
   46  13:51:31.698746 IP nslabs-mbp.mdns > 224.0.0.251.mdns: 0*- [0q] 2/0/6 PTR nslabM-bM-^@M-^Ys MacBook Pro._companion-link._tcp.local., TXT "model=MacBookPro11,3" "osxvers=20" (380)
   47  13:51:31.698751 IP6 nslabs-macbook-pro.local.mdns > ff02::fb.mdns: 0*- [0q] 2/0/6 PTR nslabM-bM-^@M-^Ys MacBook Pro._companion-link._tcp.local., TXT "model=MacBookPro11,3" "osxvers=20" (380)
   48  13:51:31.802034 IP 17.248.223.2.https > usertekiiphone.57394: Flags [P.], seq 6767:7337, ack 4211, win 501, options [nop,nop,TS val 2581811040 ecr 289977311], length 570
   49  13:51:31.804537 IP usertekiiphone.57394 > 17.248.223.2.https: Flags [.], ack 7337, win 4078, options [nop,nop,TS val 289977501 ecr 2581811040], length 0
   50  13:51:31.813371 IP usertekiiphone.57394 > 17.248.223.2.https: Flags [P.], seq 4211:4250, ack 7337, win 4096, options [nop,nop,TS val 289977509 ecr 2581811040], length 39
   51  13:51:31.814603 IP usertekiiphone.57394 > 17.248.223.2.https: Flags [P.], seq 4250:4274, ack 7337, win 4096, options [nop,nop,TS val 289977510 ecr 2581811040], length 24
   52  13:51:31.814825 IP usertekiiphone.57394 > 17.248.223.2.https: Flags [F.], seq 4274, ack 7337, win 4096, options [nop,nop,TS val 289977510 ecr 2581811040], length 0
   53  13:51:32.047195 IP 17.248.223.2.https > usertekiiphone.57394: Flags [.], ack 4274, win 501, options [nop,nop,TS val 2581811077 ecr 289977510], length 0
   54  13:51:32.047197 IP 17.248.223.2.https > usertekiiphone.57394: Flags [F.], seq 7337, ack 4274, win 501, options [nop,nop,TS val 2581811077 ecr 289977510], length 0
   55  13:51:32.047199 IP 17.248.223.2.https > usertekiiphone.57394: Flags [.], ack 4275, win 501, options [nop,nop,TS val 2581811078 ecr 289977510], length 0
   56  13:51:32.047200 IP 17.248.223.2.https > usertekiiphone.57394: Flags [.], ack 4250, win 501, options [nop,nop,TS val 2581811076 ecr 289977509], length 0
   57  13:51:32.049195 IP usertekiiphone.57394 > 17.248.223.2.https: Flags [F.], seq 4274, ack 7338, win 4096, options [nop,nop,TS val 289977744 ecr 2581811077], length 0
   58  13:51:32.101062 IP nslabs-macbook-pro.local.mdns > 224.0.0.251.mdns: 0 [2q] SRV (QU)? ncm._remoted._tcp.local. TXT (QU)? ncm._remoted._tcp.local. (47)
   59  13:51:32.101152 IP6 nslabs-macbook-pro.local.mdns > ff02::fb.mdns: 0 [2q] SRV (QU)? ncm._remoted._tcp.local. TXT (QU)? ncm._remoted._tcp.local. (47)
   60  13:51:33.103858 IP nslabs-macbook-pro.local.mdns > 224.0.0.251.mdns: 0 [2q] SRV (QM)? ncm._remoted._tcp.local. TXT (QM)? ncm._remoted._tcp.local. (47)
   61  13:51:33.103960 IP6 nslabs-macbook-pro.local.mdns > ff02::fb.mdns: 0 [2q] SRV (QM)? ncm._remoted._tcp.local. TXT (QM)? ncm._remoted._tcp.local. (47)
   62  13:51:36.109590 IP nslabs-macbook-pro.local.mdns > 224.0.0.251.mdns: 0 [2q] SRV (QM)? ncm._remoted._tcp.local. TXT (QM)? ncm._remoted._tcp.local. (47)
   63  13:51:36.109614 IP6 nslabs-macbook-pro.local.mdns > ff02::fb.mdns: 0 [2q] SRV (QM)? ncm._remoted._tcp.local. TXT (QM)? ncm._remoted._tcp.local. (47)
   64  13:51:41.494558 IP usertekiiphone.57381 > 80.14.211.130.bc.googleusercontent.com.https: Flags [P.], seq 3737618586:3737618641, ack 707026600, win 4096, options [nop,nop,TS val 593966769 ecr 4206181370], length 55
   65  13:51:41.621569 IP 80.14.211.130.bc.googleusercontent.com.https > usertekiiphone.57381: Flags [.], ack 55, win 265, options [nop,nop,TS val 4206208770 ecr 593966769], length 0
   66  13:51:41.782585 IP 80.14.211.130.bc.googleusercontent.com.https > usertekiiphone.57381: Flags [P.], seq 1:62, ack 55, win 265, options [nop,nop,TS val 4206208931 ecr 593966769], length 61
   67  13:51:41.782588 IP 80.14.211.130.bc.googleusercontent.com.https > usertekiiphone.57381: Flags [P.], seq 62:133, ack 55, win 265, options [nop,nop,TS val 4206208931 ecr 593966769], length 71
   68  13:51:41.783298 IP 80.14.211.130.bc.googleusercontent.com.https > usertekiiphone.57381: Flags [P.], seq 133:172, ack 55, win 265, options [nop,nop,TS val 4206208932 ecr 593966769], length 39
   69  13:51:41.784507 IP usertekiiphone.57381 > 80.14.211.130.bc.googleusercontent.com.https: Flags [.], ack 133, win 4091, options [nop,nop,TS val 593967056 ecr 4206208931], length 0
   70  13:51:41.784510 IP usertekiiphone.57381 > 80.14.211.130.bc.googleusercontent.com.https: Flags [.], ack 172, win 4090, options [nop,nop,TS val 593967056 ecr 4206208932], length 0
   71  13:51:41.786080 IP usertekiiphone.57381 > 80.14.211.130.bc.googleusercontent.com.https: Flags [P.], seq 55:94, ack 172, win 4096, options [nop,nop,TS val 593967058 ecr 4206208932], length 39
   72  13:51:42.133892 IP 80.14.211.130.bc.googleusercontent.com.https > usertekiiphone.57381: Flags [.], ack 94, win 265, options [nop,nop,TS val 4206209152 ecr 593967058], length 0
   73  13:51:42.143285 IP usertekiiphone.57381 > 80.14.211.130.bc.googleusercontent.com.https: Flags [P.], seq 55:94, ack 172, win 4096, options [nop,nop,TS val 593967414 ecr 4206208932], length 39
   74  13:51:42.146319 IP 80.14.211.130.bc.googleusercontent.com.https > usertekiiphone.57381: Flags [.], ack 94, win 265, options [nop,nop,TS val 4206209295 ecr 593967414,nop,nop,sack 1 {55:94}], length 0
   75  13:51:43.248549 IP usertekiiphone.57385 > 80.14.211.130.bc.googleusercontent.com.https: Flags [P.], seq 2450604146:2450604204, ack 3927317211, win 4627, options [nop,nop,TS val 199008666 ecr 2705825052], length 58
   76  13:51:43.249157 IP usertekiiphone.57385 > 80.14.211.130.bc.googleusercontent.com.https: Flags [.], seq 58:1476, ack 1, win 4627, options [nop,nop,TS val 199008666 ecr 2705825052], length 1418
   77  13:51:43.249445 IP usertekiiphone.57385 > 80.14.211.130.bc.googleusercontent.com.https: Flags [P.], seq 1476:2106, ack 1, win 4627, options [nop,nop,TS val 199008666 ecr 2705825052], length 630
   78  13:51:43.249577 IP usertekiiphone.57385 > 80.14.211.130.bc.googleusercontent.com.https: Flags [P.], seq 2106:2365, ack 1, win 4627, options [nop,nop,TS val 199008667 ecr 2705825052], length 259
   79  13:51:43.257989 IP 80.14.211.130.bc.googleusercontent.com.https > usertekiiphone.57385: Flags [.], ack 2365, win 719, options [nop,nop,TS val 2705843076 ecr 199008667], length 0
   80  13:51:43.257991 IP 80.14.211.130.bc.googleusercontent.com.https > usertekiiphone.57385: Flags [.], ack 58, win 686, options [nop,nop,TS val 2705843076 ecr 199008666], length 0
   81  13:51:43.257993 IP 80.14.211.130.bc.googleusercontent.com.https > usertekiiphone.57385: Flags [.], ack 1476, win 697, options [nop,nop,TS val 2705843076 ecr 199008666], length 0
   82  13:51:43.257994 IP 80.14.211.130.bc.googleusercontent.com.https > usertekiiphone.57385: Flags [.], ack 2106, win 708, options [nop,nop,TS val 2705843076 ecr 199008666], length 0
   83  13:51:43.579039 IP 80.14.211.130.bc.googleusercontent.com.https > usertekiiphone.57385: Flags [P.], seq 1:63, ack 2365, win 719, options [nop,nop,TS val 2705843378 ecr 199008667], length 62
   84  13:51:43.579042 IP 80.14.211.130.bc.googleusercontent.com.https > usertekiiphone.57385: Flags [P.], seq 63:1481, ack 2365, win 719, options [nop,nop,TS val 2705843378 ecr 199008667], length 1418
   85  13:51:43.579044 IP 80.14.211.130.bc.googleusercontent.com.https > usertekiiphone.57385: Flags [.], seq 1481:2899, ack 2365, win 719, options [nop,nop,TS val 2705843378 ecr 199008667], length 1418
   86  13:51:43.579046 IP 80.14.211.130.bc.googleusercontent.com.https > usertekiiphone.57385: Flags [P.], seq 2899:4194, ack 2365, win 719, options [nop,nop,TS val 2705843378 ecr 199008667], length 1295
   87  13:51:43.579047 IP 80.14.211.130.bc.googleusercontent.com.https > usertekiiphone.57385: Flags [P.], seq 4194:5612, ack 2365, win 719, options [nop,nop,TS val 2705843380 ecr 199008667], length 1418
   88  13:51:43.579049 IP 80.14.211.130.bc.googleusercontent.com.https > usertekiiphone.57385: Flags [.], seq 5612:7030, ack 2365, win 719, options [nop,nop,TS val 2705843380 ecr 199008667], length 1418
   89  13:51:43.579051 IP 80.14.211.130.bc.googleusercontent.com.https > usertekiiphone.57385: Flags [P.], seq 7030:8448, ack 2365, win 719, options [nop,nop,TS val 2705843380 ecr 199008667], length 1418
   90  13:51:43.579053 IP 80.14.211.130.bc.googleusercontent.com.https > usertekiiphone.57385: Flags [P.], seq 8448:8573, ack 2365, win 719, options [nop,nop,TS val 2705843380 ecr 199008667], length 125
   91  13:51:43.579054 IP 80.14.211.130.bc.googleusercontent.com.https > usertekiiphone.57385: Flags [P.], seq 8573:9991, ack 2365, win 719, options [nop,nop,TS val 2705843381 ecr 199008667], length 1418
   92  13:51:43.579056 IP 80.14.211.130.bc.googleusercontent.com.https > usertekiiphone.57385: Flags [.], seq 9991:11409, ack 2365, win 719, options [nop,nop,TS val 2705843381 ecr 199008667], length 1418
   93  13:51:43.579058 IP 80.14.211.130.bc.googleusercontent.com.https > usertekiiphone.57385: Flags [P.], seq 11409:12809, ack 2365, win 719, options [nop,nop,TS val 2705843381 ecr 199008667], length 1400
   94  13:51:43.579060 IP 80.14.211.130.bc.googleusercontent.com.https > usertekiiphone.57385: Flags [P.], seq 12809:14227, ack 2365, win 719, options [nop,nop,TS val 2705843382 ecr 199008667], length 1418
   95  13:51:43.579062 IP 80.14.211.130.bc.googleusercontent.com.https > usertekiiphone.57385: Flags [P.], seq 14227:14841, ack 2365, win 719, options [nop,nop,TS val 2705843382 ecr 199008667], length 614
   96  13:51:43.579063 IP 80.14.211.130.bc.googleusercontent.com.https > usertekiiphone.57385: Flags [P.], seq 14841:16259, ack 2365, win 719, options [nop,nop,TS val 2705843383 ecr 199008667], length 1418
   97  13:51:43.579066 IP 80.14.211.130.bc.googleusercontent.com.https > usertekiiphone.57385: Flags [P.], seq 16259:17446, ack 2365, win 719, options [nop,nop,TS val 2705843383 ecr 199008667], length 1187
   98  13:51:43.579068 IP 80.14.211.130.bc.googleusercontent.com.https > usertekiiphone.57385: Flags [P.], seq 17446:18864, ack 2365, win 719, options [nop,nop,TS val 2705843384 ecr 199008667], length 1418
   99  13:51:43.579071 IP 80.14.211.130.bc.googleusercontent.com.https > usertekiiphone.57385: Flags [.], seq 18864:20282, ack 2365, win 719, options [nop,nop,TS val 2705843385 ecr 199008667], length 1418
  100  13:51:43.579073 IP 80.14.211.130.bc.googleusercontent.com.https > usertekiiphone.57385: Flags [P.], seq 20282:21700, ack 2365, win 719, options [nop,nop,TS val 2705843385 ecr 199008667], length 1418
  101  13:51:43.579075 IP 80.14.211.130.bc.googleusercontent.com.https > usertekiiphone.57385: Flags [P.], seq 21700:21874, ack 2365, win 719, options [nop,nop,TS val 2705843385 ecr 199008667], length 174
  102  13:51:43.579076 IP 80.14.211.130.bc.googleusercontent.com.https > usertekiiphone.57385: Flags [P.], seq 21874:23292, ack 2365, win 719, options [nop,nop,TS val 2705843387 ecr 199008667], length 1418
  103  13:51:43.579078 IP 80.14.211.130.bc.googleusercontent.com.https > usertekiiphone.57385: Flags [P.], seq 26128:26275, ack 2365, win 719, options [nop,nop,TS val 2705843387 ecr 199008667], length 147
  104  13:51:43.579079 IP 80.14.211.130.bc.googleusercontent.com.https > usertekiiphone.57385: Flags [P.], seq 26275:27693, ack 2365, win 719, options [nop,nop,TS val 2705843388 ecr 199008667], length 1418
  105  13:51:43.579081 IP 80.14.211.130.bc.googleusercontent.com.https > usertekiiphone.57385: Flags [.], seq 27693:29111, ack 2365, win 719, options [nop,nop,TS val 2705843388 ecr 199008667], length 1418
  106  13:51:43.579083 IP 80.14.211.130.bc.googleusercontent.com.https > usertekiiphone.57385: Flags [P.], seq 29111:30529, ack 2365, win 719, options [nop,nop,TS val 2705843388 ecr 199008667], length 1418
  107  13:51:43.579085 IP 80.14.211.130.bc.googleusercontent.com.https > usertekiiphone.57385: Flags [P.], seq 30529:30582, ack 2365, win 719, options [nop,nop,TS val 2705843388 ecr 199008667], length 53
  108  13:51:43.579086 IP 80.14.211.130.bc.googleusercontent.com.https > usertekiiphone.57385: Flags [P.], seq 30582:32000, ack 2365, win 719, options [nop,nop,TS val 2705843390 ecr 199008667], length 1418
  109  13:51:43.579088 IP 80.14.211.130.bc.googleusercontent.com.https > usertekiiphone.57385: Flags [.], seq 32000:33418, ack 2365, win 719, options [nop,nop,TS val 2705843390 ecr 199008667], length 1418
  110  13:51:43.579090 IP 80.14.211.130.bc.googleusercontent.com.https > usertekiiphone.57385: Flags [P.], seq 33418:34836, ack 2365, win 719, options [nop,nop,TS val 2705843390 ecr 199008667], length 1418
  111  13:51:43.579091 IP 80.14.211.130.bc.googleusercontent.com.https > usertekiiphone.57385: Flags [P.], seq 34836:34920, ack 2365, win 719, options [nop,nop,TS val 2705843390 ecr 199008667], length 84
  112  13:51:43.579093 IP 80.14.211.130.bc.googleusercontent.com.https > usertekiiphone.57385: Flags [P.], seq 39114:39771, ack 2365, win 719, options [nop,nop,TS val 2705843393 ecr 199008667], length 657
  113  13:51:43.579094 IP 80.14.211.130.bc.googleusercontent.com.https > usertekiiphone.57385: Flags [P.], seq 39771:39840, ack 2365, win 719, options [nop,nop,TS val 2705843393 ecr 199008667], length 69
  114  13:51:43.579095 IP 80.14.211.130.bc.googleusercontent.com.https > usertekiiphone.57385: Flags [P.], seq 39840:39879, ack 2365, win 719, options [nop,nop,TS val 2705843393 ecr 199008667], length 39
  115  13:51:43.580767 IP usertekiiphone.57385 > 80.14.211.130.bc.googleusercontent.com.https: Flags [.], ack 16259, win 4119, options [nop,nop,TS val 199008995 ecr 2705843383], length 0
  116  13:51:43.580769 IP usertekiiphone.57385 > 80.14.211.130.bc.googleusercontent.com.https: Flags [.], ack 23292, win 3899, options [nop,nop,TS val 199008995 ecr 2705843387], length 0
  117  13:51:43.580770 IP usertekiiphone.57385 > 80.14.211.130.bc.googleusercontent.com.https: Flags [.], ack 23292, win 3899, options [nop,nop,TS val 199008995 ecr 2705843387,nop,nop,sack 1 {26128:34920}], length 0
  118  13:51:43.580771 IP usertekiiphone.57385 > 80.14.211.130.bc.googleusercontent.com.https: Flags [.], ack 23292, win 3899, options [nop,nop,TS val 199008995 ecr 2705843387,nop,nop,sack 2 {39114:39879}{26128:34920}], length 0
  119  13:51:43.580772 IP usertekiiphone.57385 > 80.14.211.130.bc.googleusercontent.com.https: Flags [.], ack 23292, win 4627, options [nop,nop,TS val 199008995 ecr 2705843387,nop,nop,sack 2 {39114:39879}{26128:34920}], length 0
  120  13:51:43.581176 IP 80.14.211.130.bc.googleusercontent.com.https > usertekiiphone.57385: Flags [.], seq 23292:24710, ack 2365, win 719, options [nop,nop,TS val 2705843387 ecr 199008667], length 1418
  121  13:51:43.581179 IP 80.14.211.130.bc.googleusercontent.com.https > usertekiiphone.57385: Flags [P.], seq 24710:26128, ack 2365, win 719, options [nop,nop,TS val 2705843387 ecr 199008667], length 1418
  122  13:51:43.581181 IP 80.14.211.130.bc.googleusercontent.com.https > usertekiiphone.57385: Flags [P.], seq 34920:36338, ack 2365, win 719, options [nop,nop,TS val 2705843391 ecr 199008667], length 1418
  123  13:51:43.581183 IP 80.14.211.130.bc.googleusercontent.com.https > usertekiiphone.57385: Flags [.], seq 36338:37756, ack 2365, win 719, options [nop,nop,TS val 2705843391 ecr 199008667], length 1418
  124  13:51:43.581186 IP 80.14.211.130.bc.googleusercontent.com.https > usertekiiphone.57385: Flags [P.], seq 37756:39114, ack 2365, win 719, options [nop,nop,TS val 2705843391 ecr 199008667], length 1358
  125  13:51:43.584372 IP usertekiiphone.57385 > 80.14.211.130.bc.googleusercontent.com.https: Flags [.], ack 34920, win 4264, options [nop,nop,TS val 199008997 ecr 2705843387,nop,nop,sack 1 {39114:39879}], length 0
  126  13:51:43.584374 IP usertekiiphone.57385 > 80.14.211.130.bc.googleusercontent.com.https: Flags [.], ack 39879, win 4109, options [nop,nop,TS val 199008997 ecr 2705843391], length 0
  127  13:51:43.584375 IP usertekiiphone.57385 > 80.14.211.130.bc.googleusercontent.com.https: Flags [.], ack 39879, win 4627, options [nop,nop,TS val 199008997 ecr 2705843391], length 0
  128  13:51:43.587907 IP usertekiiphone.57385 > 80.14.211.130.bc.googleusercontent.com.https: Flags [P.], seq 2365:2404, ack 39879, win 4627, options [nop,nop,TS val 199009002 ecr 2705843391], length 39
  129  13:51:43.590193 IP 80.14.211.130.bc.googleusercontent.com.https > usertekiiphone.57385: Flags [.], ack 2404, win 719, options [nop,nop,TS val 2705843410 ecr 199009002], length 0
  130  13:51:44.601096 IP 192.168.0.159.mdns > 224.0.0.251.mdns: 0 [1a] [4q] [1au] PTR (QM)? lb._dns-sd._udp.local. PTR (QM)? _companion-link._tcp.local. PTR (QM)? _homekit._tcp.local. PTR (QM)? _sleep-proxy._udp.local. (165)
  131  13:51:44.601107 IP6 fe80::18c1:54d9:aa65:3e0a.mdns > ff02::fb.mdns: 0 [1a] [4q] [1au] PTR (QM)? lb._dns-sd._udp.local. PTR (QM)? _companion-link._tcp.local. PTR (QM)? _homekit._tcp.local. PTR (QM)? _sleep-proxy._udp.local. (165)
  132  13:51:45.132340 IP nslabs-macbook-pro.local.mdns > 224.0.0.251.mdns: 0 [2q] SRV (QM)? ncm._remoted._tcp.local. TXT (QM)? ncm._remoted._tcp.local. (47)
  133  13:51:45.132443 IP6 nslabs-macbook-pro.local.mdns > ff02::fb.mdns: 0 [2q] SRV (QM)? ncm._remoted._tcp.local. TXT (QM)? ncm._remoted._tcp.local. (47)
  134  13:51:50.689434 IP usertekiiphone.57385 > 80.14.211.130.bc.googleusercontent.com.https: Flags [P.], seq 2404:2462, ack 39879, win 4627, options [nop,nop,TS val 199016101 ecr 2705843410], length 58
  135  13:51:50.690880 IP usertekiiphone.57385 > 80.14.211.130.bc.googleusercontent.com.https: Flags [.], seq 2462:3880, ack 39879, win 4627, options [nop,nop,TS val 199016102 ecr 2705843410], length 1418
  136  13:51:50.691038 IP usertekiiphone.57385 > 80.14.211.130.bc.googleusercontent.com.https: Flags [P.], seq 3880:4385, ack 39879, win 4627, options [nop,nop,TS val 199016102 ecr 2705843410], length 505
  137  13:51:50.692340 IP 80.14.211.130.bc.googleusercontent.com.https > usertekiiphone.57385: Flags [.], ack 2462, win 719, options [nop,nop,TS val 2705850512 ecr 199016101], length 0
  138  13:51:50.693555 IP 80.14.211.130.bc.googleusercontent.com.https > usertekiiphone.57385: Flags [.], ack 3880, win 730, options [nop,nop,TS val 2705850513 ecr 199016102], length 0
  139  13:51:50.693556 IP 80.14.211.130.bc.googleusercontent.com.https > usertekiiphone.57385: Flags [.], ack 4385, win 741, options [nop,nop,TS val 2705850513 ecr 199016102], length 0
  140  13:51:51.046742 IP 80.14.211.130.bc.googleusercontent.com.https > usertekiiphone.57385: Flags [P.], seq 39879:39941, ack 4385, win 741, options [nop,nop,TS val 2705850842 ecr 199016102], length 62
  141  13:51:51.046745 IP 80.14.211.130.bc.googleusercontent.com.https > usertekiiphone.57385: Flags [P.], seq 39941:41359, ack 4385, win 741, options [nop,nop,TS val 2705850842 ecr 199016102], length 1418
  142  13:51:51.046747 IP 80.14.211.130.bc.googleusercontent.com.https > usertekiiphone.57385: Flags [P.], seq 41359:41880, ack 4385, win 741, options [nop,nop,TS val 2705850842 ecr 199016102], length 521
  143  13:51:51.046749 IP 80.14.211.130.bc.googleusercontent.com.https > usertekiiphone.57385: Flags [P.], seq 41880:41919, ack 4385, win 741, options [nop,nop,TS val 2705850842 ecr 199016102], length 39
  144  13:51:51.051279 IP usertekiiphone.57385 > 80.14.211.130.bc.googleusercontent.com.https: Flags [.], ack 41919, win 4564, options [nop,nop,TS val 199016460 ecr 2705850842], length 0
  145  13:51:51.052938 IP usertekiiphone.57385 > 80.14.211.130.bc.googleusercontent.com.https: Flags [P.], seq 4385:4424, ack 41919, win 4627, options [nop,nop,TS val 199016462 ecr 2705850842], length 39
  146  13:51:51.055246 IP 80.14.211.130.bc.googleusercontent.com.https > usertekiiphone.57385: Flags [.], ack 4424, win 741, options [nop,nop,TS val 2705850875 ecr 199016462], length 0
  147  13:51:51.395593 IP usertekiiphone.57385 > 80.14.211.130.bc.googleusercontent.com.https: Flags [P.], seq 4424:4482, ack 41919, win 4627, options [nop,nop,TS val 199016803 ecr 2705850875], length 58
  148  13:51:51.395809 IP usertekiiphone.57385 > 80.14.211.130.bc.googleusercontent.com.https: Flags [P.], seq 4482:5757, ack 41919, win 4627, options [nop,nop,TS val 199016803 ecr 2705850875], length 1275
  149  13:51:51.437685 IP 80.14.211.130.bc.googleusercontent.com.https > usertekiiphone.57385: Flags [.], ack 4482, win 741, options [nop,nop,TS val 2705851257 ecr 199016803], length 0
  150  13:51:51.437686 IP 80.14.211.130.bc.googleusercontent.com.https > usertekiiphone.57385: Flags [.], ack 5757, win 752, options [nop,nop,TS val 2705851257 ecr 199016803], length 0
  151  13:51:51.639627 IP 80.14.211.130.bc.googleusercontent.com.https > usertekiiphone.57385: Flags [P.], seq 41919:41981, ack 5757, win 752, options [nop,nop,TS val 2705851459 ecr 199016803], length 62
  152  13:51:51.639628 IP 80.14.211.130.bc.googleusercontent.com.https > usertekiiphone.57385: Flags [P.], seq 41981:42823, ack 5757, win 752, options [nop,nop,TS val 2705851459 ecr 199016803], length 842
  153  13:51:51.639629 IP 80.14.211.130.bc.googleusercontent.com.https > usertekiiphone.57385: Flags [P.], seq 42823:43014, ack 5757, win 752, options [nop,nop,TS val 2705851459 ecr 199016803], length 191
  154  13:51:51.639629 IP 80.14.211.130.bc.googleusercontent.com.https > usertekiiphone.57385: Flags [P.], seq 43014:43053, ack 5757, win 752, options [nop,nop,TS val 2705851459 ecr 199016803], length 39
  155  13:51:51.639942 IP usertekiiphone.57385 > 80.14.211.130.bc.googleusercontent.com.https: Flags [.], ack 43053, win 4592, options [nop,nop,TS val 199017045 ecr 2705851459], length 0
  156  13:51:51.640245 IP usertekiiphone.57385 > 80.14.211.130.bc.googleusercontent.com.https: Flags [P.], seq 5757:5796, ack 43053, win 4627, options [nop,nop,TS val 199017045 ecr 2705851459], length 39
  157  13:51:51.642847 IP 80.14.211.130.bc.googleusercontent.com.https > usertekiiphone.57385: Flags [.], ack 5796, win 752, options [nop,nop,TS val 2705851462 ecr 199017045], length 0
  158  13:51:53.223186 IP nslabs-macbook-pro.local.mdns > 224.0.0.251.mdns: 0 [2q] SRV (QU)? ncm._remoted._tcp.local. TXT (QU)? ncm._remoted._tcp.local. (47)
  159  13:51:53.223211 IP6 nslabs-macbook-pro.local.mdns > ff02::fb.mdns: 0 [2q] SRV (QU)? ncm._remoted._tcp.local. TXT (QU)? ncm._remoted._tcp.local. (47)
  160  13:51:54.226616 IP nslabs-macbook-pro.local.mdns > 224.0.0.251.mdns: 0 [2q] SRV (QM)? ncm._remoted._tcp.local. TXT (QM)? ncm._remoted._tcp.local. (47)
  161  13:51:54.226801 IP6 nslabs-macbook-pro.local.mdns > ff02::fb.mdns: 0 [2q] SRV (QM)? ncm._remoted._tcp.local. TXT (QM)? ncm._remoted._tcp.local. (47)
  162  13:51:56.685258 ARP, Request who-has usertekiiphone tell dlinkrouter, length 28
  163  13:51:56.685303 ARP, Reply usertekiiphone is-at 42:55:64:8e:cb:27 (oui Unknown), length 28
  164  13:51:57.237250 IP nslabs-macbook-pro.local.mdns > 224.0.0.251.mdns: 0 [2q] SRV (QM)? ncm._remoted._tcp.local. TXT (QM)? ncm._remoted._tcp.local. (47)
  165  13:51:57.237354 IP6 nslabs-macbook-pro.local.mdns > ff02::fb.mdns: 0 [2q] SRV (QM)? ncm._remoted._tcp.local. TXT (QM)? ncm._remoted._tcp.local. (47)
  166  13:51:58.276892 IP6 fe80::686e:b1ff:fe33:996a.mdns > ff02::fb.mdns: 0*- [0q] 1/0/0 PTR 41ebc443d3f6._airdrop._tcp.local. (58)
  167  13:52:00.286364 IP6 fe80::686e:b1ff:fe33:996a.mdns > ff02::fb.mdns: 0*- [0q] 1/0/0 PTR 41ebc443d3f6._airdrop._tcp.local. (58)
  168  13:52:00.995036 IP usertekiiphone.51608 > nslabs-mbp.56756: Flags [.], ack 2057950537, win 4096, length 0
  169  13:52:01.003956 IP nslabs-mbp.56756 > usertekiiphone.51608: Flags [.], ack 1, win 2048, options [nop,nop,TS val 2535439782 ecr 1191361445], length 0
  170  13:52:01.591359 IP6 fe80::686e:b1ff:fe33:996a.mdns > ff02::fb.mdns: 0*- [0q] 4/0/3 (Cache flush) SRV 2cb0c815-1575-469d-99c2-7e1fd383c647.local.:8770 0 0, (Cache flush) TXT "flags=1015", PTR _airdrop._tcp.local., PTR 41ebc443d3f6._airdrop._tcp.local. (244)
  171  13:52:02.598597 IP6 fe80::686e:b1ff:fe33:996a.mdns > ff02::fb.mdns: 0*- [0q] 4/0/3 (Cache flush) SRV 2cb0c815-1575-469d-99c2-7e1fd383c647.local.:8770 0 0, (Cache flush) TXT "flags=1015", PTR _airdrop._tcp.local., PTR 41ebc443d3f6._airdrop._tcp.local. (244)
  172  13:52:04.603647 IP6 fe80::686e:b1ff:fe33:996a.mdns > ff02::fb.mdns: 0*- [0q] 4/0/3 (Cache flush) SRV 2cb0c815-1575-469d-99c2-7e1fd383c647.local.:8770 0 0, (Cache flush) TXT "flags=1015", PTR _airdrop._tcp.local., PTR 41ebc443d3f6._airdrop._tcp.local. (244)
  173  13:52:06.256091 IP nslabs-macbook-pro.local.mdns > 224.0.0.251.mdns: 0 [2q] SRV (QM)? ncm._remoted._tcp.local. TXT (QM)? ncm._remoted._tcp.local. (47)
  174  13:52:06.256187 IP6 nslabs-macbook-pro.local.mdns > ff02::fb.mdns: 0 [2q] SRV (QM)? ncm._remoted._tcp.local. TXT (QM)? ncm._remoted._tcp.local. (47)
  175  13:52:08.644814 IP6 fe80::686e:b1ff:fe33:996a.mdns > ff02::fb.mdns: 0*- [0q] 4/0/3 (Cache flush) SRV 2cb0c815-1575-469d-99c2-7e1fd383c647.local.:8770 0 0, (Cache flush) TXT "flags=1015", PTR _airdrop._tcp.local., PTR 41ebc443d3f6._airdrop._tcp.local. (244)
  176  13:52:12.438652 IP 0.0.0.0.bootpc > broadcasthost.bootps: BOOTP/DHCP, Request from 6a:db:ca:c7:c7:6c (oui Unknown), length 300
  177  13:52:13.738238 IP 0.0.0.0.bootpc > broadcasthost.bootps: BOOTP/DHCP, Request from 6a:db:ca:c7:c7:6c (oui Unknown), length 300
  178  13:52:14.318182 IP nslabs-macbook-pro.local.mdns > 224.0.0.251.mdns: 0 [2q] SRV (QU)? ncm._remoted._tcp.local. TXT (QU)? ncm._remoted._tcp.local. (47)
  179  13:52:14.318274 IP6 nslabs-macbook-pro.local.mdns > ff02::fb.mdns: 0 [2q] SRV (QU)? ncm._remoted._tcp.local. TXT (QU)? ncm._remoted._tcp.local. (47)
  180  13:52:15.265044 IP 0.0.0.0.bootpc > broadcasthost.bootps: BOOTP/DHCP, Request from 6a:db:ca:c7:c7:6a (oui Unknown), length 300
  181  13:52:15.324109 IP nslabs-macbook-pro.local.mdns > 224.0.0.251.mdns: 0 [2q] SRV (QM)? ncm._remoted._tcp.local. TXT (QM)? ncm._remoted._tcp.local. (47)
  182  13:52:15.324119 IP6 nslabs-macbook-pro.local.mdns > ff02::fb.mdns: 0 [2q] SRV (QM)? ncm._remoted._tcp.local. TXT (QM)? ncm._remoted._tcp.local. (47)
  183  13:52:16.220215 IP 0.0.0.0.bootpc > broadcasthost.bootps: BOOTP/DHCP, Request from 6a:db:ca:c7:c7:6c (oui Unknown), length 300
  184  13:52:16.515380 IP 0.0.0.0.bootpc > broadcasthost.bootps: BOOTP/DHCP, Request from 6a:db:ca:c7:c7:6a (oui Unknown), length 300
  185  13:52:18.167853 IP 80.14.211.130.bc.googleusercontent.com.https > usertekiiphone.52169: Flags [F.], seq 1826978816, ack 1748427837, win 276, options [nop,nop,TS val 664175608 ecr 1478476949], length 0
  186  13:52:18.168057 IP usertekiiphone.52169 > 80.14.211.130.bc.googleusercontent.com.https: Flags [.], ack 1, win 4096, options [nop,nop,TS val 1478536934 ecr 664175608], length 0
  187  13:52:18.213230 IP usertekiiphone.52169 > 80.14.211.130.bc.googleusercontent.com.https: Flags [F.], seq 1, ack 1, win 4096, options [nop,nop,TS val 1478536978 ecr 664175608], length 0
  188  13:52:18.331965 IP nslabs-macbook-pro.local.mdns > 224.0.0.251.mdns: 0 [2q] SRV (QM)? ncm._remoted._tcp.local. TXT (QM)? ncm._remoted._tcp.local. (47)
  189  13:52:18.331972 IP6 nslabs-macbook-pro.local.mdns > ff02::fb.mdns: 0 [2q] SRV (QM)? ncm._remoted._tcp.local. TXT (QM)? ncm._remoted._tcp.local. (47)
  190  13:52:18.335547 IP 80.14.211.130.bc.googleusercontent.com.https > usertekiiphone.52169: Flags [.], ack 2, win 276, options [nop,nop,TS val 664175856 ecr 1478536978], length 0
  191  13:52:19.230435 IP usertekiiphone.60396 > dlinkrouter.domain: 41737+ A? pgorelease.nianticlabs.com. (44)
  192  13:52:19.230993 IP usertekiiphone.52170 > 80.14.211.130.bc.googleusercontent.com.https: Flags [S], seq 918641986, win 65535, options [mss 1460,nop,wscale 5,nop,nop,TS val 3507408807 ecr 0,sackOK,eol], length 0
  193  13:52:19.234589 IP 80.14.211.130.bc.googleusercontent.com.https > usertekiiphone.52170: Flags [S.], seq 4207007846, ack 918641987, win 65535, options [mss 1430,sackOK,TS val 2072202380 ecr 3507408807,nop,wscale 8], length 0
  194  13:52:19.234694 IP usertekiiphone.52170 > 80.14.211.130.bc.googleusercontent.com.https: Flags [.], ack 1, win 4121, options [nop,nop,TS val 3507408810 ecr 2072202380], length 0
  195  13:52:19.241256 IP usertekiiphone.52170 > 80.14.211.130.bc.googleusercontent.com.https: Flags [P.], seq 1:219, ack 1, win 4121, options [nop,nop,TS val 3507408815 ecr 2072202380], length 218
  196  13:52:19.243932 IP 80.14.211.130.bc.googleusercontent.com.https > usertekiiphone.52170: Flags [.], ack 219, win 261, options [nop,nop,TS val 2072202390 ecr 3507408815], length 0
  197  13:52:19.244510 IP 80.14.211.130.bc.googleusercontent.com.https > usertekiiphone.52170: Flags [P.], seq 1:148, ack 219, win 261, options [nop,nop,TS val 2072202390 ecr 3507408815], length 147
  198  13:52:19.244716 IP usertekiiphone.52170 > 80.14.211.130.bc.googleusercontent.com.https: Flags [.], ack 148, win 4116, options [nop,nop,TS val 3507408817 ecr 2072202390], length 0
  199  13:52:19.245070 IP usertekiiphone.52170 > 80.14.211.130.bc.googleusercontent.com.https: Flags [P.], seq 219:225, ack 148, win 4116, options [nop,nop,TS val 3507408818 ecr 2072202390], length 6
  200  13:52:19.253455 IP 80.14.211.130.bc.googleusercontent.com.https > usertekiiphone.52170: Flags [.], ack 225, win 261, options [nop,nop,TS val 2072202399 ecr 3507408818], length 0
  201  13:52:19.253587 IP usertekiiphone.52170 > 80.14.211.130.bc.googleusercontent.com.https: Flags [P.], seq 225:270, ack 148, win 4116, options [nop,nop,TS val 3507408826 ecr 2072202399], length 45
  202  13:52:19.256481 IP 80.14.211.130.bc.googleusercontent.com.https > usertekiiphone.52170: Flags [.], ack 270, win 261, options [nop,nop,TS val 2072202402 ecr 3507408826], length 0
  203  13:52:19.260143 IP dlinkrouter.domain > usertekiiphone.60396: 41737 1/0/0 A 130.211.14.80 (60)
  204  13:52:19.281256 IP usertekiiphone.52170 > 80.14.211.130.bc.googleusercontent.com.https: Flags [P.], seq 270:562, ack 148, win 4116, options [nop,nop,TS val 3507408853 ecr 2072202402], length 292
  205  13:52:19.284247 IP 80.14.211.130.bc.googleusercontent.com.https > usertekiiphone.52170: Flags [.], ack 562, win 265, options [nop,nop,TS val 2072202430 ecr 3507408853], length 0
  206  13:52:19.290794 IP 0.0.0.0.bootpc > broadcasthost.bootps: BOOTP/DHCP, Request from 6a:db:ca:c7:c7:6a (oui Unknown), length 300
  207  13:52:19.447103 IP 80.14.211.130.bc.googleusercontent.com.https > usertekiiphone.52170: Flags [P.], seq 148:398, ack 562, win 265, options [nop,nop,TS val 2072202593 ecr 3507408853], length 250
  208  13:52:19.447208 IP usertekiiphone.52170 > 80.14.211.130.bc.googleusercontent.com.https: Flags [.], ack 398, win 4108, options [nop,nop,TS val 3507409017 ecr 2072202593], length 0
  209  13:52:19.584502 IP usertekiiphone.52170 > 80.14.211.130.bc.googleusercontent.com.https: Flags [.], seq 562:1980, ack 398, win 4108, options [nop,nop,TS val 3507409154 ecr 2072202593], length 1418
  210  13:52:19.590836 IP usertekiiphone.52170 > 80.14.211.130.bc.googleusercontent.com.https: Flags [P.], seq 1980:2203, ack 398, win 4108, options [nop,nop,TS val 3507409154 ecr 2072202593], length 223
  211  13:52:19.599452 IP usertekiiphone.52170 > 80.14.211.130.bc.googleusercontent.com.https: Flags [P.], seq 785:2203, ack 398, win 4108, options [nop,nop,TS val 3507409168 ecr 2072202593], length 1418
  212  13:52:19.756934 IP 80.14.211.130.bc.googleusercontent.com.https > usertekiiphone.52170: Flags [.], ack 1980, win 276, options [nop,nop,TS val 2072202889 ecr 3507409154], length 0
  213  13:52:19.756937 IP 80.14.211.130.bc.googleusercontent.com.https > usertekiiphone.52170: Flags [.], ack 2203, win 287, options [nop,nop,TS val 2072202889 ecr 3507409154], length 0
  214  13:52:19.756939 IP 80.14.211.130.bc.googleusercontent.com.https > usertekiiphone.52170: Flags [.], ack 2203, win 287, options [nop,nop,TS val 2072202889 ecr 3507409168,nop,nop,sack 1 {785:2203}], length 0
  215  13:52:19.903960 IP 80.14.211.130.bc.googleusercontent.com.https > usertekiiphone.52170: Flags [P.], seq 398:567, ack 2203, win 287, options [nop,nop,TS val 2072203050 ecr 3507409168], length 169
  216  13:52:19.904090 IP usertekiiphone.52170 > 80.14.211.130.bc.googleusercontent.com.https: Flags [.], ack 567, win 4103, options [nop,nop,TS val 3507409471 ecr 2072203050], length 0
  217  13:52:20.541937 IP 0.0.0.0.bootpc > broadcasthost.bootps: BOOTP/DHCP, Request from 6a:db:ca:c7:c7:6c (oui Unknown), length 300
  218  13:52:20.954037 ARP, Reply dlinkrouter is-at f4:8c:eb:9e:9e:db (oui Unknown), length 28
  219  13:52:23.879110 IP 0.0.0.0.bootpc > broadcasthost.bootps: BOOTP/DHCP, Request from 6a:db:ca:c7:c7:6a (oui Unknown), length 300
