    1  10:22:05.335416 IP nslabs-macbook-pro.local.mdns > 224.0.0.251.mdns: 0 [2q] SRV (QM)? ncm._remoted._tcp.local. TXT (QM)? ncm._remoted._tcp.local. (47)
    2  10:22:05.335522 IP6 nslabs-macbook-pro.local.mdns > ff02::fb.mdns: 0 [2q] SRV (QM)? ncm._remoted._tcp.local. TXT (QM)? ncm._remoted._tcp.local. (47)
    3  10:22:05.409152 IP usertekiiphone.mdns > 224.0.0.251.mdns: 0*- [0q] 1/0/1 (Cache flush) TXT "rpBA=35:78:E0:75:ED:DE" "rpVr=260.3" "rpAD=16d21a6a7dd5" (131)
    4  10:22:05.409520 IP6 user-teki-iphone.local.mdns > ff02::fb.mdns: 0*- [0q] 1/0/1 (Cache flush) TXT "rpBA=35:78:E0:75:ED:DE" "rpVr=260.3" "rpAD=16d21a6a7dd5" (131)
    5  10:22:05.409755 IP user-teki-iphone.local.mdns > 224.0.0.251.mdns: 0*- [0q] 1/0/1 (Cache flush) TXT "rpBA=35:78:E0:75:ED:DE" "rpVr=260.3" "rpAD=16d21a6a7dd5" (131)
    6  10:22:05.409951 IP6 user-teki-iphone.local.mdns > ff02::fb.mdns: 0*- [0q] 1/0/1 (Cache flush) TXT "rpBA=35:78:E0:75:ED:DE" "rpVr=260.3" "rpAD=16d21a6a7dd5" (131)
    7  10:22:05.740099 IP 0.0.0.0.bootpc > broadcasthost.bootps: BOOTP/DHCP, Request from 6a:db:ca:c7:c7:6c (oui Unknown), length 300
    8  10:22:10.536608 IP usertekiiphone.51608 > nslabs-mbp.56756: Flags [.], ack 2057884476, win 4096, length 0
    9  10:22:10.553484 IP 0.0.0.0.bootpc > broadcasthost.bootps: BOOTP/DHCP, Request from 6a:db:ca:c7:c7:6a (oui Unknown), length 300
   10  10:22:10.719081 IP nslabs-mbp.56756 > usertekiiphone.51608: Flags [.], ack 1, win 2048, options [nop,nop,TS val 2522882044 ecr 1178783237], length 0
   11  10:22:13.928324 IP 0.0.0.0.bootpc > broadcasthost.bootps: BOOTP/DHCP, Request from 6a:db:ca:c7:c7:6c (oui Unknown), length 300
   12  10:22:14.367712 IP nslabs-macbook-pro.local.mdns > 224.0.0.251.mdns: 0 [2q] SRV (QM)? ncm._remoted._tcp.local. TXT (QM)? ncm._remoted._tcp.local. (47)
   13  10:22:14.367802 IP6 nslabs-macbook-pro.local.mdns > ff02::fb.mdns: 0 [2q] SRV (QM)? ncm._remoted._tcp.local. TXT (QM)? ncm._remoted._tcp.local. (47)
   14  10:22:17.779013 IP usertekiiphone.54895 > dlinkrouter.domain: 1559+ Type65? gsp64-ssl.ls.apple.com. (40)
   15  10:22:17.779515 IP usertekiiphone.63659 > dlinkrouter.domain: 41921+ A? gsp64-ssl.ls.apple.com. (40)
   16  10:22:17.779616 IP usertekiiphone.55282 > dlinkrouter.domain: 47997+ Type65? gsp53-ssl.ls.apple.com. (40)
   17  10:22:17.779704 IP usertekiiphone.57785 > dlinkrouter.domain: 50291+ A? gsp53-ssl.ls.apple.com. (40)
   18  10:22:17.779789 IP usertekiiphone.59161 > dlinkrouter.domain: 19145+ Type65? valid.apple.com. (33)
   19  10:22:17.779864 IP usertekiiphone.63625 > dlinkrouter.domain: 48112+ A? valid.apple.com. (33)
   20  10:22:17.797507 IP dlinkrouter.domain > usertekiiphone.54895: 1559 1/0/0 CNAME gsp64-ssl.ls-apple.com.akadns.net. (87)
   21  10:22:17.797860 IP dlinkrouter.domain > usertekiiphone.63659: 41921 2/0/0 CNAME gsp64-ssl.ls-apple.com.akadns.net., A 17.167.200.72 (103)
   22  10:22:17.798165 IP usertekiiphone.62344 > dlinkrouter.domain: 187+ Type65? gsp64-ssl.ls-apple.com.akadns.net. (51)
   23  10:22:17.806770 IP usertekiiphone.59572 > dlinkrouter.domain: 8657+ A? gsp64-ssl.ls-apple.com.akadns.net. (51)
   24  10:22:17.808083 IP dlinkrouter.domain > usertekiiphone.55282: 47997 1/0/0 CNAME gsp53-ssl.ls-apple.com.akadns.net. (87)
   25  10:22:17.808609 IP usertekiiphone.53627 > dlinkrouter.domain: 55421+ Type65? gsp53-ssl.ls-apple.com.akadns.net. (51)
   26  10:22:17.808737 IP usertekiiphone.61392 > dlinkrouter.domain: 32180+ A? gsp53-ssl.ls-apple.com.akadns.net. (51)
   27  10:22:17.818910 IP dlinkrouter.domain > usertekiiphone.62344: 187 0/1/0 (117)
   28  10:22:17.818914 IP dlinkrouter.domain > usertekiiphone.57785: 50291 2/0/0 CNAME gsp53-ssl.ls-apple.com.akadns.net., A 17.167.200.36 (103)
   29  10:22:17.821950 IP usertekiiphone.57140 > 17.167.200.72.https: Flags [SEW], seq 1886162475, win 65535, options [mss 1460,nop,wscale 5,nop,nop,TS val 3339995344 ecr 0,sackOK,eol], length 0
   30  10:22:17.829542 IP dlinkrouter.domain > usertekiiphone.59572: 8657 3/0/0 A 17.142.171.7, A 17.142.171.6, A 17.142.171.5 (99)
   31  10:22:17.829766 IP dlinkrouter.domain > usertekiiphone.61392: 32180 1/0/0 A 17.167.200.36 (67)
   32  10:22:17.829970 IP dlinkrouter.domain > usertekiiphone.63625: 48112 2/0/0 CNAME valid.origin-apple.com.akadns.net., A 17.253.117.202 (96)
   33  10:22:17.830588 IP usertekiiphone.59891 > dlinkrouter.domain: 51936+ Type65? valid.origin-apple.com.akadns.net. (51)
   34  10:22:17.831150 IP usertekiiphone.57141 > 17.167.200.36.https: Flags [SEW], seq 2436871462, win 65535, options [mss 1460,nop,wscale 5,nop,nop,TS val 1226116400 ecr 0,sackOK,eol], length 0
   35  10:22:17.840114 IP dlinkrouter.domain > usertekiiphone.53627: 55421 0/1/0 (117)
   36  10:22:17.840518 IP dlinkrouter.domain > usertekiiphone.59161: 19145 1/0/0 CNAME valid.origin-apple.com.akadns.net. (80)
   37  10:22:17.849212 IP usertekiiphone.50982 > dlinkrouter.domain: 44289+ Type65? gateway.icloud.com. (36)
   38  10:22:17.849488 IP usertekiiphone.61650 > dlinkrouter.domain: 62239+ A? gateway.icloud.com. (36)
   39  10:22:17.887816 IP usertekiiphone.57142 > twtpe2-vip-bx-002.aaplimg.com.https: Flags [SEW], seq 1779663491, win 65535, options [mss 1460,nop,wscale 5,nop,nop,TS val 1772204963 ecr 0,sackOK,eol], length 0
   40  10:22:17.906113 IP usertekiiphone.57143 > 17.248.223.4.https: Flags [SEW], seq 91194357, win 65535, options [mss 1460,nop,wscale 5,nop,nop,TS val 1612046418 ecr 0,sackOK,eol], length 0
   41  10:22:18.031587 IP usertekiiphone.57144 > 17.248.223.4.https: Flags [SEW], seq 1252629920, win 65535, options [mss 1460,nop,wscale 5,nop,nop,TS val 799221263 ecr 0,sackOK,eol], length 0
   42  10:22:18.043064 IP usertekiiphone.57143 > 17.248.223.4.https: Flags [S], seq 91194357, win 65535, options [mss 1460,nop,wscale 5,nop,nop,TS val 1612046554 ecr 0,sackOK,eol], length 0
   43  10:22:18.062989 IP 17.248.223.4.https > usertekiiphone.57143: Flags [S.E], seq 290761353, ack 91194358, win 65160, options [mss 1460,sackOK,TS val 964656397 ecr 1612046418,nop,wscale 7], length 0
   44  10:22:18.063026 IP twtpe2-vip-bx-002.aaplimg.com.https > usertekiiphone.57142: Flags [S.E], seq 4259694220, ack 1779663492, win 64980, options [mss 1456,sackOK,TS val 1984040778 ecr 1772204963,nop,wscale 8], length 0
   45  10:22:18.063030 IP 17.167.200.72.https > usertekiiphone.57140: Flags [S.E], seq 4155960199, ack 1886162476, win 43440, options [mss 1460,sackOK,TS val 2390923717 ecr 3339995344,nop,wscale 9], length 0
   46  10:22:18.063034 IP 17.167.200.36.https > usertekiiphone.57141: Flags [S.E], seq 3898013140, ack 2436871463, win 43440, options [mss 1460,sackOK,TS val 389217593 ecr 1226116400,nop,wscale 9], length 0
   47  10:22:18.063062 IP dlinkrouter.domain > usertekiiphone.59891: 51936 1/0/0 CNAME valid-apple.g.aaplimg.com. (90)
   48  10:22:18.063066 IP dlinkrouter.domain > usertekiiphone.61650: 62239 2/0/0 CNAME gateway.fe.apple-dns.net., A 17.248.223.2 (90)
   49  10:22:18.063068 IP dlinkrouter.domain > usertekiiphone.50982: 44289 1/0/0 CNAME gateway.fe.apple-dns.net. (74)
   50  10:22:18.064485 IP usertekiiphone.57676 > dlinkrouter.domain: 17795+ Type65? valid-apple.g.aaplimg.com. (43)
   51  10:22:18.064646 IP usertekiiphone.59799 > dlinkrouter.domain: 7330+ A? valid-apple.g.aaplimg.com. (43)
   52  10:22:18.064748 IP usertekiiphone.51733 > dlinkrouter.domain: 63516+ Type65? gateway.fe.apple-dns.net. (42)
   53  10:22:18.068697 IP usertekiiphone.57143 > 17.248.223.4.https: Flags [.], ack 1, win 4117, options [nop,nop,TS val 1612046574 ecr 964656397], length 0
   54  10:22:18.068698 IP usertekiiphone.57143 > 17.248.223.4.https: Flags [P.], seq 1:518, ack 1, win 4117, options [nop,nop,TS val 1612046574 ecr 964656397], length 517
   55  10:22:18.068705 IP usertekiiphone.57142 > twtpe2-vip-bx-002.aaplimg.com.https: Flags [.], ack 1, win 4106, options [nop,nop,TS val 1772205137 ecr 1984040778], length 0
   56  10:22:18.068706 IP usertekiiphone.57142 > twtpe2-vip-bx-002.aaplimg.com.https: Flags [P.], seq 1:518, ack 1, win 4106, options [nop,nop,TS val 1772205138 ecr 1984040778], length 517
   57  10:22:18.068708 IP usertekiiphone.57140 > 17.167.200.72.https: Flags [.], ack 1, win 4117, options [nop,nop,TS val 3339995584 ecr 2390923717], length 0
   58  10:22:18.068708 IP usertekiiphone.57140 > 17.167.200.72.https: Flags [P.], seq 1:518, ack 1, win 4117, options [nop,nop,TS val 3339995584 ecr 2390923717], length 517
   59  10:22:18.068710 IP usertekiiphone.57141 > 17.167.200.36.https: Flags [.], ack 1, win 4117, options [nop,nop,TS val 1226116631 ecr 389217593], length 0
   60  10:22:18.068710 IP usertekiiphone.57141 > 17.167.200.36.https: Flags [P.], seq 1:518, ack 1, win 4117, options [nop,nop,TS val 1226116633 ecr 389217593], length 517
   61  10:22:18.081789 IP 17.248.223.4.https > usertekiiphone.57144: Flags [S.E], seq 761487583, ack 1252629921, win 65160, options [mss 1460,sackOK,TS val 1199016830 ecr 799221263,nop,wscale 7], length 0
   62  10:22:18.081806 IP 17.248.223.4.https > usertekiiphone.57143: Flags [S.E], seq 290761353, ack 91194358, win 65160, options [mss 1460,sackOK,TS val 964656528 ecr 1612046418,nop,wscale 7], length 0
   63  10:22:18.083046 IP usertekiiphone.57144 > 17.248.223.4.https: Flags [.], ack 1, win 4117, options [nop,nop,TS val 799221312 ecr 1199016830], length 0
   64  10:22:18.083047 IP usertekiiphone.57144 > 17.248.223.4.https: Flags [P.], seq 1:518, ack 1, win 4117, options [nop,nop,TS val 799221312 ecr 1199016830], length 517
   65  10:22:18.083054 IP usertekiiphone.57143 > 17.248.223.4.https: Flags [.], ack 1, win 4117, options [nop,nop,TS val 1612046592 ecr 964656397], length 0
   66  10:22:18.085074 IP dlinkrouter.domain > usertekiiphone.59799: 7330 2/0/0 A 17.253.117.202, A 17.253.117.201 (75)
   67  10:22:18.085290 IP dlinkrouter.domain > usertekiiphone.51733: 63516 0/1/0 (115)
   68  10:22:18.088607 IP 17.248.223.4.https > usertekiiphone.57143: Flags [.], ack 518, win 506, options [nop,nop,TS val 964656536 ecr 1612046574], length 0
   69  10:22:18.089329 IP twtpe2-vip-bx-002.aaplimg.com.https > usertekiiphone.57142: Flags [.], ack 518, win 252, options [nop,nop,TS val 1984040917 ecr 1772205138], length 0
   70  10:22:18.089564 IP 17.248.223.4.https > usertekiiphone.57143: Flags [.], seq 1:1449, ack 518, win 506, options [nop,nop,TS val 964656537 ecr 1612046574], length 1448
   71  10:22:18.089565 IP 17.248.223.4.https > usertekiiphone.57143: Flags [P.], seq 1449:2897, ack 518, win 506, options [nop,nop,TS val 964656537 ecr 1612046574], length 1448
   72  10:22:18.089566 IP 17.248.223.4.https > usertekiiphone.57143: Flags [P.], seq 2897:4097, ack 518, win 506, options [nop,nop,TS val 964656537 ecr 1612046574], length 1200
   73  10:22:18.090115 IP usertekiiphone.57143 > 17.248.223.4.https: Flags [.], ack 4097, win 3989, options [nop,nop,TS val 1612046599 ecr 964656537], length 0
   74  10:22:18.090226 IP 17.248.223.4.https > usertekiiphone.57143: Flags [.], seq 4097:5545, ack 518, win 506, options [nop,nop,TS val 964656537 ecr 1612046574], length 1448
   75  10:22:18.090228 IP 17.248.223.4.https > usertekiiphone.57143: Flags [P.], seq 5545:6097, ack 518, win 506, options [nop,nop,TS val 964656537 ecr 1612046574], length 552
   76  10:22:18.090235 IP twtpe2-vip-bx-002.aaplimg.com.https > usertekiiphone.57142: Flags [.], seq 1:1445, ack 518, win 252, options [nop,nop,TS val 1984040918 ecr 1772205138], length 1444
   77  10:22:18.090237 IP twtpe2-vip-bx-002.aaplimg.com.https > usertekiiphone.57142: Flags [.], seq 1445:2889, ack 518, win 252, options [nop,nop,TS val 1984040918 ecr 1772205138], length 1444
   78  10:22:18.090238 IP twtpe2-vip-bx-002.aaplimg.com.https > usertekiiphone.57142: Flags [P.], seq 2889:4097, ack 518, win 252, options [nop,nop,TS val 1984040918 ecr 1772205138], length 1208
   79  10:22:18.090677 IP usertekiiphone.57143 > 17.248.223.4.https: Flags [.], ack 6097, win 3927, options [nop,nop,TS val 1612046599 ecr 964656537], length 0
   80  10:22:18.090680 IP usertekiiphone.57142 > twtpe2-vip-bx-002.aaplimg.com.https: Flags [.], ack 4097, win 3978, options [nop,nop,TS val 1772205162 ecr 1984040918], length 0
   81  10:22:18.092727 IP twtpe2-vip-bx-002.aaplimg.com.https > usertekiiphone.57142: Flags [.], seq 4097:5541, ack 518, win 252, options [nop,nop,TS val 1984040920 ecr 1772205138], length 1444
   82  10:22:18.092729 IP twtpe2-vip-bx-002.aaplimg.com.https > usertekiiphone.57142: Flags [P.], seq 5541:6171, ack 518, win 252, options [nop,nop,TS val 1984040920 ecr 1772205138], length 630
   83  10:22:18.094062 IP usertekiiphone.57142 > twtpe2-vip-bx-002.aaplimg.com.https: Flags [.], ack 6171, win 3913, options [nop,nop,TS val 1772205165 ecr 1984040920], length 0
   84  10:22:18.095700 IP dlinkrouter.domain > usertekiiphone.57676: 17795 0/1/0 (103)
   85  10:22:18.103769 IP 17.248.223.4.https > usertekiiphone.57144: Flags [.], ack 518, win 506, options [nop,nop,TS val 1199016852 ecr 799221312], length 0
   86  10:22:18.104883 IP 17.248.223.4.https > usertekiiphone.57144: Flags [.], seq 1:1449, ack 518, win 506, options [nop,nop,TS val 1199016853 ecr 799221312], length 1448
   87  10:22:18.104884 IP 17.248.223.4.https > usertekiiphone.57144: Flags [P.], seq 1449:2897, ack 518, win 506, options [nop,nop,TS val 1199016853 ecr 799221312], length 1448
   88  10:22:18.104885 IP 17.248.223.4.https > usertekiiphone.57144: Flags [P.], seq 2897:4097, ack 518, win 506, options [nop,nop,TS val 1199016853 ecr 799221312], length 1200
   89  10:22:18.104886 IP 17.248.223.4.https > usertekiiphone.57144: Flags [.], seq 4097:5545, ack 518, win 506, options [nop,nop,TS val 1199016853 ecr 799221312], length 1448
   90  10:22:18.104887 IP 17.248.223.4.https > usertekiiphone.57144: Flags [P.], seq 5545:6096, ack 518, win 506, options [nop,nop,TS val 1199016853 ecr 799221312], length 551
   91  10:22:18.107274 IP usertekiiphone.57144 > 17.248.223.4.https: Flags [.], ack 6096, win 3927, options [nop,nop,TS val 799221334 ecr 1199016853], length 0
   92  10:22:18.107275 IP usertekiiphone.57144 > 17.248.223.4.https: Flags [.], ack 6096, win 4096, options [nop,nop,TS val 799221334 ecr 1199016853], length 0
   93  10:22:18.108842 IP usertekiiphone.57143 > 17.248.223.4.https: Flags [P.], seq 518:582, ack 6097, win 3927, options [nop,nop,TS val 1612046616 ecr 964656537], length 64
   94  10:22:18.119854 IP usertekiiphone.57142 > twtpe2-vip-bx-002.aaplimg.com.https: Flags [P.], seq 518:611, ack 6171, win 3913, options [nop,nop,TS val 1772205189 ecr 1984040920], length 93
   95  10:22:18.144617 IP usertekiiphone.57144 > 17.248.223.4.https: Flags [P.], seq 518:582, ack 6096, win 4096, options [nop,nop,TS val 799221370 ecr 1199016853], length 64
   96  10:22:18.206846 IP usertekiiphone.57143 > 17.248.223.4.https: Flags [P.], seq 582:628, ack 6097, win 3927, options [nop,nop,TS val 1612046712 ecr 964656537], length 46
   97  10:22:18.206978 IP usertekiiphone.57143 > 17.248.223.4.https: Flags [P.], seq 628:671, ack 6097, win 3927, options [nop,nop,TS val 1612046712 ecr 964656537], length 43
   98  10:22:18.207009 IP usertekiiphone.57143 > 17.248.223.4.https: Flags [P.], seq 671:706, ack 6097, win 3927, options [nop,nop,TS val 1612046712 ecr 964656537], length 35
   99  10:22:18.207053 IP usertekiiphone.57143 > 17.248.223.4.https: Flags [P.], seq 706:1779, ack 6097, win 3927, options [nop,nop,TS val 1612046712 ecr 964656537], length 1073
  100  10:22:18.207259 IP usertekiiphone.57143 > 17.248.223.4.https: Flags [P.], seq 1779:2614, ack 6097, win 3927, options [nop,nop,TS val 1612046712 ecr 964656537], length 835
  101  10:22:18.207370 IP usertekiiphone.57143 > 17.248.223.4.https: Flags [P.], seq 2614:2645, ack 6097, win 3927, options [nop,nop,TS val 1612046712 ecr 964656537], length 31
  102  10:22:18.239999 IP 17.248.223.4.https > usertekiiphone.57143: Flags [.], ack 582, win 506, options [nop,nop,TS val 964656576 ecr 1612046616], length 0
  103  10:22:18.240000 IP 17.248.223.4.https > usertekiiphone.57143: Flags [P.], seq 6097:6368, ack 582, win 506, options [nop,nop,TS val 964656576 ecr 1612046616], length 271
  104  10:22:18.240001 IP 17.248.223.4.https > usertekiiphone.57143: Flags [P.], seq 6368:6639, ack 582, win 506, options [nop,nop,TS val 964656576 ecr 1612046616], length 271
  105  10:22:18.240001 IP 17.248.223.4.https > usertekiiphone.57143: Flags [P.], seq 6639:6701, ack 582, win 506, options [nop,nop,TS val 964656576 ecr 1612046616], length 62
  106  10:22:18.240651 IP usertekiiphone.57143 > 17.248.223.4.https: Flags [.], ack 6701, win 3908, options [nop,nop,TS val 1612046745 ecr 964656576], length 0
  107  10:22:18.240874 IP usertekiiphone.57143 > 17.248.223.4.https: Flags [P.], seq 2645:2676, ack 6701, win 3908, options [nop,nop,TS val 1612046745 ecr 964656576], length 31
  108  10:22:18.256456 IP 17.248.223.4.https > usertekiiphone.57143: Flags [.], ack 628, win 506, options [nop,nop,TS val 964656706 ecr 1612046712], length 0
  109  10:22:18.256457 IP 17.248.223.4.https > usertekiiphone.57143: Flags [.], ack 671, win 506, options [nop,nop,TS val 964656706 ecr 1612046712], length 0
  110  10:22:18.256458 IP 17.248.223.4.https > usertekiiphone.57143: Flags [P.], seq 6701:6732, ack 671, win 506, options [nop,nop,TS val 964656706 ecr 1612046712], length 31
  111  10:22:18.256458 IP 17.248.223.4.https > usertekiiphone.57143: Flags [.], ack 706, win 506, options [nop,nop,TS val 964656706 ecr 1612046712], length 0
  112  10:22:18.256459 IP 17.248.223.4.https > usertekiiphone.57143: Flags [.], ack 1779, win 501, options [nop,nop,TS val 964656706 ecr 1612046712], length 0
  113  10:22:18.256459 IP 17.248.223.4.https > usertekiiphone.57143: Flags [.], ack 2614, win 501, options [nop,nop,TS val 964656706 ecr 1612046712], length 0
  114  10:22:18.256460 IP 17.248.223.4.https > usertekiiphone.57143: Flags [P.], seq 6732:6767, ack 2614, win 501, options [nop,nop,TS val 964656706 ecr 1612046712], length 35
  115  10:22:18.256460 IP 17.248.223.4.https > usertekiiphone.57143: Flags [.], ack 2645, win 501, options [nop,nop,TS val 964656706 ecr 1612046712], length 0
  116  10:22:18.256493 IP 17.248.223.4.https > usertekiiphone.57144: Flags [.], ack 582, win 506, options [nop,nop,TS val 1199017008 ecr 799221370], length 0
  117  10:22:18.256494 IP 17.248.223.4.https > usertekiiphone.57144: Flags [P.], seq 6096:6367, ack 582, win 506, options [nop,nop,TS val 1199017008 ecr 799221370], length 271
  118  10:22:18.256494 IP 17.248.223.4.https > usertekiiphone.57144: Flags [P.], seq 6367:6638, ack 582, win 506, options [nop,nop,TS val 1199017008 ecr 799221370], length 271
  119  10:22:18.256495 IP 17.248.223.4.https > usertekiiphone.57144: Flags [P.], seq 6638:6700, ack 582, win 506, options [nop,nop,TS val 1199017008 ecr 799221370], length 62
  120  10:22:18.256503 IP twtpe2-vip-bx-002.aaplimg.com.https > usertekiiphone.57142: Flags [P.], seq 6171:6222, ack 611, win 252, options [nop,nop,TS val 1984041088 ecr 1772205189], length 51
  121  10:22:18.256717 IP twtpe2-vip-bx-002.aaplimg.com.https > usertekiiphone.57142: Flags [P.], seq 6222:6272, ack 611, win 252, options [nop,nop,TS val 1984041088 ecr 1772205189], length 50
  122  10:22:18.257638 IP usertekiiphone.57143 > 17.248.223.4.https: Flags [.], ack 6732, win 3907, options [nop,nop,TS val 1612046761 ecr 964656706], length 0
  123  10:22:18.257639 IP usertekiiphone.57143 > 17.248.223.4.https: Flags [.], ack 6767, win 3906, options [nop,nop,TS val 1612046761 ecr 964656706], length 0
  124  10:22:18.257647 IP usertekiiphone.57144 > 17.248.223.4.https: Flags [.], ack 6700, win 4077, options [nop,nop,TS val 799221481 ecr 1199017008], length 0
  125  10:22:18.257649 IP usertekiiphone.57142 > twtpe2-vip-bx-002.aaplimg.com.https: Flags [.], ack 6222, win 3911, options [nop,nop,TS val 1772205324 ecr 1984041088], length 0
  126  10:22:18.258125 IP 17.248.223.4.https > usertekiiphone.57143: Flags [.], ack 2676, win 501, options [nop,nop,TS val 964656708 ecr 1612046745], length 0
  127  10:22:18.260472 IP usertekiiphone.57142 > twtpe2-vip-bx-002.aaplimg.com.https: Flags [.], ack 6272, win 3910, options [nop,nop,TS val 1772205327 ecr 1984041088], length 0
  128  10:22:18.264809 IP 17.167.200.72.https > usertekiiphone.57140: Flags [.], ack 518, win 83, options [nop,nop,TS val 2390924015 ecr 3339995584], length 0
  129  10:22:18.264840 IP 17.167.200.72.https > usertekiiphone.57140: Flags [.], seq 1:1449, ack 518, win 83, options [nop,nop,TS val 2390924016 ecr 3339995584], length 1448
  130  10:22:18.264841 IP 17.167.200.72.https > usertekiiphone.57140: Flags [.], seq 1449:2897, ack 518, win 83, options [nop,nop,TS val 2390924016 ecr 3339995584], length 1448
  131  10:22:18.264842 IP 17.167.200.72.https > usertekiiphone.57140: Flags [P.], seq 2897:2948, ack 518, win 83, options [nop,nop,TS val 2390924016 ecr 3339995584], length 51
  132  10:22:18.267458 IP 17.167.200.36.https > usertekiiphone.57141: Flags [.], ack 518, win 84, options [nop,nop,TS val 389217831 ecr 1226116633], length 0
  133  10:22:18.269094 IP 17.167.200.36.https > usertekiiphone.57141: Flags [.], seq 1:1449, ack 518, win 84, options [nop,nop,TS val 389217831 ecr 1226116633], length 1448
  134  10:22:18.269095 IP 17.167.200.36.https > usertekiiphone.57141: Flags [P.], seq 1449:2811, ack 518, win 84, options [nop,nop,TS val 389217831 ecr 1226116633], length 1362
  135  10:22:18.271415 IP usertekiiphone.57140 > 17.167.200.72.https: Flags [.], ack 2948, win 4025, options [nop,nop,TS val 3339995777 ecr 2390924016], length 0
  136  10:22:18.274993 IP usertekiiphone.57141 > 17.167.200.36.https: Flags [.], ack 2811, win 4029, options [nop,nop,TS val 1226116832 ecr 389217831], length 0
  137  10:22:18.281175 IP usertekiiphone.57140 > 17.167.200.72.https: Flags [P.], seq 518:598, ack 2948, win 4096, options [nop,nop,TS val 3339995792 ecr 2390924016], length 80
  138  10:22:18.290097 IP usertekiiphone.57141 > 17.167.200.36.https: Flags [P.], seq 518:611, ack 2811, win 4096, options [nop,nop,TS val 1226116847 ecr 389217831], length 93
  139  10:22:18.291149 IP usertekiiphone.57140 > 17.167.200.72.https: Flags [P.], seq 598:890, ack 2948, win 4096, options [nop,nop,TS val 3339995801 ecr 2390924016], length 292
  140  10:22:18.292761 IP usertekiiphone.57140 > 17.167.200.72.https: Flags [P.], seq 890:1435, ack 2948, win 4096, options [nop,nop,TS val 3339995802 ecr 2390924016], length 545
  141  10:22:18.294790 IP usertekiiphone.57144 > 17.248.223.4.https: Flags [P.], seq 582:628, ack 6700, win 4077, options [nop,nop,TS val 799221515 ecr 1199017008], length 46
  142  10:22:18.294826 IP usertekiiphone.57144 > 17.248.223.4.https: Flags [P.], seq 628:671, ack 6700, win 4077, options [nop,nop,TS val 799221515 ecr 1199017008], length 43
  143  10:22:18.294846 IP usertekiiphone.57144 > 17.248.223.4.https: Flags [P.], seq 671:706, ack 6700, win 4077, options [nop,nop,TS val 799221515 ecr 1199017008], length 35
  144  10:22:18.294936 IP usertekiiphone.57144 > 17.248.223.4.https: Flags [P.], seq 706:1755, ack 6700, win 4077, options [nop,nop,TS val 799221515 ecr 1199017008], length 1049
  145  10:22:18.295123 IP usertekiiphone.57144 > 17.248.223.4.https: Flags [P.], seq 1755:1786, ack 6700, win 4077, options [nop,nop,TS val 799221515 ecr 1199017008], length 31
  146  10:22:18.295232 IP usertekiiphone.57144 > 17.248.223.4.https: Flags [P.], seq 1786:2654, ack 6700, win 4077, options [nop,nop,TS val 799221515 ecr 1199017008], length 868
  147  10:22:18.295308 IP usertekiiphone.57144 > 17.248.223.4.https: Flags [P.], seq 2654:2685, ack 6700, win 4077, options [nop,nop,TS val 799221515 ecr 1199017008], length 31
  148  10:22:18.309433 IP usertekiiphone.57142 > twtpe2-vip-bx-002.aaplimg.com.https: Flags [P.], seq 611:664, ack 6272, win 3910, options [nop,nop,TS val 1772205372 ecr 1984041088], length 53
  149  10:22:18.309468 IP usertekiiphone.57142 > twtpe2-vip-bx-002.aaplimg.com.https: Flags [P.], seq 664:714, ack 6272, win 3910, options [nop,nop,TS val 1772205372 ecr 1984041088], length 50
  150  10:22:18.309484 IP usertekiiphone.57142 > twtpe2-vip-bx-002.aaplimg.com.https: Flags [P.], seq 714:756, ack 6272, win 3910, options [nop,nop,TS val 1772205372 ecr 1984041088], length 42
  151  10:22:18.309498 IP usertekiiphone.57142 > twtpe2-vip-bx-002.aaplimg.com.https: Flags [P.], seq 756:858, ack 6272, win 3910, options [nop,nop,TS val 1772205372 ecr 1984041088], length 102
  152  10:22:18.309700 IP usertekiiphone.57142 > twtpe2-vip-bx-002.aaplimg.com.https: Flags [P.], seq 858:896, ack 6272, win 3910, options [nop,nop,TS val 1772205372 ecr 1984041088], length 38
  153  10:22:18.313426 IP 17.248.223.4.https > usertekiiphone.57144: Flags [.], ack 628, win 506, options [nop,nop,TS val 1199017063 ecr 799221515], length 0
  154  10:22:18.313427 IP 17.248.223.4.https > usertekiiphone.57144: Flags [.], ack 671, win 506, options [nop,nop,TS val 1199017064 ecr 799221515], length 0
  155  10:22:18.313427 IP 17.248.223.4.https > usertekiiphone.57144: Flags [P.], seq 6700:6731, ack 671, win 506, options [nop,nop,TS val 1199017064 ecr 799221515], length 31
  156  10:22:18.313428 IP 17.248.223.4.https > usertekiiphone.57144: Flags [.], ack 706, win 506, options [nop,nop,TS val 1199017064 ecr 799221515], length 0
  157  10:22:18.313428 IP 17.248.223.4.https > usertekiiphone.57144: Flags [.], ack 1755, win 501, options [nop,nop,TS val 1199017064 ecr 799221515], length 0
  158  10:22:18.313429 IP 17.248.223.4.https > usertekiiphone.57144: Flags [.], ack 1786, win 501, options [nop,nop,TS val 1199017064 ecr 799221515], length 0
  159  10:22:18.313429 IP 17.248.223.4.https > usertekiiphone.57144: Flags [.], ack 2685, win 501, options [nop,nop,TS val 1199017064 ecr 799221515], length 0
  160  10:22:18.313696 IP usertekiiphone.57144 > 17.248.223.4.https: Flags [.], ack 6731, win 4076, options [nop,nop,TS val 799221533 ecr 1199017064], length 0
  161  10:22:18.328404 IP twtpe2-vip-bx-002.aaplimg.com.https > usertekiiphone.57142: Flags [.], ack 896, win 251, options [nop,nop,TS val 1984041158 ecr 1772205372], length 0
  162  10:22:18.329102 IP twtpe2-vip-bx-002.aaplimg.com.https > usertekiiphone.57142: Flags [.], seq 6272:7716, ack 896, win 251, options [nop,nop,TS val 1984041159 ecr 1772205372], length 1444
  163  10:22:18.329104 IP twtpe2-vip-bx-002.aaplimg.com.https > usertekiiphone.57142: Flags [P.], seq 7716:9005, ack 896, win 251, options [nop,nop,TS val 1984041159 ecr 1772205372], length 1289
  164  10:22:18.329256 IP usertekiiphone.57142 > twtpe2-vip-bx-002.aaplimg.com.https: Flags [.], ack 9005, win 3825, options [nop,nop,TS val 1772205390 ecr 1984041159], length 0
  165  10:22:18.359714 IP usertekiiphone.50816 > dlinkrouter.domain: 31951+ Type65? ocsp2.apple.com. (33)
  166  10:22:18.359914 IP usertekiiphone.61688 > dlinkrouter.domain: 64549+ A? ocsp2.apple.com. (33)
  167  10:22:18.388982 IP usertekiiphone.49419 > dlinkrouter.domain: 23558+ Type65? caldav.calendar.yahoo.com. (43)
  168  10:22:18.389232 IP usertekiiphone.56766 > dlinkrouter.domain: 14657+ A? caldav.calendar.yahoo.com. (43)
  169  10:22:18.454804 IP usertekiiphone.57145 > twtpe2-vip-bx-001.aaplimg.com.https: Flags [SEW], seq 1769932113, win 65535, options [mss 1460,nop,wscale 5,nop,nop,TS val 4263664725 ecr 0,sackOK,eol], length 0
  170  10:22:18.586827 IP 17.167.200.72.https > usertekiiphone.57140: Flags [P.], seq 2948:3251, ack 598, win 83, options [nop,nop,TS val 2390924228 ecr 3339995792], length 303
  171  10:22:18.586828 IP 17.167.200.72.https > usertekiiphone.57140: Flags [P.], seq 3251:3554, ack 598, win 83, options [nop,nop,TS val 2390924228 ecr 3339995792], length 303
  172  10:22:18.586829 IP 17.167.200.72.https > usertekiiphone.57140: Flags [.], ack 1435, win 83, options [nop,nop,TS val 2390924239 ecr 3339995801], length 0
  173  10:22:18.586830 IP 17.167.200.72.https > usertekiiphone.57140: Flags [P.], seq 3554:3900, ack 1435, win 83, options [nop,nop,TS val 2390924240 ecr 3339995801], length 346
  174  10:22:18.586841 IP dlinkrouter.domain > usertekiiphone.50816: 31951 1/0/0 CNAME ocsp2-lb.apple.com.akadns.net. (76)
  175  10:22:18.586845 IP dlinkrouter.domain > usertekiiphone.61688: 64549 2/0/0 CNAME ocsp2-lb.apple.com.akadns.net., A 17.253.117.202 (92)
  176  10:22:18.586859 IP 17.167.200.36.https > usertekiiphone.57141: Flags [P.], seq 2811:2862, ack 611, win 84, options [nop,nop,TS val 389218052 ecr 1226116847], length 51
  177  10:22:18.586860 IP 17.167.200.36.https > usertekiiphone.57141: Flags [P.], seq 2862:2931, ack 611, win 84, options [nop,nop,TS val 389218052 ecr 1226116847], length 69
  178  10:22:18.586864 IP 17.248.223.4.https > usertekiiphone.57143: Flags [.], seq 6767:8215, ack 2676, win 501, options [nop,nop,TS val 964656957 ecr 1612046761], length 1448
  179  10:22:18.586865 IP 17.248.223.4.https > usertekiiphone.57143: Flags [P.], seq 8215:9663, ack 2676, win 501, options [nop,nop,TS val 964656957 ecr 1612046761], length 1448
  180  10:22:18.586866 IP 17.248.223.4.https > usertekiiphone.57143: Flags [.], seq 9663:11111, ack 2676, win 501, options [nop,nop,TS val 964656959 ecr 1612046761], length 1448
  181  10:22:18.586867 IP 17.248.223.4.https > usertekiiphone.57143: Flags [P.], seq 11111:12559, ack 2676, win 501, options [nop,nop,TS val 964656959 ecr 1612046761], length 1448
  182  10:22:18.586867 IP 17.248.223.4.https > usertekiiphone.57143: Flags [.], seq 12559:14007, ack 2676, win 501, options [nop,nop,TS val 964656962 ecr 1612046761], length 1448
  183  10:22:18.586869 IP 17.248.223.4.https > usertekiiphone.57143: Flags [P.], seq 14007:14969, ack 2676, win 501, options [nop,nop,TS val 964656962 ecr 1612046761], length 962
  184  10:22:18.586949 IP 17.248.223.4.https > usertekiiphone.57144: Flags [.], seq 6731:8179, ack 2685, win 501, options [nop,nop,TS val 1199017297 ecr 799221533], length 1448
  185  10:22:18.586950 IP 17.248.223.4.https > usertekiiphone.57144: Flags [P.], seq 8179:8742, ack 2685, win 501, options [nop,nop,TS val 1199017297 ecr 799221533], length 563
  186  10:22:18.586951 IP 17.248.223.4.https > usertekiiphone.57144: Flags [P.], seq 8742:8773, ack 2685, win 501, options [nop,nop,TS val 1199017297 ecr 799221533], length 31
  187  10:22:18.588092 IP usertekiiphone.49629 > dlinkrouter.domain: 39068+ Type65? ocsp2-lb.apple.com.akadns.net. (47)
  188  10:22:18.588274 IP usertekiiphone.57140 > 17.167.200.72.https: Flags [.], ack 3554, win 4077, options [nop,nop,TS val 3339996094 ecr 2390924228], length 0
  189  10:22:18.588275 IP usertekiiphone.57140 > 17.167.200.72.https: Flags [.], ack 3900, win 4066, options [nop,nop,TS val 3339996094 ecr 2390924240], length 0
  190  10:22:18.588278 IP usertekiiphone.57141 > 17.167.200.36.https: Flags [.], ack 2931, win 4092, options [nop,nop,TS val 1226117141 ecr 389218052], length 0
  191  10:22:18.588281 IP usertekiiphone.57143 > 17.248.223.4.https: Flags [.], ack 14969, win 3650, options [nop,nop,TS val 1612047085 ecr 964656962], length 0
  192  10:22:18.588283 IP usertekiiphone.57144 > 17.248.223.4.https: Flags [.], ack 8773, win 4012, options [nop,nop,TS val 799221805 ecr 1199017297], length 0
  193  10:22:18.589409 IP 17.248.223.4.https > usertekiiphone.57144: Flags [P.], seq 8742:8773, ack 2685, win 501, options [nop,nop,TS val 1199017342 ecr 799221533], length 31
  194  10:22:18.591680 IP usertekiiphone.57144 > 17.248.223.4.https: Flags [.], ack 8773, win 4012, options [nop,nop,TS val 799221809 ecr 1199017342,nop,nop,sack 1 {8742:8773}], length 0
  195  10:22:18.602997 IP twtpe2-vip-bx-001.aaplimg.com.https > usertekiiphone.57145: Flags [S.E], seq 1215254903, ack 1769932114, win 64980, options [mss 1456,sackOK,TS val 1705350442 ecr 4263664725,nop,wscale 8], length 0
  196  10:22:18.606996 IP dlinkrouter.domain > usertekiiphone.49629: 39068 1/0/0 CNAME ocsp2.g.aaplimg.com. (80)
  197  10:22:18.607701 IP usertekiiphone.62356 > dlinkrouter.domain: 49267+ Type65? ocsp2.g.aaplimg.com. (37)
  198  10:22:18.607834 IP usertekiiphone.61174 > dlinkrouter.domain: 57931+ A? ocsp2.g.aaplimg.com. (37)
  199  10:22:18.616054 IP usertekiiphone.57141 > 17.167.200.36.https: Flags [P.], seq 611:664, ack 2931, win 4096, options [nop,nop,TS val 1226117169 ecr 389218052], length 53
  200  10:22:18.616216 IP usertekiiphone.57141 > 17.167.200.36.https: Flags [P.], seq 664:714, ack 2931, win 4096, options [nop,nop,TS val 1226117169 ecr 389218052], length 50
  201  10:22:18.616264 IP usertekiiphone.57141 > 17.167.200.36.https: Flags [P.], seq 714:756, ack 2931, win 4096, options [nop,nop,TS val 1226117169 ecr 389218052], length 42
  202  10:22:18.616304 IP usertekiiphone.57141 > 17.167.200.36.https: Flags [P.], seq 756:912, ack 2931, win 4096, options [nop,nop,TS val 1226117169 ecr 389218052], length 156
  203  10:22:18.616715 IP usertekiiphone.57141 > 17.167.200.36.https: Flags [P.], seq 912:950, ack 2931, win 4096, options [nop,nop,TS val 1226117169 ecr 389218052], length 38
  204  10:22:18.617621 IP dlinkrouter.domain > usertekiiphone.49419: 23558 1/0/0 CNAME edge.gycpi.b.yahoodns.net. (82)
  205  10:22:18.618190 IP dlinkrouter.domain > usertekiiphone.56766: 14657 2/0/0 CNAME edge.gycpi.b.yahoodns.net., A 119.161.14.18 (98)
  206  10:22:18.618285 IP usertekiiphone.57141 > 17.167.200.36.https: Flags [P.], seq 950:1153, ack 2931, win 4096, options [nop,nop,TS val 1226117171 ecr 389218052], length 203
  207  10:22:18.618640 IP usertekiiphone.65226 > dlinkrouter.domain: 28491+ Type65? edge.gycpi.b.yahoodns.net. (43)
  208  10:22:18.618773 IP usertekiiphone.56806 > dlinkrouter.domain: 19347+ A? edge.gycpi.b.yahoodns.net. (43)
  209  10:22:18.628356 IP dlinkrouter.domain > usertekiiphone.61174: 57931 2/0/0 A 17.253.117.202, A 17.253.117.201 (69)
  210  10:22:18.639307 IP dlinkrouter.domain > usertekiiphone.56806: 19347 4/0/0 A 119.161.14.18, A 119.161.16.11, A 119.161.16.12, A 119.161.14.17 (107)
  211  10:22:18.639312 IP dlinkrouter.domain > usertekiiphone.62356: 49267 0/1/0 (97)
  212  10:22:18.649670 IP dlinkrouter.domain > usertekiiphone.65226: 28491 0/1/0 (113)
  213  10:22:18.657644 IP usertekiiphone.57145 > twtpe2-vip-bx-001.aaplimg.com.https: Flags [.], ack 1, win 4106, options [nop,nop,TS val 4263664898 ecr 1705350442], length 0
  214  10:22:18.657646 IP usertekiiphone.57145 > twtpe2-vip-bx-001.aaplimg.com.https: Flags [P.], seq 1:518, ack 1, win 4106, options [nop,nop,TS val 4263664926 ecr 1705350442], length 517
  215  10:22:18.682607 IP twtpe2-vip-bx-001.aaplimg.com.https > usertekiiphone.57145: Flags [.], ack 518, win 252, options [nop,nop,TS val 1705350515 ecr 4263664926], length 0
  216  10:22:18.684014 IP twtpe2-vip-bx-001.aaplimg.com.https > usertekiiphone.57145: Flags [.], seq 1:1445, ack 518, win 252, options [nop,nop,TS val 1705350515 ecr 4263664926], length 1444
  217  10:22:18.684016 IP twtpe2-vip-bx-001.aaplimg.com.https > usertekiiphone.57145: Flags [.], seq 1445:2889, ack 518, win 252, options [nop,nop,TS val 1705350515 ecr 4263664926], length 1444
  218  10:22:18.684017 IP twtpe2-vip-bx-001.aaplimg.com.https > usertekiiphone.57145: Flags [P.], seq 2889:4097, ack 518, win 252, options [nop,nop,TS val 1705350515 ecr 4263664926], length 1208
  219  10:22:18.684018 IP twtpe2-vip-bx-001.aaplimg.com.https > usertekiiphone.57145: Flags [P.], seq 4097:4911, ack 518, win 252, options [nop,nop,TS val 1705350515 ecr 4263664926], length 814
  220  10:22:18.687323 IP usertekiiphone.57145 > twtpe2-vip-bx-001.aaplimg.com.https: Flags [.], ack 4911, win 3952, options [nop,nop,TS val 4263664954 ecr 1705350515], length 0
  221  10:22:18.687324 IP usertekiiphone.57145 > twtpe2-vip-bx-001.aaplimg.com.https: Flags [.], ack 4911, win 4096, options [nop,nop,TS val 4263664954 ecr 1705350515], length 0
  222  10:22:18.710829 IP usertekiiphone.57146 > e2.ycpi.vip.twb.yahoo.com.https: Flags [SEW], seq 3148041790, win 65535, options [mss 1460,nop,wscale 5,nop,nop,TS val 824168546 ecr 0,sackOK,eol], length 0
  223  10:22:18.735034 IP e2.ycpi.vip.twb.yahoo.com.https > usertekiiphone.57146: Flags [S.], seq 437371421, ack 3148041791, win 28960, options [mss 1460,nop,nop,TS val 2836572921 ecr 824168546,nop,wscale 8], length 0
  224  10:22:18.748476 IP usertekiiphone.57146 > e2.ycpi.vip.twb.yahoo.com.https: Flags [.], ack 1, win 4117, options [nop,nop,TS val 824168582 ecr 2836572921], length 0
  225  10:22:18.748478 IP usertekiiphone.57146 > e2.ycpi.vip.twb.yahoo.com.https: Flags [P.], seq 1:518, ack 1, win 4117, options [nop,nop,TS val 824168585 ecr 2836572921], length 517
  226  10:22:18.772851 IP e2.ycpi.vip.twb.yahoo.com.https > usertekiiphone.57146: Flags [.], ack 518, win 118, options [nop,nop,TS val 2836572959 ecr 824168585], length 0
  227  10:22:18.773589 IP e2.ycpi.vip.twb.yahoo.com.https > usertekiiphone.57146: Flags [.], seq 1:1449, ack 518, win 118, options [nop,nop,TS val 2836572960 ecr 824168585], length 1448
  228  10:22:18.773621 IP e2.ycpi.vip.twb.yahoo.com.https > usertekiiphone.57146: Flags [.], seq 1449:2897, ack 518, win 118, options [nop,nop,TS val 2836572960 ecr 824168585], length 1448
  229  10:22:18.773622 IP e2.ycpi.vip.twb.yahoo.com.https > usertekiiphone.57146: Flags [P.], seq 2897:4097, ack 518, win 118, options [nop,nop,TS val 2836572960 ecr 824168585], length 1200
  230  10:22:18.773623 IP e2.ycpi.vip.twb.yahoo.com.https > usertekiiphone.57146: Flags [P.], seq 4097:5189, ack 518, win 118, options [nop,nop,TS val 2836572960 ecr 824168585], length 1092
  231  10:22:18.811755 IP usertekiiphone.57146 > e2.ycpi.vip.twb.yahoo.com.https: Flags [.], ack 1449, win 4072, options [nop,nop,TS val 824168616 ecr 2836572960], length 0
  232  10:22:18.811756 IP usertekiiphone.57146 > e2.ycpi.vip.twb.yahoo.com.https: Flags [.], ack 5189, win 3955, options [nop,nop,TS val 824168616 ecr 2836572960], length 0
  233  10:22:18.811756 IP usertekiiphone.57146 > e2.ycpi.vip.twb.yahoo.com.https: Flags [.], ack 5189, win 4096, options [nop,nop,TS val 824168616 ecr 2836572960], length 0
  234  10:22:18.818111 IP 0.0.0.0.bootpc > broadcasthost.bootps: BOOTP/DHCP, Request from 6a:db:ca:c7:c7:6a (oui Unknown), length 300
  235  10:22:18.823328 IP 17.167.200.36.https > usertekiiphone.57141: Flags [.], ack 756, win 84, options [nop,nop,TS val 389218378 ecr 1226117169], length 0
  236  10:22:18.823329 IP 17.167.200.36.https > usertekiiphone.57141: Flags [P.], seq 2931:2969, ack 912, win 84, options [nop,nop,TS val 389218378 ecr 1226117169], length 38
  237  10:22:18.823639 IP usertekiiphone.57141 > 17.167.200.36.https: Flags [.], ack 2969, win 4094, options [nop,nop,TS val 1226117376 ecr 389218378], length 0
  238  10:22:18.824019 IP 17.167.200.36.https > usertekiiphone.57141: Flags [.], ack 1153, win 84, options [nop,nop,TS val 389218379 ecr 1226117169], length 0
  239  10:22:18.824822 IP 17.167.200.36.https > usertekiiphone.57141: Flags [P.], seq 2969:3220, ack 1153, win 84, options [nop,nop,TS val 389218380 ecr 1226117169], length 251
  240  10:22:18.824944 IP usertekiiphone.57141 > 17.167.200.36.https: Flags [.], ack 3220, win 4088, options [nop,nop,TS val 1226117377 ecr 389218380], length 0
  241  10:22:18.870200 IP usertekiiphone.57141 > 17.167.200.36.https: Flags [P.], seq 1153:1222, ack 3220, win 4096, options [nop,nop,TS val 1226117422 ecr 389218380], length 69
  242  10:22:18.870733 IP usertekiiphone.57141 > 17.167.200.36.https: Flags [P.], seq 1222:1425, ack 3220, win 4096, options [nop,nop,TS val 1226117422 ecr 389218380], length 203
  243  10:22:18.980597 IP usertekiiphone.57145 > twtpe2-vip-bx-001.aaplimg.com.https: Flags [P.], seq 518:582, ack 4911, win 4096, options [nop,nop,TS val 4263665248 ecr 1705350515], length 64
  244  10:22:18.981630 IP usertekiiphone.57146 > e2.ycpi.vip.twb.yahoo.com.https: Flags [P.], seq 518:582, ack 5189, win 4096, options [nop,nop,TS val 824168817 ecr 2836572960], length 64
  245  10:22:18.997089 IP usertekiiphone.57146 > e2.ycpi.vip.twb.yahoo.com.https: Flags [P.], seq 582:1966, ack 5189, win 4096, options [nop,nop,TS val 824168832 ecr 2836572960], length 1384
