    1  13:58:25.766066 IP nslabs-macbook-pro.local.mdns > 224.0.0.251.mdns: 0 [2q] SRV (QM)? ncm._remoted._tcp.local. TXT (QM)? ncm._remoted._tcp.local. (47)
    2  13:58:25.766095 IP6 nslabs-macbook-pro.local.mdns > ff02::fb.mdns: 0 [2q] SRV (QM)? ncm._remoted._tcp.local. TXT (QM)? ncm._remoted._tcp.local. (47)
    3  13:58:33.834054 IP nslabs-macbook-pro.local.mdns > 224.0.0.251.mdns: 0 [2q] SRV (QU)? ncm._remoted._tcp.local. TXT (QU)? ncm._remoted._tcp.local. (47)
    4  13:58:33.834080 IP6 nslabs-macbook-pro.local.mdns > ff02::fb.mdns: 0 [2q] SRV (QU)? ncm._remoted._tcp.local. TXT (QU)? ncm._remoted._tcp.local. (47)
    5  13:58:34.836698 IP nslabs-macbook-pro.local.mdns > 224.0.0.251.mdns: 0 [2q] SRV (QM)? ncm._remoted._tcp.local. TXT (QM)? ncm._remoted._tcp.local. (47)
    6  13:58:34.836823 IP6 nslabs-macbook-pro.local.mdns > ff02::fb.mdns: 0 [2q] SRV (QM)? ncm._remoted._tcp.local. TXT (QM)? ncm._remoted._tcp.local. (47)
    7  13:58:34.980091 IP usertekiiphone.57416 > 80.14.211.130.bc.googleusercontent.com.https: Flags [P.], seq 4244552804:4244552862, ack 2555126434, win 4539, options [nop,nop,TS val 514325663 ecr 2183208318], length 58
    8  13:58:34.984548 IP usertekiiphone.57416 > 80.14.211.130.bc.googleusercontent.com.https: Flags [.], seq 58:1476, ack 1, win 4539, options [nop,nop,TS val 514325667 ecr 2183208318], length 1418
    9  13:58:34.988461 IP usertekiiphone.57416 > 80.14.211.130.bc.googleusercontent.com.https: Flags [P.], seq 1476:2106, ack 1, win 4539, options [nop,nop,TS val 514325667 ecr 2183208318], length 630
   10  13:58:34.988768 IP usertekiiphone.57416 > 80.14.211.130.bc.googleusercontent.com.https: Flags [P.], seq 2106:2253, ack 1, win 4539, options [nop,nop,TS val 514325671 ecr 2183208318], length 147
   11  13:58:35.049344 IP 80.14.211.130.bc.googleusercontent.com.https > usertekiiphone.57416: Flags [.], ack 58, win 741, options [nop,nop,TS val 2183221219 ecr 514325663], length 0
   12  13:58:35.049346 IP 80.14.211.130.bc.googleusercontent.com.https > usertekiiphone.57416: Flags [.], ack 1476, win 752, options [nop,nop,TS val 2183221219 ecr 514325667], length 0
   13  13:58:35.049348 IP 80.14.211.130.bc.googleusercontent.com.https > usertekiiphone.57416: Flags [.], ack 2106, win 763, options [nop,nop,TS val 2183221219 ecr 514325667], length 0
   14  13:58:35.049349 IP 80.14.211.130.bc.googleusercontent.com.https > usertekiiphone.57416: Flags [.], ack 2253, win 774, options [nop,nop,TS val 2183221219 ecr 514325671], length 0
   15  13:58:35.290472 IP 80.14.211.130.bc.googleusercontent.com.https > usertekiiphone.57416: Flags [P.], seq 1:63, ack 2253, win 774, options [nop,nop,TS val 2183221462 ecr 514325671], length 62
   16  13:58:35.290474 IP 80.14.211.130.bc.googleusercontent.com.https > usertekiiphone.57416: Flags [P.], seq 63:1481, ack 2253, win 774, options [nop,nop,TS val 2183221462 ecr 514325671], length 1418
   17  13:58:35.290477 IP 80.14.211.130.bc.googleusercontent.com.https > usertekiiphone.57416: Flags [.], seq 1481:2899, ack 2253, win 774, options [nop,nop,TS val 2183221462 ecr 514325671], length 1418
   18  13:58:35.290480 IP 80.14.211.130.bc.googleusercontent.com.https > usertekiiphone.57416: Flags [P.], seq 2899:4122, ack 2253, win 774, options [nop,nop,TS val 2183221462 ecr 514325671], length 1223
   19  13:58:35.291910 IP 80.14.211.130.bc.googleusercontent.com.https > usertekiiphone.57416: Flags [P.], seq 4122:5540, ack 2253, win 774, options [nop,nop,TS val 2183221463 ecr 514325671], length 1418
   20  13:58:35.291913 IP 80.14.211.130.bc.googleusercontent.com.https > usertekiiphone.57416: Flags [.], seq 5540:6958, ack 2253, win 774, options [nop,nop,TS val 2183221463 ecr 514325671], length 1418
   21  13:58:35.291916 IP 80.14.211.130.bc.googleusercontent.com.https > usertekiiphone.57416: Flags [P.], seq 6958:8376, ack 2253, win 774, options [nop,nop,TS val 2183221463 ecr 514325671], length 1418
   22  13:58:35.291956 IP 80.14.211.130.bc.googleusercontent.com.https > usertekiiphone.57416: Flags [P.], seq 8376:8471, ack 2253, win 774, options [nop,nop,TS val 2183221463 ecr 514325671], length 95
   23  13:58:35.292790 IP 80.14.211.130.bc.googleusercontent.com.https > usertekiiphone.57416: Flags [P.], seq 8471:9889, ack 2253, win 774, options [nop,nop,TS val 2183221464 ecr 514325671], length 1418
   24  13:58:35.292793 IP 80.14.211.130.bc.googleusercontent.com.https > usertekiiphone.57416: Flags [.], seq 9889:11307, ack 2253, win 774, options [nop,nop,TS val 2183221464 ecr 514325671], length 1418
   25  13:58:35.293030 IP 80.14.211.130.bc.googleusercontent.com.https > usertekiiphone.57416: Flags [P.], seq 11307:12725, ack 2253, win 774, options [nop,nop,TS val 2183221464 ecr 514325671], length 1418
   26  13:58:35.293033 IP 80.14.211.130.bc.googleusercontent.com.https > usertekiiphone.57416: Flags [P.], seq 12725:12910, ack 2253, win 774, options [nop,nop,TS val 2183221464 ecr 514325671], length 185
   27  13:58:35.293760 IP 80.14.211.130.bc.googleusercontent.com.https > usertekiiphone.57416: Flags [P.], seq 12910:14328, ack 2253, win 774, options [nop,nop,TS val 2183221465 ecr 514325671], length 1418
   28  13:58:35.293769 IP 80.14.211.130.bc.googleusercontent.com.https > usertekiiphone.57416: Flags [P.], seq 14328:14925, ack 2253, win 774, options [nop,nop,TS val 2183221465 ecr 514325671], length 597
   29  13:58:35.296024 IP 80.14.211.130.bc.googleusercontent.com.https > usertekiiphone.57416: Flags [P.], seq 14925:16343, ack 2253, win 774, options [nop,nop,TS val 2183221467 ecr 514325671], length 1418
   30  13:58:35.296027 IP 80.14.211.130.bc.googleusercontent.com.https > usertekiiphone.57416: Flags [.], seq 16343:17761, ack 2253, win 774, options [nop,nop,TS val 2183221467 ecr 514325671], length 1418
   31  13:58:35.296028 IP 80.14.211.130.bc.googleusercontent.com.https > usertekiiphone.57416: Flags [P.], seq 17761:19179, ack 2253, win 774, options [nop,nop,TS val 2183221467 ecr 514325671], length 1418
   32  13:58:35.296030 IP 80.14.211.130.bc.googleusercontent.com.https > usertekiiphone.57416: Flags [P.], seq 19179:19215, ack 2253, win 774, options [nop,nop,TS val 2183221467 ecr 514325671], length 36
   33  13:58:35.296908 IP 80.14.211.130.bc.googleusercontent.com.https > usertekiiphone.57416: Flags [P.], seq 19215:20633, ack 2253, win 774, options [nop,nop,TS val 2183221468 ecr 514325671], length 1418
   34  13:58:35.296911 IP 80.14.211.130.bc.googleusercontent.com.https > usertekiiphone.57416: Flags [.], seq 20633:22051, ack 2253, win 774, options [nop,nop,TS val 2183221468 ecr 514325671], length 1418
   35  13:58:35.296913 IP 80.14.211.130.bc.googleusercontent.com.https > usertekiiphone.57416: Flags [P.], seq 22051:23469, ack 2253, win 774, options [nop,nop,TS val 2183221468 ecr 514325671], length 1418
   36  13:58:35.296915 IP 80.14.211.130.bc.googleusercontent.com.https > usertekiiphone.57416: Flags [P.], seq 23469:23661, ack 2253, win 774, options [nop,nop,TS val 2183221468 ecr 514325671], length 192
   37  13:58:35.297729 IP usertekiiphone.57416 > 80.14.211.130.bc.googleusercontent.com.https: Flags [.], ack 4122, win 4410, options [nop,nop,TS val 514325978 ecr 2183221462], length 0
   38  13:58:35.297731 IP usertekiiphone.57416 > 80.14.211.130.bc.googleusercontent.com.https: Flags [.], ack 8376, win 4277, options [nop,nop,TS val 514325978 ecr 2183221463], length 0
   39  13:58:35.297732 IP usertekiiphone.57416 > 80.14.211.130.bc.googleusercontent.com.https: Flags [.], ack 8471, win 4274, options [nop,nop,TS val 514325978 ecr 2183221463], length 0
   40  13:58:35.297733 IP usertekiiphone.57416 > 80.14.211.130.bc.googleusercontent.com.https: Flags [.], ack 11307, win 4185, options [nop,nop,TS val 514325978 ecr 2183221464], length 0
   41  13:58:35.297734 IP usertekiiphone.57416 > 80.14.211.130.bc.googleusercontent.com.https: Flags [.], ack 12910, win 4135, options [nop,nop,TS val 514325978 ecr 2183221464], length 0
   42  13:58:35.297735 IP usertekiiphone.57416 > 80.14.211.130.bc.googleusercontent.com.https: Flags [.], ack 14925, win 4072, options [nop,nop,TS val 514325978 ecr 2183221465], length 0
   43  13:58:35.297736 IP usertekiiphone.57416 > 80.14.211.130.bc.googleusercontent.com.https: Flags [.], ack 19215, win 3938, options [nop,nop,TS val 514325978 ecr 2183221467], length 0
   44  13:58:35.297737 IP usertekiiphone.57416 > 80.14.211.130.bc.googleusercontent.com.https: Flags [.], ack 19215, win 4539, options [nop,nop,TS val 514325978 ecr 2183221467], length 0
   45  13:58:35.299174 IP 80.14.211.130.bc.googleusercontent.com.https > usertekiiphone.57416: Flags [P.], seq 23661:25079, ack 2253, win 774, options [nop,nop,TS val 2183221470 ecr 514325671], length 1418
   46  13:58:35.299176 IP 80.14.211.130.bc.googleusercontent.com.https > usertekiiphone.57416: Flags [.], seq 25079:26497, ack 2253, win 774, options [nop,nop,TS val 2183221470 ecr 514325671], length 1418
   47  13:58:35.299179 IP 80.14.211.130.bc.googleusercontent.com.https > usertekiiphone.57416: Flags [P.], seq 26497:27876, ack 2253, win 774, options [nop,nop,TS val 2183221470 ecr 514325671], length 1379
   48  13:58:35.299890 IP 80.14.211.130.bc.googleusercontent.com.https > usertekiiphone.57416: Flags [P.], seq 27876:29294, ack 2253, win 774, options [nop,nop,TS val 2183221471 ecr 514325671], length 1418
   49  13:58:35.299893 IP 80.14.211.130.bc.googleusercontent.com.https > usertekiiphone.57416: Flags [.], seq 29294:30712, ack 2253, win 774, options [nop,nop,TS val 2183221471 ecr 514325671], length 1418
   50  13:58:35.299895 IP 80.14.211.130.bc.googleusercontent.com.https > usertekiiphone.57416: Flags [P.], seq 30712:32130, ack 2253, win 774, options [nop,nop,TS val 2183221471 ecr 514325671], length 1418
   51  13:58:35.299897 IP 80.14.211.130.bc.googleusercontent.com.https > usertekiiphone.57416: Flags [P.], seq 32130:32286, ack 2253, win 774, options [nop,nop,TS val 2183221471 ecr 514325671], length 156
   52  13:58:35.299943 IP usertekiiphone.57416 > 80.14.211.130.bc.googleusercontent.com.https: Flags [.], ack 23661, win 4400, options [nop,nop,TS val 514325981 ecr 2183221468], length 0
   53  13:58:35.299945 IP usertekiiphone.57416 > 80.14.211.130.bc.googleusercontent.com.https: Flags [.], ack 23661, win 4539, options [nop,nop,TS val 514325981 ecr 2183221468], length 0
   54  13:58:35.301008 IP 80.14.211.130.bc.googleusercontent.com.https > usertekiiphone.57416: Flags [P.], seq 35122:36540, ack 2253, win 774, options [nop,nop,TS val 2183221472 ecr 514325978], length 1418
   55  13:58:35.301096 IP 80.14.211.130.bc.googleusercontent.com.https > usertekiiphone.57416: Flags [P.], seq 32286:33704, ack 2253, win 774, options [nop,nop,TS val 2183221472 ecr 514325978], length 1418
   56  13:58:35.301098 IP 80.14.211.130.bc.googleusercontent.com.https > usertekiiphone.57416: Flags [.], seq 33704:35122, ack 2253, win 774, options [nop,nop,TS val 2183221472 ecr 514325978], length 1418
   57  13:58:35.301482 IP usertekiiphone.57416 > 80.14.211.130.bc.googleusercontent.com.https: Flags [.], ack 27876, win 4407, options [nop,nop,TS val 514325982 ecr 2183221470], length 0
   58  13:58:35.301484 IP usertekiiphone.57416 > 80.14.211.130.bc.googleusercontent.com.https: Flags [.], ack 32286, win 4269, options [nop,nop,TS val 514325982 ecr 2183221471], length 0
   59  13:58:35.301485 IP usertekiiphone.57416 > 80.14.211.130.bc.googleusercontent.com.https: Flags [.], ack 32286, win 4539, options [nop,nop,TS val 514325982 ecr 2183221471], length 0
   60  13:58:35.302470 IP usertekiiphone.57416 > 80.14.211.130.bc.googleusercontent.com.https: Flags [.], ack 32286, win 4539, options [nop,nop,TS val 514325982 ecr 2183221471,nop,nop,sack 1 {35122:36540}], length 0
   61  13:58:35.302471 IP usertekiiphone.57416 > 80.14.211.130.bc.googleusercontent.com.https: Flags [.], ack 36540, win 4406, options [nop,nop,TS val 514325982 ecr 2183221472], length 0
   62  13:58:35.302472 IP usertekiiphone.57416 > 80.14.211.130.bc.googleusercontent.com.https: Flags [.], ack 36540, win 4539, options [nop,nop,TS val 514325982 ecr 2183221472], length 0
   63  13:58:35.302596 IP 80.14.211.130.bc.googleusercontent.com.https > usertekiiphone.57416: Flags [P.], seq 36540:37958, ack 2253, win 774, options [nop,nop,TS val 2183221474 ecr 514325981], length 1418
   64  13:58:35.304826 IP 80.14.211.130.bc.googleusercontent.com.https > usertekiiphone.57416: Flags [.], seq 37958:39376, ack 2253, win 774, options [nop,nop,TS val 2183221474 ecr 514325981], length 1418
   65  13:58:35.304829 IP 80.14.211.130.bc.googleusercontent.com.https > usertekiiphone.57416: Flags [P.], seq 39376:40310, ack 2253, win 774, options [nop,nop,TS val 2183221474 ecr 514325981], length 934
   66  13:58:35.304831 IP 80.14.211.130.bc.googleusercontent.com.https > usertekiiphone.57416: Flags [P.], seq 40310:40374, ack 2253, win 774, options [nop,nop,TS val 2183221474 ecr 514325981], length 64
   67  13:58:35.304832 IP 80.14.211.130.bc.googleusercontent.com.https > usertekiiphone.57416: Flags [P.], seq 40374:40413, ack 2253, win 774, options [nop,nop,TS val 2183221474 ecr 514325981], length 39
   68  13:58:35.306564 IP usertekiiphone.57416 > 80.14.211.130.bc.googleusercontent.com.https: Flags [.], ack 37958, win 4494, options [nop,nop,TS val 514325987 ecr 2183221474], length 0
   69  13:58:35.306566 IP usertekiiphone.57416 > 80.14.211.130.bc.googleusercontent.com.https: Flags [.], ack 40413, win 4418, options [nop,nop,TS val 514325987 ecr 2183221474], length 0
   70  13:58:35.306567 IP usertekiiphone.57416 > 80.14.211.130.bc.googleusercontent.com.https: Flags [.], ack 40413, win 4539, options [nop,nop,TS val 514325987 ecr 2183221474], length 0
   71  13:58:35.307056 IP usertekiiphone.57416 > 80.14.211.130.bc.googleusercontent.com.https: Flags [P.], seq 2253:2292, ack 40413, win 4539, options [nop,nop,TS val 514325987 ecr 2183221474], length 39
   72  13:58:35.309212 IP 80.14.211.130.bc.googleusercontent.com.https > usertekiiphone.57416: Flags [.], ack 2292, win 774, options [nop,nop,TS val 2183221481 ecr 514325987], length 0
   73  13:58:35.768322 IP 0.0.0.0.bootpc > broadcasthost.bootps: BOOTP/DHCP, Request from 6a:db:ca:c7:c7:6c (oui Unknown), length 300
   74  13:58:37.041735 IP 0.0.0.0.bootpc > broadcasthost.bootps: BOOTP/DHCP, Request from 6a:db:ca:c7:c7:6c (oui Unknown), length 300
   75  13:58:37.844187 IP nslabs-macbook-pro.local.mdns > 224.0.0.251.mdns: 0 [2q] SRV (QM)? ncm._remoted._tcp.local. TXT (QM)? ncm._remoted._tcp.local. (47)
   76  13:58:37.844317 IP6 nslabs-macbook-pro.local.mdns > ff02::fb.mdns: 0 [2q] SRV (QM)? ncm._remoted._tcp.local. TXT (QM)? ncm._remoted._tcp.local. (47)
   77  13:58:38.462511 IP 0.0.0.0.bootpc > broadcasthost.bootps: BOOTP/DHCP, Request from 6a:db:ca:c7:c7:6a (oui Unknown), length 300
   78  13:58:39.530121 IP 0.0.0.0.bootpc > broadcasthost.bootps: BOOTP/DHCP, Request from 6a:db:ca:c7:c7:6a (oui Unknown), length 300
   79  13:58:39.885257 IP 0.0.0.0.bootpc > broadcasthost.bootps: BOOTP/DHCP, Request from 6a:db:ca:c7:c7:6c (oui Unknown), length 300
   80  13:58:40.349571 ARP, Request who-has usertekiiphone tell dlinkrouter, length 28
   81  13:58:40.349611 ARP, Reply usertekiiphone is-at 42:55:64:8e:cb:27 (oui Unknown), length 28
   82  13:58:40.698873 IP usertekiiphone.57411 > 80.14.211.130.bc.googleusercontent.com.https: Flags [P.], seq 1841200005:1841200060, ack 4254213520, win 4096, options [nop,nop,TS val 3326787889 ecr 1190514922], length 55
   83  13:58:40.804355 IP 80.14.211.130.bc.googleusercontent.com.https > usertekiiphone.57411: Flags [.], ack 55, win 265, options [nop,nop,TS val 1190544758 ecr 3326787889], length 0
   84  13:58:40.966011 IP 80.14.211.130.bc.googleusercontent.com.https > usertekiiphone.57411: Flags [P.], seq 1:62, ack 55, win 265, options [nop,nop,TS val 1190544918 ecr 3326787889], length 61
   85  13:58:40.966014 IP 80.14.211.130.bc.googleusercontent.com.https > usertekiiphone.57411: Flags [P.], seq 62:133, ack 55, win 265, options [nop,nop,TS val 1190544918 ecr 3326787889], length 71
   86  13:58:40.966015 IP 80.14.211.130.bc.googleusercontent.com.https > usertekiiphone.57411: Flags [P.], seq 133:172, ack 55, win 265, options [nop,nop,TS val 1190544918 ecr 3326787889], length 39
   87  13:58:40.966477 IP usertekiiphone.57411 > 80.14.211.130.bc.googleusercontent.com.https: Flags [.], ack 172, win 4090, options [nop,nop,TS val 3326788154 ecr 1190544918], length 0
   88  13:58:40.967285 IP usertekiiphone.57411 > 80.14.211.130.bc.googleusercontent.com.https: Flags [P.], seq 55:94, ack 172, win 4096, options [nop,nop,TS val 3326788155 ecr 1190544918], length 39
   89  13:58:40.970186 IP 80.14.211.130.bc.googleusercontent.com.https > usertekiiphone.57411: Flags [.], ack 94, win 265, options [nop,nop,TS val 1190544924 ecr 3326788155], length 0
   90  13:58:41.534266 IP 0.0.0.0.bootpc > broadcasthost.bootps: BOOTP/DHCP, Request from 6a:db:ca:c7:c7:6a (oui Unknown), length 300
   91  13:58:44.642441 IP 0.0.0.0.bootpc > broadcasthost.bootps: BOOTP/DHCP, Request from 6a:db:ca:c7:c7:6c (oui Unknown), length 300
   92  13:58:45.571897 IP 80.14.211.130.bc.googleusercontent.com.https > usertekiiphone.52177: Flags [F.], seq 1901923756, ack 1196567772, win 276, options [nop,nop,TS val 2160584413 ecr 1833773997], length 0
   93  13:58:45.572091 IP usertekiiphone.52177 > 80.14.211.130.bc.googleusercontent.com.https: Flags [.], ack 1, win 4096, options [nop,nop,TS val 1833833709 ecr 2160584413], length 0
   94  13:58:45.593683 IP usertekiiphone.52177 > 80.14.211.130.bc.googleusercontent.com.https: Flags [F.], seq 1, ack 1, win 4096, options [nop,nop,TS val 1833833730 ecr 2160584413], length 0
   95  13:58:45.596023 IP usertekiiphone.57416 > 80.14.211.130.bc.googleusercontent.com.https: Flags [P.], seq 2292:2350, ack 40413, win 4539, options [nop,nop,TS val 514336271 ecr 2183221481], length 58
   96  13:58:45.596431 IP 80.14.211.130.bc.googleusercontent.com.https > usertekiiphone.52177: Flags [.], ack 2, win 276, options [nop,nop,TS val 2160584569 ecr 1833833730], length 0
   97  13:58:45.596810 IP usertekiiphone.57416 > 80.14.211.130.bc.googleusercontent.com.https: Flags [.], seq 2350:3768, ack 40413, win 4539, options [nop,nop,TS val 514336271 ecr 2183221481], length 1418
   98  13:58:45.596857 IP usertekiiphone.57416 > 80.14.211.130.bc.googleusercontent.com.https: Flags [P.], seq 3768:4217, ack 40413, win 4539, options [nop,nop,TS val 514336271 ecr 2183221481], length 449
   99  13:58:45.598568 IP 80.14.211.130.bc.googleusercontent.com.https > usertekiiphone.57416: Flags [.], ack 2350, win 774, options [nop,nop,TS val 2183231770 ecr 514336271], length 0
  100  13:58:45.599644 IP 80.14.211.130.bc.googleusercontent.com.https > usertekiiphone.57416: Flags [.], ack 3768, win 786, options [nop,nop,TS val 2183231771 ecr 514336271], length 0
  101  13:58:45.599646 IP 80.14.211.130.bc.googleusercontent.com.https > usertekiiphone.57416: Flags [.], ack 4217, win 797, options [nop,nop,TS val 2183231771 ecr 514336271], length 0
  102  13:58:45.640965 IP 0.0.0.0.bootpc > broadcasthost.bootps: BOOTP/DHCP, Request from 6a:db:ca:c7:c7:6a (oui Unknown), length 300
  103  13:58:45.981713 IP 80.14.211.130.bc.googleusercontent.com.https > usertekiiphone.57416: Flags [P.], seq 40413:40475, ack 4217, win 797, options [nop,nop,TS val 2183231997 ecr 514336271], length 62
  104  13:58:45.983194 IP 80.14.211.130.bc.googleusercontent.com.https > usertekiiphone.57416: Flags [P.], seq 40475:41893, ack 4217, win 797, options [nop,nop,TS val 2183231997 ecr 514336271], length 1418
  105  13:58:45.983197 IP 80.14.211.130.bc.googleusercontent.com.https > usertekiiphone.57416: Flags [P.], seq 41893:42739, ack 4217, win 797, options [nop,nop,TS val 2183231997 ecr 514336271], length 846
  106  13:58:45.983198 IP 80.14.211.130.bc.googleusercontent.com.https > usertekiiphone.57416: Flags [P.], seq 42739:42778, ack 4217, win 797, options [nop,nop,TS val 2183231997 ecr 514336271], length 39
  107  13:58:45.983200 IP 80.14.211.130.bc.googleusercontent.com.https > usertekiiphone.57416: Flags [P.], seq 42739:42778, ack 4217, win 797, options [nop,nop,TS val 2183232019 ecr 514336271], length 39
  108  13:58:45.985494 IP usertekiiphone.57416 > 80.14.211.130.bc.googleusercontent.com.https: Flags [.], ack 40475, win 4537, options [nop,nop,TS val 514336658 ecr 2183231997], length 0
  109  13:58:45.985497 IP usertekiiphone.57416 > 80.14.211.130.bc.googleusercontent.com.https: Flags [.], ack 42778, win 4465, options [nop,nop,TS val 514336658 ecr 2183231997], length 0
  110  13:58:45.985498 IP usertekiiphone.57416 > 80.14.211.130.bc.googleusercontent.com.https: Flags [.], ack 42778, win 4465, options [nop,nop,TS val 514336658 ecr 2183232019,nop,nop,sack 1 {42739:42778}], length 0
  111  13:58:45.988125 IP usertekiiphone.57416 > 80.14.211.130.bc.googleusercontent.com.https: Flags [P.], seq 4217:4256, ack 42778, win 4539, options [nop,nop,TS val 514336660 ecr 2183232019], length 39
  112  13:58:45.990540 IP 80.14.211.130.bc.googleusercontent.com.https > usertekiiphone.57416: Flags [.], ack 4256, win 797, options [nop,nop,TS val 2183232162 ecr 514336660], length 0
  113  13:58:46.008038 IP usertekiiphone.52178 > 80.14.211.130.bc.googleusercontent.com.https: Flags [S], seq 3542700213, win 65535, options [mss 1460,nop,wscale 5,nop,nop,TS val 1368905176 ecr 0,sackOK,eol], length 0
  114  13:58:46.009179 IP usertekiiphone.62271 > dlinkrouter.domain: 617+ A? pgorelease.nianticlabs.com. (44)
  115  13:58:46.010884 IP 80.14.211.130.bc.googleusercontent.com.https > usertekiiphone.52178: Flags [S.], seq 1350671169, ack 3542700214, win 65535, options [mss 1430,sackOK,TS val 4206633157 ecr 1368905176,nop,wscale 8], length 0
  116  13:58:46.011034 IP usertekiiphone.52178 > 80.14.211.130.bc.googleusercontent.com.https: Flags [.], ack 1, win 4121, options [nop,nop,TS val 1368905180 ecr 4206633157], length 0
  117  13:58:46.015205 IP usertekiiphone.52178 > 80.14.211.130.bc.googleusercontent.com.https: Flags [P.], seq 1:219, ack 1, win 4121, options [nop,nop,TS val 1368905184 ecr 4206633157], length 218
  118  13:58:46.018130 IP 80.14.211.130.bc.googleusercontent.com.https > usertekiiphone.52178: Flags [.], ack 219, win 261, options [nop,nop,TS val 4206633164 ecr 1368905184], length 0
  119  13:58:46.018416 IP 80.14.211.130.bc.googleusercontent.com.https > usertekiiphone.52178: Flags [P.], seq 1:148, ack 219, win 261, options [nop,nop,TS val 4206633165 ecr 1368905184], length 147
  120  13:58:46.018512 IP usertekiiphone.52178 > 80.14.211.130.bc.googleusercontent.com.https: Flags [.], ack 148, win 4116, options [nop,nop,TS val 1368905187 ecr 4206633165], length 0
  121  13:58:46.019222 IP usertekiiphone.52178 > 80.14.211.130.bc.googleusercontent.com.https: Flags [P.], seq 219:225, ack 148, win 4116, options [nop,nop,TS val 1368905187 ecr 4206633165], length 6
  122  13:58:46.027445 IP 80.14.211.130.bc.googleusercontent.com.https > usertekiiphone.52178: Flags [.], ack 225, win 261, options [nop,nop,TS val 4206633174 ecr 1368905187], length 0
  123  13:58:46.027607 IP usertekiiphone.52178 > 80.14.211.130.bc.googleusercontent.com.https: Flags [P.], seq 225:270, ack 148, win 4116, options [nop,nop,TS val 1368905196 ecr 4206633174], length 45
  124  13:58:46.030517 IP 80.14.211.130.bc.googleusercontent.com.https > usertekiiphone.52178: Flags [.], ack 270, win 261, options [nop,nop,TS val 4206633177 ecr 1368905196], length 0
  125  13:58:46.031870 IP dlinkrouter.domain > usertekiiphone.62271: 617 1/0/0 A 130.211.14.80 (60)
  126  13:58:46.052969 IP usertekiiphone.52178 > 80.14.211.130.bc.googleusercontent.com.https: Flags [P.], seq 270:562, ack 148, win 4116, options [nop,nop,TS val 1368905221 ecr 4206633177], length 292
  127  13:58:46.055467 IP 80.14.211.130.bc.googleusercontent.com.https > usertekiiphone.52178: Flags [.], ack 562, win 265, options [nop,nop,TS val 4206633202 ecr 1368905221], length 0
  128  13:58:46.217633 IP 80.14.211.130.bc.googleusercontent.com.https > usertekiiphone.52178: Flags [P.], seq 148:398, ack 562, win 265, options [nop,nop,TS val 4206633364 ecr 1368905221], length 250
  129  13:58:46.217772 IP usertekiiphone.52178 > 80.14.211.130.bc.googleusercontent.com.https: Flags [.], ack 398, win 4108, options [nop,nop,TS val 1368905383 ecr 4206633364], length 0
  130  13:58:46.245464 IP usertekiiphone.52178 > 80.14.211.130.bc.googleusercontent.com.https: Flags [P.], seq 562:1771, ack 398, win 4108, options [nop,nop,TS val 1368905410 ecr 4206633364], length 1209
  131  13:58:46.248199 IP 80.14.211.130.bc.googleusercontent.com.https > usertekiiphone.52178: Flags [.], ack 1771, win 276, options [nop,nop,TS val 4206633395 ecr 1368905410], length 0
  132  13:58:46.577669 IP 80.14.211.130.bc.googleusercontent.com.https > usertekiiphone.52178: Flags [P.], seq 398:567, ack 1771, win 276, options [nop,nop,TS val 4206633555 ecr 1368905410], length 169
  133  13:58:46.577784 IP usertekiiphone.52178 > 80.14.211.130.bc.googleusercontent.com.https: Flags [.], ack 567, win 4103, options [nop,nop,TS val 1368905740 ecr 4206633555], length 0
  134  13:58:46.864033 IP nslabs-macbook-pro.local.mdns > 224.0.0.251.mdns: 0 [2q] SRV (QM)? ncm._remoted._tcp.local. TXT (QM)? ncm._remoted._tcp.local. (47)
  135  13:58:46.864098 IP6 nslabs-macbook-pro.local.mdns > ff02::fb.mdns: 0 [2q] SRV (QM)? ncm._remoted._tcp.local. TXT (QM)? ncm._remoted._tcp.local. (47)
  136  13:58:49.394646 IP nslabs-macbook-pro.local.58466 > 239.255.255.250.ssdp: UDP, length 174
  137  13:58:50.395796 IP nslabs-macbook-pro.local.58466 > 239.255.255.250.ssdp: UDP, length 174
  138  13:58:51.396053 IP nslabs-macbook-pro.local.58466 > 239.255.255.250.ssdp: UDP, length 174
  139  13:58:52.397015 IP nslabs-macbook-pro.local.58466 > 239.255.255.250.ssdp: UDP, length 174
  140  13:58:52.830082 IP 0.0.0.0.bootpc > broadcasthost.bootps: BOOTP/DHCP, Request from 6a:db:ca:c7:c7:6c (oui Unknown), length 300
  141  13:58:54.420743 IP 0.0.0.0.bootpc > broadcasthost.bootps: BOOTP/DHCP, Request from 6a:db:ca:c7:c7:6a (oui Unknown), length 300
  142  13:58:54.831785 IP nslabs-macbook-pro.local.mdns > 224.0.0.251.mdns: 0 [2q] SRV (QU)? ncm._remoted._tcp.local. TXT (QU)? ncm._remoted._tcp.local. (47)
  143  13:58:54.831863 IP6 nslabs-macbook-pro.local.mdns > ff02::fb.mdns: 0 [2q] SRV (QU)? ncm._remoted._tcp.local. TXT (QU)? ncm._remoted._tcp.local. (47)
  144  13:58:55.084540 IP ec2-54-193-68-112.us-west-1.compute.amazonaws.com.https > usertekiiphone.57421: Flags [P.], seq 4223393027:4223393073, ack 2208576112, win 121, options [nop,nop,TS val 661594545 ecr 3718818071], length 46
  145  13:58:55.084541 IP ec2-54-193-68-112.us-west-1.compute.amazonaws.com.https > usertekiiphone.57421: Flags [P.], seq 46:77, ack 1, win 121, options [nop,nop,TS val 661594545 ecr 3718818071], length 31
  146  13:58:55.084542 IP ec2-54-193-68-112.us-west-1.compute.amazonaws.com.https > usertekiiphone.57421: Flags [F.], seq 77, ack 1, win 121, options [nop,nop,TS val 661594545 ecr 3718818071], length 0
  147  13:58:55.085810 IP usertekiiphone.57421 > ec2-54-193-68-112.us-west-1.compute.amazonaws.com.https: Flags [.], ack 77, win 4093, options [nop,nop,TS val 3718878271 ecr 661594545], length 0
  148  13:58:55.085811 IP usertekiiphone.57421 > ec2-54-193-68-112.us-west-1.compute.amazonaws.com.https: Flags [.], ack 78, win 4093, options [nop,nop,TS val 3718878271 ecr 661594545], length 0
  149  13:58:55.098061 IP usertekiiphone.57421 > ec2-54-193-68-112.us-west-1.compute.amazonaws.com.https: Flags [P.], seq 1:47, ack 78, win 4096, options [nop,nop,TS val 3718878283 ecr 661594545], length 46
  150  13:58:55.098953 IP usertekiiphone.57421 > ec2-54-193-68-112.us-west-1.compute.amazonaws.com.https: Flags [P.], seq 47:78, ack 78, win 4096, options [nop,nop,TS val 3718878284 ecr 661594545], length 31
  151  13:58:55.100546 IP usertekiiphone.57421 > ec2-54-193-68-112.us-west-1.compute.amazonaws.com.https: Flags [F.], seq 78, ack 78, win 4096, options [nop,nop,TS val 3718878285 ecr 661594545], length 0
  152  13:58:55.251709 IP ec2-54-193-68-112.us-west-1.compute.amazonaws.com.https > usertekiiphone.57421: Flags [F.], seq 77, ack 1, win 121, options [nop,nop,TS val 661594861 ecr 3718818071], length 0
  153  13:58:55.251710 IP ec2-54-193-68-112.us-west-1.compute.amazonaws.com.https > usertekiiphone.57421: Flags [R], seq 4223393105, win 0, length 0
  154  13:58:55.251711 IP ec2-54-193-68-112.us-west-1.compute.amazonaws.com.https > usertekiiphone.57421: Flags [R], seq 4223393105, win 0, length 0
  155  13:58:55.251711 IP ec2-54-193-68-112.us-west-1.compute.amazonaws.com.https > usertekiiphone.57421: Flags [R], seq 4223393105, win 0, length 0
  156  13:58:55.251972 IP usertekiiphone.57421 > ec2-54-193-68-112.us-west-1.compute.amazonaws.com.https: Flags [F.], seq 78, ack 78, win 4096, options [nop,nop,TS val 3718878435 ecr 661594545], length 0
  157  13:58:55.490031 IP ec2-54-193-68-112.us-west-1.compute.amazonaws.com.https > usertekiiphone.57421: Flags [R], seq 4223393105, win 0, length 0
  158  13:58:55.834827 IP nslabs-macbook-pro.local.mdns > 224.0.0.251.mdns: 0 [2q] SRV (QM)? ncm._remoted._tcp.local. TXT (QM)? ncm._remoted._tcp.local. (47)
  159  13:58:55.834927 IP6 nslabs-macbook-pro.local.mdns > ff02::fb.mdns: 0 [2q] SRV (QM)? ncm._remoted._tcp.local. TXT (QM)? ncm._remoted._tcp.local. (47)
  160  13:58:56.235398 IP usertekiiphone.57417 > 151.101.77.208.https: Flags [P.], seq 3690521671:3690521735, ack 73788404, win 4096, options [nop,nop,TS val 1293669925 ecr 311120004], length 64
  161  13:58:56.237632 IP usertekiiphone.57417 > 151.101.77.208.https: Flags [P.], seq 64:463, ack 1, win 4096, options [nop,nop,TS val 1293669927 ecr 311120004], length 399
  162  13:58:56.270529 IP 151.101.77.208.https > usertekiiphone.57417: Flags [.], ack 64, win 299, options [nop,nop,TS val 311183430 ecr 1293669925], length 0
  163  13:58:56.270530 IP 151.101.77.208.https > usertekiiphone.57417: Flags [.], ack 463, win 305, options [nop,nop,TS val 311183430 ecr 1293669927], length 0
  164  13:58:56.270531 IP 151.101.77.208.https > usertekiiphone.57417: Flags [P.], seq 1:43, ack 463, win 305, options [nop,nop,TS val 311183430 ecr 1293669927], length 42
  165  13:58:56.271990 IP usertekiiphone.57417 > 151.101.77.208.https: Flags [.], ack 43, win 4094, options [nop,nop,TS val 1293669959 ecr 311183430], length 0
  166  13:58:56.491874 IP 151.101.77.208.https > usertekiiphone.57417: Flags [P.], seq 43:221, ack 463, win 305, options [nop,nop,TS val 311183651 ecr 1293669959], length 178
  167  13:58:56.491876 IP 151.101.77.208.https > usertekiiphone.57417: Flags [P.], seq 221:259, ack 463, win 305, options [nop,nop,TS val 311183651 ecr 1293669959], length 38
  168  13:58:56.514842 IP usertekiiphone.57417 > 151.101.77.208.https: Flags [.], ack 259, win 4089, options [nop,nop,TS val 1293670201 ecr 311183651], length 0
  169  13:58:58.844209 IP nslabs-macbook-pro.local.mdns > 224.0.0.251.mdns: 0 [2q] SRV (QM)? ncm._remoted._tcp.local. TXT (QM)? ncm._remoted._tcp.local. (47)
  170  13:58:58.844234 IP6 nslabs-macbook-pro.local.mdns > ff02::fb.mdns: 0 [2q] SRV (QM)? ncm._remoted._tcp.local. TXT (QM)? ncm._remoted._tcp.local. (47)
  171  13:59:01.054333 IP 0.0.0.0.bootpc > broadcasthost.bootps: BOOTP/DHCP, Request from 6a:db:ca:c7:c7:6c (oui Unknown), length 300
  172  13:59:02.653311 IP 0.0.0.0.bootpc > broadcasthost.bootps: BOOTP/DHCP, Request from 6a:db:ca:c7:c7:6a (oui Unknown), length 300
  173  13:59:06.087877 IP nslabs-macbook-pro.local.mdns > 224.0.0.251.mdns: 0 [2q] SRV (QU)? HP Color LaserJet M651 [3F3C6F]._ipp._tcp.local. TXT (QU)? HP Color LaserJet M651 [3F3C6F]._ipp._tcp.local. (71)
  174  13:59:06.088034 IP6 nslabs-macbook-pro.local.mdns > ff02::fb.mdns: 0 [2q] SRV (QU)? HP Color LaserJet M651 [3F3C6F]._ipp._tcp.local. TXT (QU)? HP Color LaserJet M651 [3F3C6F]._ipp._tcp.local. (71)
  175  13:59:06.255521 IP6 dlinkrouter.local > ff02::1: ICMP6, router advertisement, length 32
  176  13:59:07.089581 IP nslabs-macbook-pro.local.mdns > 224.0.0.251.mdns: 0 [2q] SRV (QM)? HP Color LaserJet M651 [3F3C6F]._ipp._tcp.local. TXT (QM)? HP Color LaserJet M651 [3F3C6F]._ipp._tcp.local. (71)
  177  13:59:07.089653 IP6 nslabs-macbook-pro.local.mdns > ff02::fb.mdns: 0 [2q] SRV (QM)? HP Color LaserJet M651 [3F3C6F]._ipp._tcp.local. TXT (QM)? HP Color LaserJet M651 [3F3C6F]._ipp._tcp.local. (71)
  178  13:59:07.177168 IP6 nslabs-macbook-pro.local.mdns > ff02::fb.mdns: 0 [2q] SRV (QM)? HP Color LaserJet M651 [3F3C6F]._ipp._tcp.local. TXT (QM)? HP Color LaserJet M651 [3F3C6F]._ipp._tcp.local. (71)
  179  13:59:07.863533 IP nslabs-macbook-pro.local.mdns > 224.0.0.251.mdns: 0 [2q] SRV (QM)? ncm._remoted._tcp.local. TXT (QM)? ncm._remoted._tcp.local. (47)
  180  13:59:07.863614 IP6 nslabs-macbook-pro.local.mdns > ff02::fb.mdns: 0 [2q] SRV (QM)? ncm._remoted._tcp.local. TXT (QM)? ncm._remoted._tcp.local. (47)
  181  13:59:09.599387 IP 0.0.0.0.bootpc > broadcasthost.bootps: BOOTP/DHCP, Request from 6a:db:ca:c7:c7:6c (oui Unknown), length 300
  182  13:59:10.098495 IP nslabs-macbook-pro.local.mdns > 224.0.0.251.mdns: 0 [2q] SRV (QM)? HP Color LaserJet M651 [3F3C6F]._ipp._tcp.local. TXT (QM)? HP Color LaserJet M651 [3F3C6F]._ipp._tcp.local. (71)
  183  13:59:10.098582 IP6 nslabs-macbook-pro.local.mdns > ff02::fb.mdns: 0 [2q] SRV (QM)? HP Color LaserJet M651 [3F3C6F]._ipp._tcp.local. TXT (QM)? HP Color LaserJet M651 [3F3C6F]._ipp._tcp.local. (71)
  184  13:59:10.146723 IP nslabs-mbp.mdns > 224.0.0.251.mdns: 0 [2q] SRV (QM)? HP Color LaserJet M651 [3F3C6F]._ipp._tcp.local. TXT (QM)? HP Color LaserJet M651 [3F3C6F]._ipp._tcp.local. (71)
  185  13:59:10.146732 IP6 nslabs-macbook-pro.local.mdns > ff02::fb.mdns: 0 [2q] SRV (QM)? HP Color LaserJet M651 [3F3C6F]._ipp._tcp.local. TXT (QM)? HP Color LaserJet M651 [3F3C6F]._ipp._tcp.local. (71)
  186  13:59:11.569324 IP 0.0.0.0.bootpc > broadcasthost.bootps: BOOTP/DHCP, Request from 6a:db:ca:c7:c7:6a (oui Unknown), length 300
  187  13:59:15.958275 IP nslabs-macbook-pro.local.mdns > 224.0.0.251.mdns: 0 [2q] SRV (QU)? ncm._remoted._tcp.local. TXT (QU)? ncm._remoted._tcp.local. (47)
  188  13:59:15.958294 IP6 nslabs-macbook-pro.local.mdns > ff02::fb.mdns: 0 [2q] SRV (QU)? ncm._remoted._tcp.local. TXT (QU)? ncm._remoted._tcp.local. (47)
  189  13:59:16.961112 IP nslabs-macbook-pro.local.mdns > 224.0.0.251.mdns: 0 [2q] SRV (QM)? ncm._remoted._tcp.local. TXT (QM)? ncm._remoted._tcp.local. (47)
  190  13:59:16.961205 IP6 nslabs-macbook-pro.local.mdns > ff02::fb.mdns: 0 [2q] SRV (QM)? ncm._remoted._tcp.local. TXT (QM)? ncm._remoted._tcp.local. (47)
  191  13:59:16.968143 IP usertekiiphone.51608 > nslabs-mbp.56756: Flags [.], ack 2057954609, win 4096, length 0
  192  13:59:17.102878 IP nslabs-mbp.56756 > usertekiiphone.51608: Flags [.], ack 1, win 2048, options [nop,nop,TS val 2535874694 ecr 1191796617], length 0
  193  13:59:17.636315 IP 0.0.0.0.bootpc > broadcasthost.bootps: BOOTP/DHCP, Request from 6a:db:ca:c7:c7:6c (oui Unknown), length 300
  194  13:59:19.119940 IP nslabs-macbook-pro.local.mdns > 224.0.0.251.mdns: 0 [4q] SRV (QM)? HP Color LaserJet M651 [3F3C6F]._ipp._tcp.local. TXT (QM)? HP Color LaserJet M651 [3F3C6F]._ipp._tcp.local. SRV (QM)? ncm._remoted._tcp.local. TXT (QM)? ncm._remoted._tcp.local. (96)
  195  13:59:19.120006 IP6 nslabs-macbook-pro.local.mdns > ff02::fb.mdns: 0 [4q] SRV (QM)? HP Color LaserJet M651 [3F3C6F]._ipp._tcp.local. TXT (QM)? HP Color LaserJet M651 [3F3C6F]._ipp._tcp.local. SRV (QM)? ncm._remoted._tcp.local. TXT (QM)? ncm._remoted._tcp.local. (96)
  196  13:59:19.157997 IP nslabs-mbp.mdns > 224.0.0.251.mdns: 0 [2q] SRV (QM)? HP Color LaserJet M651 [3F3C6F]._ipp._tcp.local. TXT (QM)? HP Color LaserJet M651 [3F3C6F]._ipp._tcp.local. (71)
  197  13:59:19.158004 IP6 nslabs-macbook-pro.local.mdns > ff02::fb.mdns: 0 [2q] SRV (QM)? HP Color LaserJet M651 [3F3C6F]._ipp._tcp.local. TXT (QM)? HP Color LaserJet M651 [3F3C6F]._ipp._tcp.local. (71)
  198  13:59:20.308676 IP 0.0.0.0.bootpc > broadcasthost.bootps: BOOTP/DHCP, Request from 6a:db:ca:c7:c7:6a (oui Unknown), length 300
  199  13:59:26.027516 IP 0.0.0.0.bootpc > broadcasthost.bootps: BOOTP/DHCP, Request from 6a:db:ca:c7:c7:6c (oui Unknown), length 300
  200  13:59:28.138439 IP nslabs-macbook-pro.local.mdns > 224.0.0.251.mdns: 0 [2q] SRV (QM)? ncm._remoted._tcp.local. TXT (QM)? ncm._remoted._tcp.local. (47)
  201  13:59:28.138453 IP6 nslabs-macbook-pro.local.mdns > ff02::fb.mdns: 0 [2q] SRV (QM)? ncm._remoted._tcp.local. TXT (QM)? ncm._remoted._tcp.local. (47)
  202  13:59:28.957238 IP 0.0.0.0.bootpc > broadcasthost.bootps: BOOTP/DHCP, Request from 6a:db:ca:c7:c7:6a (oui Unknown), length 300
  203  13:59:34.112889 IP 0.0.0.0.bootpc > broadcasthost.bootps: BOOTP/DHCP, Request from 6a:db:ca:c7:c7:6c (oui Unknown), length 300
  204  13:59:34.640130 IP6 fe80::686e:b1ff:fe33:996a.mdns > ff02::fb.mdns: 0*- [0q] 1/0/0 PTR 41ebc443d3f6._airdrop._tcp.local. (58)
  205  13:59:36.820539 IP6 fe80::686e:b1ff:fe33:996a.mdns > ff02::fb.mdns: 0*- [0q] 1/0/0 PTR 41ebc443d3f6._airdrop._tcp.local. (58)
  206  13:59:37.032156 IP nslabs-macbook-pro.local.mdns > 224.0.0.251.mdns: 0 [2q] SRV (QU)? ncm._remoted._tcp.local. TXT (QU)? ncm._remoted._tcp.local. (47)
  207  13:59:37.032292 IP6 nslabs-macbook-pro.local.mdns > ff02::fb.mdns: 0 [2q] SRV (QU)? ncm._remoted._tcp.local. TXT (QU)? ncm._remoted._tcp.local. (47)
  208  13:59:37.540190 IP 0.0.0.0.bootpc > broadcasthost.bootps: BOOTP/DHCP, Request from 6a:db:ca:c7:c7:6a (oui Unknown), length 300
  209  13:59:38.036822 IP nslabs-macbook-pro.local.mdns > 224.0.0.251.mdns: 0 [2q] SRV (QM)? ncm._remoted._tcp.local. TXT (QM)? ncm._remoted._tcp.local. (47)
  210  13:59:38.036913 IP6 nslabs-macbook-pro.local.mdns > ff02::fb.mdns: 0 [2q] SRV (QM)? ncm._remoted._tcp.local. TXT (QM)? ncm._remoted._tcp.local. (47)
  211  13:59:38.823965 IP6 fe80::686e:b1ff:fe33:996a.mdns > ff02::fb.mdns: 0*- [0q] 1/0/0 PTR 41ebc443d3f6._airdrop._tcp.local. (58)
  212  13:59:41.044714 IP nslabs-macbook-pro.local.mdns > 224.0.0.251.mdns: 0 [2q] SRV (QM)? ncm._remoted._tcp.local. TXT (QM)? ncm._remoted._tcp.local. (47)
  213  13:59:41.044730 IP6 nslabs-macbook-pro.local.mdns > ff02::fb.mdns: 0 [2q] SRV (QM)? ncm._remoted._tcp.local. TXT (QM)? ncm._remoted._tcp.local. (47)
  214  13:59:46.176133 IP nslabs-macbook-pro.local.mdns > 224.0.0.251.mdns: 0 [4q] SRV (QM)? HP Color LaserJet M651 [3F3C6F]._ipp._tcp.local. TXT (QM)? HP Color LaserJet M651 [3F3C6F]._ipp._tcp.local. SRV (QM)? ncm._remoted._tcp.local. TXT (QM)? ncm._remoted._tcp.local. (96)
  215  13:59:46.176221 IP6 nslabs-macbook-pro.local.mdns > ff02::fb.mdns: 0 [4q] SRV (QM)? HP Color LaserJet M651 [3F3C6F]._ipp._tcp.local. TXT (QM)? HP Color LaserJet M651 [3F3C6F]._ipp._tcp.local. SRV (QM)? ncm._remoted._tcp.local. TXT (QM)? ncm._remoted._tcp.local. (96)
  216  13:59:46.333529 IP 80.14.211.130.bc.googleusercontent.com.https > usertekiiphone.52178: Flags [F.], seq 567, ack 1771, win 276, options [nop,nop,TS val 4206693364 ecr 1368905740], length 0
  217  13:59:46.333833 IP usertekiiphone.52178 > 80.14.211.130.bc.googleusercontent.com.https: Flags [.], ack 568, win 4103, options [nop,nop,TS val 1368965413 ecr 4206693364], length 0
  218  13:59:46.357516 IP usertekiiphone.52178 > 80.14.211.130.bc.googleusercontent.com.https: Flags [F.], seq 1771, ack 568, win 4103, options [nop,nop,TS val 1368965435 ecr 4206693364], length 0
  219  13:59:46.360179 IP 80.14.211.130.bc.googleusercontent.com.https > usertekiiphone.52178: Flags [.], ack 1772, win 276, options [nop,nop,TS val 4206693507 ecr 1368965435], length 0
  220  13:59:47.375379 IP usertekiiphone.60170 > dlinkrouter.domain: 51285+ Type65? pgorelease.nianticlabs.com. (44)
  221  13:59:47.375911 IP usertekiiphone.63675 > dlinkrouter.domain: 2533+ A? pgorelease.nianticlabs.com. (44)
  222  13:59:47.414219 IP dlinkrouter.domain > usertekiiphone.60170: 51285 0/1/0 (116)
  223  13:59:47.414225 IP dlinkrouter.domain > usertekiiphone.63675: 2533 1/0/0 A 130.211.14.80 (60)
