    1  13:45:38.017718 IP nslabs-macbook-pro.local.mdns > 224.0.0.251.mdns: 0 [2q] SRV (QM)? ncm._remoted._tcp.local. TXT (QM)? ncm._remoted._tcp.local. (47)
    2  13:45:38.017852 IP6 nslabs-macbook-pro.local.mdns > ff02::fb.mdns: 0 [2q] SRV (QM)? ncm._remoted._tcp.local. TXT (QM)? ncm._remoted._tcp.local. (47)
    3  13:45:45.337716 IP nslabs-macbook-pro.local.mdns > 224.0.0.251.mdns: 0 [2q] SRV (QU)? HP Color LaserJet M651 [3F3C6F]._ipp._tcp.local. TXT (QU)? HP Color LaserJet M651 [3F3C6F]._ipp._tcp.local. (71)
    4  13:45:45.337837 IP6 nslabs-macbook-pro.local.mdns > ff02::fb.mdns: 0 [2q] SRV (QU)? HP Color LaserJet M651 [3F3C6F]._ipp._tcp.local. TXT (QU)? HP Color LaserJet M651 [3F3C6F]._ipp._tcp.local. (71)
    5  13:45:45.924642 IP usertekiiphone.57345 > 80.14.211.130.bc.googleusercontent.com.https: Flags [P.], seq 2694995305:2694995363, ack 3900793957, win 4096, options [nop,nop,TS val 2001408286 ecr 1583256287], length 58
    6  13:45:45.925404 IP usertekiiphone.57345 > 80.14.211.130.bc.googleusercontent.com.https: Flags [.], seq 58:1476, ack 1, win 4096, options [nop,nop,TS val 2001408286 ecr 1583256287], length 1418
    7  13:45:45.925447 IP usertekiiphone.57345 > 80.14.211.130.bc.googleusercontent.com.https: Flags [P.], seq 1476:2106, ack 1, win 4096, options [nop,nop,TS val 2001408286 ecr 1583256287], length 630
    8  13:45:45.925550 IP usertekiiphone.57345 > 80.14.211.130.bc.googleusercontent.com.https: Flags [P.], seq 2106:2333, ack 1, win 4096, options [nop,nop,TS val 2001408287 ecr 1583256287], length 227
    9  13:45:45.963208 IP 80.14.211.130.bc.googleusercontent.com.https > usertekiiphone.57345: Flags [.], ack 0, win 2053, options [nop,nop,TS val 1583268866 ecr 2001395663,nop,nop,sack 1 {1476:2106}], length 0
   10  13:45:45.967852 IP usertekiiphone.57345 > 80.14.211.130.bc.googleusercontent.com.https: Flags [.], seq 0:1418, ack 1, win 4096, options [nop,nop,TS val 2001408328 ecr 1583268866], length 1418
   11  13:45:45.967855 IP usertekiiphone.57345 > 80.14.211.130.bc.googleusercontent.com.https: Flags [.], seq 1418:1476, ack 1, win 4096, options [nop,nop,TS val 2001408328 ecr 1583268866], length 58
   12  13:45:45.967856 IP usertekiiphone.57345 > 80.14.211.130.bc.googleusercontent.com.https: Flags [P.], seq 2106:2333, ack 1, win 4096, options [nop,nop,TS val 2001408328 ecr 1583268866], length 227
   13  13:45:45.971792 IP 80.14.211.130.bc.googleusercontent.com.https > usertekiiphone.57345: Flags [.], ack 1418, win 2048, options [nop,nop,TS val 1583268874 ecr 2001408328,nop,nop,sack 1 {1476:2106}], length 0
   14  13:45:45.971794 IP 80.14.211.130.bc.googleusercontent.com.https > usertekiiphone.57345: Flags [.], ack 2106, win 2048, options [nop,nop,TS val 1583268874 ecr 2001408328], length 0
   15  13:45:45.971796 IP 80.14.211.130.bc.googleusercontent.com.https > usertekiiphone.57345: Flags [.], ack 2333, win 2048, options [nop,nop,TS val 1583268874 ecr 2001408328], length 0
   16  13:45:45.972080 IP usertekiiphone.57345 > 80.14.211.130.bc.googleusercontent.com.https: Flags [P.], seq 2106:2333, ack 1, win 4096, options [nop,nop,TS val 2001408332 ecr 1583268874], length 227
   17  13:45:45.975337 IP 80.14.211.130.bc.googleusercontent.com.https > usertekiiphone.57345: Flags [.], ack 2333, win 2055, options [nop,nop,TS val 1583268878 ecr 2001408332,nop,nop,sack 1 {2106:2333}], length 0
   18  13:45:46.216423 IP 80.14.211.130.bc.googleusercontent.com.https > usertekiiphone.57345: Flags [P.], seq 1:63, ack 2333, win 2055, options [nop,nop,TS val 1583269118 ecr 2001408332], length 62
   19  13:45:46.216426 IP 80.14.211.130.bc.googleusercontent.com.https > usertekiiphone.57345: Flags [P.], seq 63:1481, ack 2333, win 2055, options [nop,nop,TS val 1583269118 ecr 2001408332], length 1418
   20  13:45:46.216428 IP 80.14.211.130.bc.googleusercontent.com.https > usertekiiphone.57345: Flags [.], seq 1481:2899, ack 2333, win 2055, options [nop,nop,TS val 1583269119 ecr 2001408332], length 1418
   21  13:45:46.216430 IP 80.14.211.130.bc.googleusercontent.com.https > usertekiiphone.57345: Flags [P.], seq 2899:4221, ack 2333, win 2055, options [nop,nop,TS val 1583269119 ecr 2001408332], length 1322
   22  13:45:46.217735 IP 80.14.211.130.bc.googleusercontent.com.https > usertekiiphone.57345: Flags [P.], seq 4221:5639, ack 2333, win 2055, options [nop,nop,TS val 1583269120 ecr 2001408332], length 1418
   23  13:45:46.217739 IP 80.14.211.130.bc.googleusercontent.com.https > usertekiiphone.57345: Flags [.], seq 5639:7057, ack 2333, win 2055, options [nop,nop,TS val 1583269120 ecr 2001408332], length 1418
   24  13:45:46.217741 IP 80.14.211.130.bc.googleusercontent.com.https > usertekiiphone.57345: Flags [P.], seq 7057:8475, ack 2333, win 2055, options [nop,nop,TS val 1583269120 ecr 2001408332], length 1418
   25  13:45:46.217743 IP 80.14.211.130.bc.googleusercontent.com.https > usertekiiphone.57345: Flags [P.], seq 8475:8565, ack 2333, win 2055, options [nop,nop,TS val 1583269120 ecr 2001408332], length 90
   26  13:45:46.218649 IP 80.14.211.130.bc.googleusercontent.com.https > usertekiiphone.57345: Flags [P.], seq 8565:9983, ack 2333, win 2055, options [nop,nop,TS val 1583269121 ecr 2001408332], length 1418
   27  13:45:46.218655 IP 80.14.211.130.bc.googleusercontent.com.https > usertekiiphone.57345: Flags [.], seq 9983:11401, ack 2333, win 2055, options [nop,nop,TS val 1583269121 ecr 2001408332], length 1418
   28  13:45:46.218657 IP 80.14.211.130.bc.googleusercontent.com.https > usertekiiphone.57345: Flags [P.], seq 11401:12737, ack 2333, win 2055, options [nop,nop,TS val 1583269121 ecr 2001408332], length 1336
   29  13:45:46.220217 IP 80.14.211.130.bc.googleusercontent.com.https > usertekiiphone.57345: Flags [P.], seq 12737:14155, ack 2333, win 2055, options [nop,nop,TS val 1583269122 ecr 2001408332], length 1418
   30  13:45:46.220220 IP 80.14.211.130.bc.googleusercontent.com.https > usertekiiphone.57345: Flags [P.], seq 14155:14792, ack 2333, win 2055, options [nop,nop,TS val 1583269122 ecr 2001408332], length 637
   31  13:45:46.220222 IP 80.14.211.130.bc.googleusercontent.com.https > usertekiiphone.57345: Flags [P.], seq 14792:16210, ack 2333, win 2055, options [nop,nop,TS val 1583269122 ecr 2001408332], length 1418
   32  13:45:46.220224 IP 80.14.211.130.bc.googleusercontent.com.https > usertekiiphone.57345: Flags [P.], seq 16210:17525, ack 2333, win 2055, options [nop,nop,TS val 1583269122 ecr 2001408332], length 1315
   33  13:45:46.221091 IP 80.14.211.130.bc.googleusercontent.com.https > usertekiiphone.57345: Flags [P.], seq 17525:18943, ack 2333, win 2055, options [nop,nop,TS val 1583269123 ecr 2001408332], length 1418
   34  13:45:46.221094 IP 80.14.211.130.bc.googleusercontent.com.https > usertekiiphone.57345: Flags [.], seq 18943:20361, ack 2333, win 2055, options [nop,nop,TS val 1583269123 ecr 2001408332], length 1418
   35  13:45:46.221096 IP 80.14.211.130.bc.googleusercontent.com.https > usertekiiphone.57345: Flags [P.], seq 20361:21779, ack 2333, win 2055, options [nop,nop,TS val 1583269123 ecr 2001408332], length 1418
   36  13:45:46.221098 IP 80.14.211.130.bc.googleusercontent.com.https > usertekiiphone.57345: Flags [P.], seq 21779:21892, ack 2333, win 2055, options [nop,nop,TS val 1583269123 ecr 2001408332], length 113
   37  13:45:46.222841 IP 80.14.211.130.bc.googleusercontent.com.https > usertekiiphone.57345: Flags [P.], seq 21892:23310, ack 2333, win 2055, options [nop,nop,TS val 1583269125 ecr 2001408332], length 1418
   38  13:45:46.222844 IP 80.14.211.130.bc.googleusercontent.com.https > usertekiiphone.57345: Flags [.], seq 23310:24728, ack 2333, win 2055, options [nop,nop,TS val 1583269125 ecr 2001408332], length 1418
   39  13:45:46.222846 IP 80.14.211.130.bc.googleusercontent.com.https > usertekiiphone.57345: Flags [P.], seq 24728:26146, ack 2333, win 2055, options [nop,nop,TS val 1583269125 ecr 2001408332], length 1418
   40  13:45:46.222848 IP 80.14.211.130.bc.googleusercontent.com.https > usertekiiphone.57345: Flags [P.], seq 26146:26246, ack 2333, win 2055, options [nop,nop,TS val 1583269125 ecr 2001408332], length 100
   41  13:45:46.224093 IP 80.14.211.130.bc.googleusercontent.com.https > usertekiiphone.57345: Flags [P.], seq 26246:27664, ack 2333, win 2055, options [nop,nop,TS val 1583269126 ecr 2001408332], length 1418
   42  13:45:46.224098 IP 80.14.211.130.bc.googleusercontent.com.https > usertekiiphone.57345: Flags [.], seq 27664:29082, ack 2333, win 2055, options [nop,nop,TS val 1583269126 ecr 2001408332], length 1418
   43  13:45:46.224103 IP 80.14.211.130.bc.googleusercontent.com.https > usertekiiphone.57345: Flags [P.], seq 29082:30500, ack 2333, win 2055, options [nop,nop,TS val 1583269126 ecr 2001408332], length 1418
   44  13:45:46.224105 IP 80.14.211.130.bc.googleusercontent.com.https > usertekiiphone.57345: Flags [P.], seq 30500:30654, ack 2333, win 2055, options [nop,nop,TS val 1583269126 ecr 2001408332], length 154
   45  13:45:46.224162 IP usertekiiphone.57345 > 80.14.211.130.bc.googleusercontent.com.https: Flags [.], ack 4221, win 3964, options [nop,nop,TS val 2001408581 ecr 1583269119], length 0
   46  13:45:46.224164 IP usertekiiphone.57345 > 80.14.211.130.bc.googleusercontent.com.https: Flags [.], ack 8565, win 3828, options [nop,nop,TS val 2001408581 ecr 1583269120], length 0
   47  13:45:46.224165 IP usertekiiphone.57345 > 80.14.211.130.bc.googleusercontent.com.https: Flags [.], ack 12737, win 3698, options [nop,nop,TS val 2001408581 ecr 1583269121], length 0
   48  13:45:46.224166 IP usertekiiphone.57345 > 80.14.211.130.bc.googleusercontent.com.https: Flags [.], ack 17525, win 3548, options [nop,nop,TS val 2001408581 ecr 1583269122], length 0
   49  13:45:46.224167 IP usertekiiphone.57345 > 80.14.211.130.bc.googleusercontent.com.https: Flags [.], ack 21892, win 3411, options [nop,nop,TS val 2001408581 ecr 1583269123], length 0
   50  13:45:46.224168 IP usertekiiphone.57345 > 80.14.211.130.bc.googleusercontent.com.https: Flags [.], ack 26246, win 3275, options [nop,nop,TS val 2001408581 ecr 1583269125], length 0
   51  13:45:46.224169 IP usertekiiphone.57345 > 80.14.211.130.bc.googleusercontent.com.https: Flags [.], ack 26246, win 4096, options [nop,nop,TS val 2001408581 ecr 1583269125], length 0
   52  13:45:46.225558 IP 80.14.211.130.bc.googleusercontent.com.https > usertekiiphone.57345: Flags [P.], seq 30654:32072, ack 2333, win 2055, options [nop,nop,TS val 1583269128 ecr 2001408332], length 1418
   53  13:45:46.225561 IP 80.14.211.130.bc.googleusercontent.com.https > usertekiiphone.57345: Flags [.], seq 32072:33490, ack 2333, win 2055, options [nop,nop,TS val 1583269128 ecr 2001408332], length 1418
   54  13:45:46.225563 IP 80.14.211.130.bc.googleusercontent.com.https > usertekiiphone.57345: Flags [P.], seq 33490:34908, ack 2333, win 2055, options [nop,nop,TS val 1583269128 ecr 2001408332], length 1418
   55  13:45:46.225565 IP 80.14.211.130.bc.googleusercontent.com.https > usertekiiphone.57345: Flags [P.], seq 34908:35245, ack 2333, win 2055, options [nop,nop,TS val 1583269128 ecr 2001408332], length 337
   56  13:45:46.226016 IP 80.14.211.130.bc.googleusercontent.com.https > usertekiiphone.57345: Flags [P.], seq 35245:36663, ack 2333, win 2055, options [nop,nop,TS val 1583269128 ecr 2001408332], length 1418
   57  13:45:46.226019 IP 80.14.211.130.bc.googleusercontent.com.https > usertekiiphone.57345: Flags [.], seq 36663:38081, ack 2333, win 2055, options [nop,nop,TS val 1583269128 ecr 2001408332], length 1418
   58  13:45:46.226021 IP 80.14.211.130.bc.googleusercontent.com.https > usertekiiphone.57345: Flags [P.], seq 38081:39499, ack 2333, win 2055, options [nop,nop,TS val 1583269128 ecr 2001408332], length 1418
   59  13:45:46.226712 IP usertekiiphone.57345 > 80.14.211.130.bc.googleusercontent.com.https: Flags [.], ack 30654, win 3958, options [nop,nop,TS val 2001408584 ecr 1583269126], length 0
   60  13:45:46.226714 IP usertekiiphone.57345 > 80.14.211.130.bc.googleusercontent.com.https: Flags [.], ack 30654, win 4096, options [nop,nop,TS val 2001408584 ecr 1583269126], length 0
   61  13:45:46.227842 IP 80.14.211.130.bc.googleusercontent.com.https > usertekiiphone.57345: Flags [P.], seq 39499:39674, ack 2333, win 2055, options [nop,nop,TS val 1583269128 ecr 2001408332], length 175
   62  13:45:46.227844 IP 80.14.211.130.bc.googleusercontent.com.https > usertekiiphone.57345: Flags [P.], seq 39674:40643, ack 2333, win 2055, options [nop,nop,TS val 1583269129 ecr 2001408332], length 969
   63  13:45:46.227846 IP 80.14.211.130.bc.googleusercontent.com.https > usertekiiphone.57345: Flags [P.], seq 40643:40768, ack 2333, win 2055, options [nop,nop,TS val 1583269129 ecr 2001408332], length 125
   64  13:45:46.227847 IP 80.14.211.130.bc.googleusercontent.com.https > usertekiiphone.57345: Flags [P.], seq 40768:40807, ack 2333, win 2055, options [nop,nop,TS val 1583269129 ecr 2001408332], length 39
   65  13:45:46.227906 IP usertekiiphone.57345 > 80.14.211.130.bc.googleusercontent.com.https: Flags [.], ack 35245, win 3952, options [nop,nop,TS val 2001408585 ecr 1583269128], length 0
   66  13:45:46.227907 IP usertekiiphone.57345 > 80.14.211.130.bc.googleusercontent.com.https: Flags [.], ack 39499, win 3819, options [nop,nop,TS val 2001408585 ecr 1583269128], length 0
   67  13:45:46.227908 IP usertekiiphone.57345 > 80.14.211.130.bc.googleusercontent.com.https: Flags [.], ack 39499, win 4096, options [nop,nop,TS val 2001408585 ecr 1583269128], length 0
   68  13:45:46.233292 IP usertekiiphone.57345 > 80.14.211.130.bc.googleusercontent.com.https: Flags [.], ack 40807, win 4055, options [nop,nop,TS val 2001408589 ecr 1583269129], length 0
   69  13:45:46.233914 IP usertekiiphone.57345 > 80.14.211.130.bc.googleusercontent.com.https: Flags [P.], seq 2333:2372, ack 40807, win 4096, options [nop,nop,TS val 2001408590 ecr 1583269129], length 39
   70  13:45:46.237431 IP 80.14.211.130.bc.googleusercontent.com.https > usertekiiphone.57345: Flags [.], ack 2372, win 2055, options [nop,nop,TS val 1583269140 ecr 2001408590], length 0
   71  13:45:46.344088 IP nslabs-macbook-pro.local.mdns > 224.0.0.251.mdns: 0 [2q] SRV (QM)? HP Color LaserJet M651 [3F3C6F]._ipp._tcp.local. TXT (QM)? HP Color LaserJet M651 [3F3C6F]._ipp._tcp.local. (71)
   72  13:45:46.344170 IP6 nslabs-macbook-pro.local.mdns > ff02::fb.mdns: 0 [2q] SRV (QM)? HP Color LaserJet M651 [3F3C6F]._ipp._tcp.local. TXT (QM)? HP Color LaserJet M651 [3F3C6F]._ipp._tcp.local. (71)
   73  13:45:46.400501 IP nslabs-mbp.mdns > 224.0.0.251.mdns: 0 [2q] SRV (QM)? HP Color LaserJet M651 [3F3C6F]._ipp._tcp.local. TXT (QM)? HP Color LaserJet M651 [3F3C6F]._ipp._tcp.local. (71)
   74  13:45:46.400513 IP6 nslabs-macbook-pro.local.mdns > ff02::fb.mdns: 0 [2q] SRV (QM)? HP Color LaserJet M651 [3F3C6F]._ipp._tcp.local. TXT (QM)? HP Color LaserJet M651 [3F3C6F]._ipp._tcp.local. (71)
   75  13:45:47.037641 IP nslabs-macbook-pro.local.mdns > 224.0.0.251.mdns: 0 [2q] SRV (QM)? ncm._remoted._tcp.local. TXT (QM)? ncm._remoted._tcp.local. (47)
   76  13:45:47.037738 IP6 nslabs-macbook-pro.local.mdns > ff02::fb.mdns: 0 [2q] SRV (QM)? ncm._remoted._tcp.local. TXT (QM)? ncm._remoted._tcp.local. (47)
   77  13:45:49.191115 IP 0.0.0.0.bootpc > broadcasthost.bootps: BOOTP/DHCP, Request from 6a:db:ca:c7:c7:6a (oui Unknown), length 300
   78  13:45:49.350324 IP nslabs-macbook-pro.local.mdns > 224.0.0.251.mdns: 0 [2q] SRV (QM)? HP Color LaserJet M651 [3F3C6F]._ipp._tcp.local. TXT (QM)? HP Color LaserJet M651 [3F3C6F]._ipp._tcp.local. (71)
   79  13:45:49.350435 IP6 nslabs-macbook-pro.local.mdns > ff02::fb.mdns: 0 [2q] SRV (QM)? HP Color LaserJet M651 [3F3C6F]._ipp._tcp.local. TXT (QM)? HP Color LaserJet M651 [3F3C6F]._ipp._tcp.local. (71)
   80  13:45:49.370192 IP nslabs-mbp.mdns > 224.0.0.251.mdns: 0 [2q] SRV (QM)? HP Color LaserJet M651 [3F3C6F]._ipp._tcp.local. TXT (QM)? HP Color LaserJet M651 [3F3C6F]._ipp._tcp.local. (71)
   81  13:45:49.370202 IP6 nslabs-macbook-pro.local.mdns > ff02::fb.mdns: 0 [2q] SRV (QM)? HP Color LaserJet M651 [3F3C6F]._ipp._tcp.local. TXT (QM)? HP Color LaserJet M651 [3F3C6F]._ipp._tcp.local. (71)
   82  13:45:49.932703 IP 0.0.0.0.bootpc > broadcasthost.bootps: BOOTP/DHCP, Request from 6a:db:ca:c7:c7:6c (oui Unknown), length 300
   83  13:45:50.609052 IP 0.0.0.0.bootpc > broadcasthost.bootps: BOOTP/DHCP, Request from 6a:db:ca:c7:c7:6a (oui Unknown), length 300
   84  13:45:51.654346 IP 0.0.0.0.bootpc > broadcasthost.bootps: BOOTP/DHCP, Request from 6a:db:ca:c7:c7:6c (oui Unknown), length 300
   85  13:45:52.825557 IP 0.0.0.0.bootpc > broadcasthost.bootps: BOOTP/DHCP, Request from 6a:db:ca:c7:c7:6a (oui Unknown), length 300
   86  13:45:53.942880 IP 0.0.0.0.bootpc > broadcasthost.bootps: BOOTP/DHCP, Request from 6a:db:ca:c7:c7:6c (oui Unknown), length 300
   87  13:45:54.478995 IP 80.14.211.130.bc.googleusercontent.com.https > usertekiiphone.52163: Flags [F.], seq 3971890847, ack 2381327825, win 276, options [nop,nop,TS val 387865944 ecr 4275234201], length 0
   88  13:45:54.479227 IP usertekiiphone.52163 > 80.14.211.130.bc.googleusercontent.com.https: Flags [.], ack 1, win 4096, options [nop,nop,TS val 4275294236 ecr 387865944], length 0
   89  13:45:54.485971 IP usertekiiphone.52163 > 80.14.211.130.bc.googleusercontent.com.https: Flags [F.], seq 1, ack 1, win 4096, options [nop,nop,TS val 4275294241 ecr 387865944], length 0
   90  13:45:54.488448 IP 80.14.211.130.bc.googleusercontent.com.https > usertekiiphone.52163: Flags [.], ack 2, win 276, options [nop,nop,TS val 387866071 ecr 4275294241], length 0
   91  13:45:55.045290 IP nslabs-macbook-pro.local.mdns > 224.0.0.251.mdns: 0 [2q] SRV (QU)? ncm._remoted._tcp.local. TXT (QU)? ncm._remoted._tcp.local. (47)
   92  13:45:55.045391 IP6 nslabs-macbook-pro.local.mdns > ff02::fb.mdns: 0 [2q] SRV (QU)? ncm._remoted._tcp.local. TXT (QU)? ncm._remoted._tcp.local. (47)
   93  13:45:55.512107 IP usertekiiphone.52098 > dlinkrouter.domain: 11365+ Type65? pgorelease.nianticlabs.com. (44)
   94  13:45:55.512979 IP usertekiiphone.60743 > dlinkrouter.domain: 11781+ A? pgorelease.nianticlabs.com. (44)
   95  13:45:55.539728 IP dlinkrouter.domain > usertekiiphone.52098: 11365 0/1/0 (116)
   96  13:45:55.539995 IP dlinkrouter.domain > usertekiiphone.60743: 11781 1/0/0 A 130.211.14.80 (60)
   97  13:45:55.554953 IP usertekiiphone.52164 > 80.14.211.130.bc.googleusercontent.com.https: Flags [S], seq 3778472189, win 65535, options [mss 1460,nop,wscale 5,nop,nop,TS val 428971227 ecr 0,sackOK,eol], length 0
   98  13:45:55.557721 IP 80.14.211.130.bc.googleusercontent.com.https > usertekiiphone.52164: Flags [S.], seq 1549164762, ack 3778472190, win 65535, options [mss 1430,sackOK,TS val 4171645786 ecr 428971227,nop,wscale 8], length 0
   99  13:45:55.557907 IP usertekiiphone.52164 > 80.14.211.130.bc.googleusercontent.com.https: Flags [.], ack 1, win 4121, options [nop,nop,TS val 428971230 ecr 4171645786], length 0
  100  13:45:55.563024 IP usertekiiphone.52164 > 80.14.211.130.bc.googleusercontent.com.https: Flags [P.], seq 1:219, ack 1, win 4121, options [nop,nop,TS val 428971235 ecr 4171645786], length 218
  101  13:45:55.565667 IP 80.14.211.130.bc.googleusercontent.com.https > usertekiiphone.52164: Flags [.], ack 219, win 261, options [nop,nop,TS val 4171645794 ecr 428971235], length 0
  102  13:45:55.567323 IP 80.14.211.130.bc.googleusercontent.com.https > usertekiiphone.52164: Flags [.], seq 1:1419, ack 219, win 261, options [nop,nop,TS val 4171645795 ecr 428971235], length 1418
  103  13:45:55.567326 IP 80.14.211.130.bc.googleusercontent.com.https > usertekiiphone.52164: Flags [.], seq 1419:2837, ack 219, win 261, options [nop,nop,TS val 4171645795 ecr 428971235], length 1418
  104  13:45:55.567328 IP 80.14.211.130.bc.googleusercontent.com.https > usertekiiphone.52164: Flags [P.], seq 2837:3501, ack 219, win 261, options [nop,nop,TS val 4171645795 ecr 428971235], length 664
  105  13:45:55.567472 IP usertekiiphone.52164 > 80.14.211.130.bc.googleusercontent.com.https: Flags [.], ack 3501, win 4011, options [nop,nop,TS val 428971238 ecr 4171645795], length 0
  106  13:45:55.728652 IP usertekiiphone.52164 > 80.14.211.130.bc.googleusercontent.com.https: Flags [P.], seq 219:294, ack 3501, win 4096, options [nop,nop,TS val 428971398 ecr 4171645795], length 75
  107  13:45:55.737048 IP 80.14.211.130.bc.googleusercontent.com.https > usertekiiphone.52164: Flags [.], ack 294, win 261, options [nop,nop,TS val 4171645965 ecr 428971398], length 0
  108  13:45:55.737228 IP usertekiiphone.52164 > 80.14.211.130.bc.googleusercontent.com.https: Flags [P.], seq 294:345, ack 3501, win 4096, options [nop,nop,TS val 428971406 ecr 4171645965], length 51
  109  13:45:55.739907 IP 80.14.211.130.bc.googleusercontent.com.https > usertekiiphone.52164: Flags [.], ack 345, win 261, options [nop,nop,TS val 4171645968 ecr 428971406], length 0
  110  13:45:55.740222 IP 80.14.211.130.bc.googleusercontent.com.https > usertekiiphone.52164: Flags [P.], seq 3501:3552, ack 345, win 261, options [nop,nop,TS val 4171645968 ecr 428971406], length 51
  111  13:45:55.740322 IP usertekiiphone.52164 > 80.14.211.130.bc.googleusercontent.com.https: Flags [.], ack 3552, win 4094, options [nop,nop,TS val 428971408 ecr 4171645968], length 0
  112  13:45:55.759049 IP usertekiiphone.52164 > 80.14.211.130.bc.googleusercontent.com.https: Flags [P.], seq 345:637, ack 3552, win 4096, options [nop,nop,TS val 428971426 ecr 4171645968], length 292
  113  13:45:55.766881 IP 80.14.211.130.bc.googleusercontent.com.https > usertekiiphone.52164: Flags [.], ack 637, win 265, options [nop,nop,TS val 4171645995 ecr 428971426], length 0
  114  13:45:56.051026 IP nslabs-macbook-pro.local.mdns > 224.0.0.251.mdns: 0 [2q] SRV (QM)? ncm._remoted._tcp.local. TXT (QM)? ncm._remoted._tcp.local. (47)
  115  13:45:56.051243 IP 80.14.211.130.bc.googleusercontent.com.https > usertekiiphone.52164: Flags [P.], seq 3552:3802, ack 637, win 265, options [nop,nop,TS val 4171646148 ecr 428971426], length 250
  116  13:45:56.051362 IP6 nslabs-macbook-pro.local.mdns > ff02::fb.mdns: 0 [2q] SRV (QM)? ncm._remoted._tcp.local. TXT (QM)? ncm._remoted._tcp.local. (47)
  117  13:45:56.051536 IP usertekiiphone.52164 > 80.14.211.130.bc.googleusercontent.com.https: Flags [.], ack 3802, win 4088, options [nop,nop,TS val 428971717 ecr 4171646148], length 0
  118  13:45:56.450463 IP usertekiiphone.57367 > 80.14.211.130.bc.googleusercontent.com.https: Flags [P.], seq 1755433373:1755433428, ack 4196085953, win 4096, options [nop,nop,TS val 3929381911 ecr 2907557723], length 55
  119  13:45:56.454136 IP 80.14.211.130.bc.googleusercontent.com.https > usertekiiphone.57367: Flags [.], ack 55, win 265, options [nop,nop,TS val 2907588359 ecr 3929381911], length 0
  120  13:45:56.519997 IP usertekiiphone.57345 > 80.14.211.130.bc.googleusercontent.com.https: Flags [P.], seq 2372:2430, ack 40807, win 4096, options [nop,nop,TS val 2001418873 ecr 1583269140], length 58
  121  13:45:56.520510 IP usertekiiphone.57345 > 80.14.211.130.bc.googleusercontent.com.https: Flags [.], seq 2430:3848, ack 40807, win 4096, options [nop,nop,TS val 2001418873 ecr 1583269140], length 1418
  122  13:45:56.520650 IP usertekiiphone.57345 > 80.14.211.130.bc.googleusercontent.com.https: Flags [P.], seq 3848:4353, ack 40807, win 4096, options [nop,nop,TS val 2001418873 ecr 1583269140], length 505
  123  13:45:56.522536 IP 80.14.211.130.bc.googleusercontent.com.https > usertekiiphone.57345: Flags [.], ack 2430, win 2055, options [nop,nop,TS val 1583279425 ecr 2001418873], length 0
  124  13:45:56.523507 IP 80.14.211.130.bc.googleusercontent.com.https > usertekiiphone.57345: Flags [.], ack 3848, win 2051, options [nop,nop,TS val 1583279426 ecr 2001418873], length 0
  125  13:45:56.523509 IP 80.14.211.130.bc.googleusercontent.com.https > usertekiiphone.57345: Flags [.], ack 4353, win 2050, options [nop,nop,TS val 1583279426 ecr 2001418873], length 0
  126  13:45:56.639256 IP 80.14.211.130.bc.googleusercontent.com.https > usertekiiphone.57367: Flags [P.], seq 1:62, ack 55, win 265, options [nop,nop,TS val 2907588521 ecr 3929381911], length 61
  127  13:45:56.639259 IP 80.14.211.130.bc.googleusercontent.com.https > usertekiiphone.57367: Flags [P.], seq 62:133, ack 55, win 265, options [nop,nop,TS val 2907588521 ecr 3929381911], length 71
  128  13:45:56.639261 IP 80.14.211.130.bc.googleusercontent.com.https > usertekiiphone.57367: Flags [P.], seq 133:172, ack 55, win 265, options [nop,nop,TS val 2907588522 ecr 3929381911], length 39
  129  13:45:56.648949 IP usertekiiphone.57367 > 80.14.211.130.bc.googleusercontent.com.https: Flags [.], ack 172, win 4090, options [nop,nop,TS val 3929382101 ecr 2907588522], length 0
  130  13:45:56.653770 IP usertekiiphone.57367 > 80.14.211.130.bc.googleusercontent.com.https: Flags [P.], seq 55:94, ack 172, win 4096, options [nop,nop,TS val 3929382110 ecr 2907588522], length 39
  131  13:45:56.656311 IP 80.14.211.130.bc.googleusercontent.com.https > usertekiiphone.57367: Flags [.], ack 94, win 265, options [nop,nop,TS val 2907588561 ecr 3929382110], length 0
  132  13:45:56.662005 IP usertekiiphone.52164 > 80.14.211.130.bc.googleusercontent.com.https: Flags [P.], seq 637:1846, ack 3802, win 4096, options [nop,nop,TS val 428972322 ecr 4171646148], length 1209
  133  13:45:56.664522 IP 80.14.211.130.bc.googleusercontent.com.https > usertekiiphone.52164: Flags [.], ack 1846, win 276, options [nop,nop,TS val 4171646893 ecr 428972322], length 0
  134  13:45:56.687467 IP 80.14.211.130.bc.googleusercontent.com.https > usertekiiphone.57345: Flags [P.], seq 40807:40869, ack 4353, win 2055, options [nop,nop,TS val 1583279590 ecr 2001418873], length 62
  135  13:45:56.687470 IP 80.14.211.130.bc.googleusercontent.com.https > usertekiiphone.57345: Flags [P.], seq 40869:42287, ack 4353, win 2055, options [nop,nop,TS val 1583279590 ecr 2001418873], length 1418
  136  13:45:56.687473 IP 80.14.211.130.bc.googleusercontent.com.https > usertekiiphone.57345: Flags [P.], seq 42287:42479, ack 4353, win 2055, options [nop,nop,TS val 1583279590 ecr 2001418873], length 192
  137  13:45:56.687474 IP 80.14.211.130.bc.googleusercontent.com.https > usertekiiphone.57345: Flags [P.], seq 42479:42518, ack 4353, win 2055, options [nop,nop,TS val 1583279590 ecr 2001418873], length 39
  138  13:45:56.693470 IP usertekiiphone.57345 > 80.14.211.130.bc.googleusercontent.com.https: Flags [.], ack 42518, win 4042, options [nop,nop,TS val 2001419041 ecr 1583279590], length 0
  139  13:45:56.694137 IP usertekiiphone.57345 > 80.14.211.130.bc.googleusercontent.com.https: Flags [P.], seq 4353:4392, ack 42518, win 4096, options [nop,nop,TS val 2001419041 ecr 1583279590], length 39
  140  13:45:56.697069 IP 80.14.211.130.bc.googleusercontent.com.https > usertekiiphone.57345: Flags [.], ack 4392, win 2055, options [nop,nop,TS val 1583279600 ecr 2001419041], length 0
  141  13:45:56.821966 IP 80.14.211.130.bc.googleusercontent.com.https > usertekiiphone.52164: Flags [P.], seq 3802:3971, ack 1846, win 276, options [nop,nop,TS val 4171647050 ecr 428972322], length 169
  142  13:45:56.822216 IP usertekiiphone.52164 > 80.14.211.130.bc.googleusercontent.com.https: Flags [.], ack 3971, win 4090, options [nop,nop,TS val 428972480 ecr 4171647050], length 0
  143  13:45:56.892097 IP usertekiiphone.57345 > 80.14.211.130.bc.googleusercontent.com.https: Flags [P.], seq 4392:4450, ack 42518, win 4096, options [nop,nop,TS val 2001419238 ecr 1583279600], length 58
  144  13:45:56.892653 IP usertekiiphone.57345 > 80.14.211.130.bc.googleusercontent.com.https: Flags [P.], seq 4450:5837, ack 42518, win 4096, options [nop,nop,TS val 2001419239 ecr 1583279600], length 1387
  145  13:45:56.974600 IP usertekiiphone.57345 > 80.14.211.130.bc.googleusercontent.com.https: Flags [P.], seq 4419:5837, ack 42518, win 4096, options [nop,nop,TS val 2001419320 ecr 1583279600], length 1418
  146  13:45:57.101863 IP 80.14.211.130.bc.googleusercontent.com.https > usertekiiphone.57345: Flags [.], ack 4450, win 2055, options [nop,nop,TS val 1583280004 ecr 2001419238], length 0
  147  13:45:57.101865 IP 80.14.211.130.bc.googleusercontent.com.https > usertekiiphone.57345: Flags [.], ack 5837, win 2050, options [nop,nop,TS val 1583280004 ecr 2001419239], length 0
  148  13:45:57.101924 IP 80.14.211.130.bc.googleusercontent.com.https > usertekiiphone.57345: Flags [.], ack 5837, win 2055, options [nop,nop,TS val 1583280005 ecr 2001419320,nop,nop,sack 1 {4419:5837}], length 0
  149  13:45:57.263269 IP 0.0.0.0.bootpc > broadcasthost.bootps: BOOTP/DHCP, Request from 6a:db:ca:c7:c7:6a (oui Unknown), length 300
  150  13:45:57.317096 IP 80.14.211.130.bc.googleusercontent.com.https > usertekiiphone.57345: Flags [P.], seq 42518:42580, ack 5837, win 2055, options [nop,nop,TS val 1583280218 ecr 2001419320], length 62
  151  13:45:57.317099 IP 80.14.211.130.bc.googleusercontent.com.https > usertekiiphone.57345: Flags [P.], seq 42580:43043, ack 5837, win 2055, options [nop,nop,TS val 1583280218 ecr 2001419320], length 463
  152  13:45:57.317102 IP 80.14.211.130.bc.googleusercontent.com.https > usertekiiphone.57345: Flags [P.], seq 43043:43260, ack 5837, win 2055, options [nop,nop,TS val 1583280218 ecr 2001419320], length 217
  153  13:45:57.317103 IP 80.14.211.130.bc.googleusercontent.com.https > usertekiiphone.57345: Flags [P.], seq 43260:43299, ack 5837, win 2055, options [nop,nop,TS val 1583280218 ecr 2001419320], length 39
  154  13:45:57.326199 IP usertekiiphone.57345 > 80.14.211.130.bc.googleusercontent.com.https: Flags [.], ack 43299, win 4071, options [nop,nop,TS val 2001419666 ecr 1583280218], length 0
  155  13:45:57.327426 IP usertekiiphone.57345 > 80.14.211.130.bc.googleusercontent.com.https: Flags [P.], seq 5837:5876, ack 43299, win 4096, options [nop,nop,TS val 2001419670 ecr 1583280218], length 39
  156  13:45:57.329818 IP 80.14.211.130.bc.googleusercontent.com.https > usertekiiphone.57345: Flags [.], ack 5876, win 2055, options [nop,nop,TS val 1583280233 ecr 2001419670], length 0
  157  13:45:58.252613 IP usertekiiphone.mdns > 224.0.0.251.mdns: 0*- [0q] 1/0/1 (Cache flush) TXT "rpBA=B6:B3:D0:C3:CA:3A" "rpVr=260.3" "rpAD=bfa0e8164934" (131)
  158  13:45:58.252933 IP6 user-teki-iphone.local.mdns > ff02::fb.mdns: 0*- [0q] 1/0/1 (Cache flush) TXT "rpBA=B6:B3:D0:C3:CA:3A" "rpVr=260.3" "rpAD=bfa0e8164934" (131)
  159  13:45:58.253307 IP user-teki-iphone.local.mdns > 224.0.0.251.mdns: 0*- [0q] 1/0/1 (Cache flush) TXT "rpBA=B6:B3:D0:C3:CA:3A" "rpVr=260.3" "rpAD=bfa0e8164934" (131)
  160  13:45:58.253497 IP6 user-teki-iphone.local.mdns > ff02::fb.mdns: 0*- [0q] 1/0/1 (Cache flush) TXT "rpBA=B6:B3:D0:C3:CA:3A" "rpVr=260.3" "rpAD=bfa0e8164934" (131)
  161  13:45:58.368855 IP nslabs-macbook-pro.local.mdns > 224.0.0.251.mdns: 0 [4q] SRV (QM)? HP Color LaserJet M651 [3F3C6F]._ipp._tcp.local. TXT (QM)? HP Color LaserJet M651 [3F3C6F]._ipp._tcp.local. SRV (QM)? ncm._remoted._tcp.local. TXT (QM)? ncm._remoted._tcp.local. (96)
  162  13:45:58.368949 IP6 nslabs-macbook-pro.local.mdns > ff02::fb.mdns: 0 [4q] SRV (QM)? HP Color LaserJet M651 [3F3C6F]._ipp._tcp.local. TXT (QM)? HP Color LaserJet M651 [3F3C6F]._ipp._tcp.local. SRV (QM)? ncm._remoted._tcp.local. TXT (QM)? ncm._remoted._tcp.local. (96)
  163  13:45:58.562134 IP 0.0.0.0.bootpc > broadcasthost.bootps: BOOTP/DHCP, Request from 6a:db:ca:c7:c7:6c (oui Unknown), length 300
  164  13:45:59.252669 IP usertekiiphone.mdns > 224.0.0.251.mdns: 0*- [0q] 1/0/1 (Cache flush) TXT "rpBA=B6:B3:D0:C3:CA:3A" "rpVr=260.3" "rpAD=bfa0e8164934" (131)
  165  13:45:59.252755 IP6 user-teki-iphone.local.mdns > ff02::fb.mdns: 0*- [0q] 1/0/1 (Cache flush) TXT "rpBA=B6:B3:D0:C3:CA:3A" "rpVr=260.3" "rpAD=bfa0e8164934" (131)
  166  13:45:59.253086 IP user-teki-iphone.local.mdns > 224.0.0.251.mdns: 0*- [0q] 1/0/1 (Cache flush) TXT "rpBA=B6:B3:D0:C3:CA:3A" "rpVr=260.3" "rpAD=bfa0e8164934" (131)
  167  13:45:59.253239 IP6 user-teki-iphone.local.mdns > ff02::fb.mdns: 0*- [0q] 1/0/1 (Cache flush) TXT "rpBA=B6:B3:D0:C3:CA:3A" "rpVr=260.3" "rpAD=bfa0e8164934" (131)
  168  13:45:59.253768 IP nslabs-macbook-pro.local.mdns > 224.0.0.251.mdns: 0 TXT (QM)? user M-gM-^ZM-^D iPhone._rdlink._tcp.local. (52)
  169  13:45:59.253775 IP6 nslabs-macbook-pro.local.mdns > ff02::fb.mdns: 0 TXT (QM)? user M-gM-^ZM-^D iPhone._rdlink._tcp.local. (52)
  170  13:46:01.260214 IP usertekiiphone.mdns > 224.0.0.251.mdns: 0*- [0q] 1/0/1 (Cache flush) TXT "rpBA=B6:B3:D0:C3:CA:3A" "rpVr=260.3" "rpAD=bfa0e8164934" (131)
  171  13:46:01.260927 IP6 user-teki-iphone.local.mdns > ff02::fb.mdns: 0*- [0q] 1/0/1 (Cache flush) TXT "rpBA=B6:B3:D0:C3:CA:3A" "rpVr=260.3" "rpAD=bfa0e8164934" (131)
  172  13:46:01.261275 IP user-teki-iphone.local.mdns > 224.0.0.251.mdns: 0*- [0q] 1/0/1 (Cache flush) TXT "rpBA=B6:B3:D0:C3:CA:3A" "rpVr=260.3" "rpAD=bfa0e8164934" (131)
  173  13:46:01.261479 IP6 user-teki-iphone.local.mdns > ff02::fb.mdns: 0*- [0q] 1/0/1 (Cache flush) TXT "rpBA=B6:B3:D0:C3:CA:3A" "rpVr=260.3" "rpAD=bfa0e8164934" (131)
  174  13:46:05.262000 IP usertekiiphone.mdns > 224.0.0.251.mdns: 0*- [0q] 1/0/1 (Cache flush) TXT "rpBA=B6:B3:D0:C3:CA:3A" "rpVr=260.3" "rpAD=bfa0e8164934" (131)
  175  13:46:05.262518 IP6 user-teki-iphone.local.mdns > ff02::fb.mdns: 0*- [0q] 1/0/1 (Cache flush) TXT "rpBA=B6:B3:D0:C3:CA:3A" "rpVr=260.3" "rpAD=bfa0e8164934" (131)
  176  13:46:05.263733 IP user-teki-iphone.local.mdns > 224.0.0.251.mdns: 0*- [0q] 1/0/1 (Cache flush) TXT "rpBA=B6:B3:D0:C3:CA:3A" "rpVr=260.3" "rpAD=bfa0e8164934" (131)
  177  13:46:05.264047 IP6 user-teki-iphone.local.mdns > ff02::fb.mdns: 0*- [0q] 1/0/1 (Cache flush) TXT "rpBA=B6:B3:D0:C3:CA:3A" "rpVr=260.3" "rpAD=bfa0e8164934" (131)
  178  13:46:06.035786 IP 0.0.0.0.bootpc > broadcasthost.bootps: BOOTP/DHCP, Request from 6a:db:ca:c7:c7:6a (oui Unknown), length 300
  179  13:46:07.386586 IP nslabs-macbook-pro.local.mdns > 224.0.0.251.mdns: 0 [2q] SRV (QM)? ncm._remoted._tcp.local. TXT (QM)? ncm._remoted._tcp.local. (47)
  180  13:46:07.386617 IP6 nslabs-macbook-pro.local.mdns > ff02::fb.mdns: 0 [2q] SRV (QM)? ncm._remoted._tcp.local. TXT (QM)? ncm._remoted._tcp.local. (47)
  181  13:46:07.446476 IP 0.0.0.0.bootpc > broadcasthost.bootps: BOOTP/DHCP, Request from 6a:db:ca:c7:c7:6c (oui Unknown), length 300
  182  13:46:14.345958 IP 0.0.0.0.bootpc > broadcasthost.bootps: BOOTP/DHCP, Request from 6a:db:ca:c7:c7:6a (oui Unknown), length 300
  183  13:46:15.531637 IP 0.0.0.0.bootpc > broadcasthost.bootps: BOOTP/DHCP, Request from 6a:db:ca:c7:c7:6c (oui Unknown), length 300
  184  13:46:16.206863 IP nslabs-macbook-pro.local.mdns > 224.0.0.251.mdns: 0 [2q] SRV (QU)? ncm._remoted._tcp.local. TXT (QU)? ncm._remoted._tcp.local. (47)
  185  13:46:16.206975 IP6 nslabs-macbook-pro.local.mdns > ff02::fb.mdns: 0 [2q] SRV (QU)? ncm._remoted._tcp.local. TXT (QU)? ncm._remoted._tcp.local. (47)
  186  13:46:17.208489 IP nslabs-macbook-pro.local.mdns > 224.0.0.251.mdns: 0 [2q] SRV (QM)? ncm._remoted._tcp.local. TXT (QM)? ncm._remoted._tcp.local. (47)
  187  13:46:17.208496 IP6 nslabs-macbook-pro.local.mdns > ff02::fb.mdns: 0 [2q] SRV (QM)? ncm._remoted._tcp.local. TXT (QM)? ncm._remoted._tcp.local. (47)
  188  13:46:19.056375 IP usertekiiphone.51608 > nslabs-mbp.56756: Flags [.], ack 2057946465, win 4096, length 0
  189  13:46:19.115279 IP nslabs-mbp.56756 > usertekiiphone.51608: Flags [.], ack 1, win 2048, options [nop,nop,TS val 2535098676 ecr 1191019782], length 0
  190  13:46:19.580855 ARP, Reply dlinkrouter is-at f4:8c:eb:9e:9e:db (oui Unknown), length 28
  191  13:46:20.214722 IP nslabs-macbook-pro.local.mdns > 224.0.0.251.mdns: 0 [2q] SRV (QM)? ncm._remoted._tcp.local. TXT (QM)? ncm._remoted._tcp.local. (47)
  192  13:46:20.214728 IP6 nslabs-macbook-pro.local.mdns > ff02::fb.mdns: 0 [2q] SRV (QM)? ncm._remoted._tcp.local. TXT (QM)? ncm._remoted._tcp.local. (47)
  193  13:46:22.912994 IP 0.0.0.0.bootpc > broadcasthost.bootps: BOOTP/DHCP, Request from 6a:db:ca:c7:c7:6a (oui Unknown), length 300
  194  13:46:23.700631 IP 0.0.0.0.bootpc > broadcasthost.bootps: BOOTP/DHCP, Request from 6a:db:ca:c7:c7:6c (oui Unknown), length 300
  195  13:46:25.424239 IP nslabs-macbook-pro.local.mdns > 224.0.0.251.mdns: 0 [4q] SRV (QM)? HP Color LaserJet M651 [3F3C6F]._ipp._tcp.local. TXT (QM)? HP Color LaserJet M651 [3F3C6F]._ipp._tcp.local. SRV (QM)? ncm._remoted._tcp.local. TXT (QM)? ncm._remoted._tcp.local. (96)
  196  13:46:25.424341 IP6 nslabs-macbook-pro.local.mdns > ff02::fb.mdns: 0 [4q] SRV (QM)? HP Color LaserJet M651 [3F3C6F]._ipp._tcp.local. TXT (QM)? HP Color LaserJet M651 [3F3C6F]._ipp._tcp.local. SRV (QM)? ncm._remoted._tcp.local. TXT (QM)? ncm._remoted._tcp.local. (96)
  197  13:46:31.881841 IP 0.0.0.0.bootpc > broadcasthost.bootps: BOOTP/DHCP, Request from 6a:db:ca:c7:c7:6a (oui Unknown), length 300
  198  13:46:32.034154 IP 0.0.0.0.bootpc > broadcasthost.bootps: BOOTP/DHCP, Request from 6a:db:ca:c7:c7:6c (oui Unknown), length 300
  199  13:46:34.762313 IP6 fe80::686e:b1ff:fe33:996a.mdns > ff02::fb.mdns: 0*- [0q] 1/0/0 PTR a78c91d2392e._airdrop._tcp.local. (58)
  200  13:46:35.845841 IP6 fe80::686e:b1ff:fe33:996a.mdns > ff02::fb.mdns: 0*- [0q] 4/0/3 (Cache flush) SRV 2cb0c815-1575-469d-99c2-7e1fd383c647.local.:8770 0 0, (Cache flush) TXT "flags=1015", PTR _airdrop._tcp.local., PTR a78c91d2392e._airdrop._tcp.local. (244)
  201  13:46:36.847817 IP6 fe80::686e:b1ff:fe33:996a.mdns > ff02::fb.mdns: 0*- [0q] 4/0/3 (Cache flush) SRV 2cb0c815-1575-469d-99c2-7e1fd383c647.local.:8770 0 0, (Cache flush) TXT "flags=1015", PTR _airdrop._tcp.local., PTR a78c91d2392e._airdrop._tcp.local. (244)
  202  13:46:37.320232 IP nslabs-macbook-pro.local.mdns > 224.0.0.251.mdns: 0 [2q] SRV (QU)? ncm._remoted._tcp.local. TXT (QU)? ncm._remoted._tcp.local. (47)
  203  13:46:37.320294 IP6 nslabs-macbook-pro.local.mdns > ff02::fb.mdns: 0 [2q] SRV (QU)? ncm._remoted._tcp.local. TXT (QU)? ncm._remoted._tcp.local. (47)
  204  13:46:38.323715 IP nslabs-macbook-pro.local.mdns > 224.0.0.251.mdns: 0 [2q] SRV (QM)? ncm._remoted._tcp.local. TXT (QM)? ncm._remoted._tcp.local. (47)
  205  13:46:38.323722 IP6 nslabs-macbook-pro.local.mdns > ff02::fb.mdns: 0 [2q] SRV (QM)? ncm._remoted._tcp.local. TXT (QM)? ncm._remoted._tcp.local. (47)
  206  13:46:38.881029 IP6 fe80::686e:b1ff:fe33:996a.mdns > ff02::fb.mdns: 0*- [0q] 4/0/3 (Cache flush) SRV 2cb0c815-1575-469d-99c2-7e1fd383c647.local.:8770 0 0, (Cache flush) TXT "flags=1015", PTR _airdrop._tcp.local., PTR a78c91d2392e._airdrop._tcp.local. (244)
  207  13:46:40.352799 IP 0.0.0.0.bootpc > broadcasthost.bootps: BOOTP/DHCP, Request from 6a:db:ca:c7:c7:6c (oui Unknown), length 300
  208  13:46:40.764338 IP 0.0.0.0.bootpc > broadcasthost.bootps: BOOTP/DHCP, Request from 6a:db:ca:c7:c7:6a (oui Unknown), length 300
  209  13:46:41.333676 IP nslabs-macbook-pro.local.mdns > 224.0.0.251.mdns: 0 [2q] SRV (QM)? ncm._remoted._tcp.local. TXT (QM)? ncm._remoted._tcp.local. (47)
  210  13:46:41.333739 IP6 nslabs-macbook-pro.local.mdns > ff02::fb.mdns: 0 [2q] SRV (QM)? ncm._remoted._tcp.local. TXT (QM)? ncm._remoted._tcp.local. (47)
  211  13:46:42.886038 IP6 fe80::686e:b1ff:fe33:996a.mdns > ff02::fb.mdns: 0*- [0q] 4/0/3 (Cache flush) SRV 2cb0c815-1575-469d-99c2-7e1fd383c647.local.:8770 0 0, (Cache flush) TXT "flags=1015", PTR _airdrop._tcp.local., PTR a78c91d2392e._airdrop._tcp.local. (244)
  212  13:46:48.683787 IP 0.0.0.0.bootpc > broadcasthost.bootps: BOOTP/DHCP, Request from 6a:db:ca:c7:c7:6c (oui Unknown), length 300
  213  13:46:49.404709 IP nslabs-macbook-pro.local.58272 > 239.255.255.250.ssdp: UDP, length 174
  214  13:46:49.463389 IP 0.0.0.0.bootpc > broadcasthost.bootps: BOOTP/DHCP, Request from 6a:db:ca:c7:c7:6a (oui Unknown), length 300
  215  13:46:50.351803 IP nslabs-macbook-pro.local.mdns > 224.0.0.251.mdns: 0 [2q] SRV (QM)? ncm._remoted._tcp.local. TXT (QM)? ncm._remoted._tcp.local. (47)
  216  13:46:50.351813 IP6 nslabs-macbook-pro.local.mdns > ff02::fb.mdns: 0 [2q] SRV (QM)? ncm._remoted._tcp.local. TXT (QM)? ncm._remoted._tcp.local. (47)
